,Article,Date,Symbol,Time,Title,Url
117,"   By Jonathan Stempel and Sarah N. Lynch  The former chief of a financial services firm owned by Live Nation Entertainment Inc, who was previously accused of embezzling from former heavyweight boxing champion Mike Tyson, was charged by the U.S. Securities and Exchange Commission with stealing $670,000 from clients.Brian Ourand, 53, the former president of SFX Financial Advisory Management Enterprises, was charged on Monday with fraud for having written checks and initiated wire transfers from client accounts for his own benefit from 2006 to 2011.In bringing administrative proceedings against the Miami resident, the SEC did not identify which clients were defrauded.It said SFX, a Washington-based firm that serves current and former professional athletes, fired Ourand after Chief Compliance Officer Eugene Mason learned in July 2011 that Ourand had misappropriated assets after a client complained he could not use one of his credit cards. SFX and Mason agreed to pay $150,000 and $25,000, respectively, to settle related SEC charges, including that SFX failed to properly supervise Ourand and that Mason did not properly monitor client cash.Ourand could not immediately be reached. A lawyer for SFX and Mason declined to comment immediately. In February 2013, Tyson sued Ourand, SFX and Live Nation for $5 million in Los Angeles Superior Court.He alleged that Ourand stole more than $300,000 from him, a theft discovered in July 2011, and that Ourand's misconduct delayed his emergence from bankruptcy and forced him to give up lucrative business opportunities. Tyson said he and his wife Lakiha had once trusted Ourand so much that he attended their wedding.According to Tyson's lawsuit, Ourand's other clients at SFX included former National Basketball Association stars Juwan Howard, Allen Iverson and Dikembe Mutombo.A lawyer for Tyson was not immediately available to comment.",2015-06-15,TSN,"Mon Jun 15, 2015 | 3:53pm EDT",SEC charges ex-Mike Tyson financial adviser with fraud,http://www.reuters.com//article/sec-livenation-sfx-theft-idUSL1N0Z11ZK20150615?type=companyNews
118,"   By Jonathan Stempel and Sarah N. Lynch  The former chief of a financial services firm owned by Live Nation Entertainment Inc, who was previously accused of embezzling from former heavyweight boxing champion Mike Tyson, was charged by the U.S. Securities and Exchange Commission with stealing $670,000 from clients.Brian Ourand, 53, the former president of SFX Financial Advisory Management Enterprises, was charged on Monday with fraud for having written checks and initiated wire transfers from client accounts for his own benefit from 2006 to 2011.In bringing administrative proceedings against the Miami resident, the SEC did not identify which clients were defrauded.It said SFX, a Washington-based firm that serves current and former professional athletes, fired Ourand after Chief Compliance Officer Eugene Mason learned in July 2011 that Ourand had misappropriated assets after a client complained he could not use one of his credit cards. SFX and Mason agreed to pay $150,000 and $25,000, respectively, to settle related SEC charges, including that SFX failed to properly supervise Ourand and that Mason did not properly monitor client cash.Ourand could not immediately be reached. A lawyer for SFX and Mason declined to comment immediately.In February 2013, Tyson sued Ourand, SFX and Live Nation for $5 million in Los Angeles Superior Court. He alleged that Ourand stole more than $300,000 from him, a theft discovered in July 2011, and that Ourand's misconduct delayed his emergence from bankruptcy and forced him to give up lucrative business opportunities.Tyson said he and his wife Lakiha had once trusted Ourand so much that he attended their wedding. According to Tyson's lawsuit, Ourand's other clients at SFX included former National Basketball Association stars Juwan Howard, Allen Iverson and Dikembe Mutombo.A lawyer for Tyson was not immediately available to comment. (Reporting by Jonathan Stempel in New York and Sarah N. Lynch in Washington; Editing by Jonathan Oatis)",2015-06-15,TSN,"Mon Jun 15, 2015 | 3:45pm EDT",SEC charges ex-Mike Tyson financial adviser with fraud,http://www.reuters.com//article/us-sec-livenation-sfx-theft-idUSKBN0OV2K020150615?type=companyNews
119,"  (Adds details, Mike Tyson, bylines)By Jonathan Stempel and Sarah N. LynchJune 15 The former chief of a financial services firm owned by Live Nation Entertainment Inc, who was previously accused of embezzling from former heavyweight boxing champion Mike Tyson, was charged by the U.S. Securities and Exchange Commission with stealing $670,000 from clients.Brian Ourand, 53, the former president of SFX Financial Advisory Management Enterprises, was charged on Monday with fraud for having written checks and initiated wire transfers from client accounts for his own benefit from 2006 to 2011.In bringing administrative proceedings against the Miami resident, the SEC did not identify which clients were defrauded. It said SFX, a Washington-based firm that serves current and former professional athletes, fired Ourand after Chief Compliance Officer Eugene Mason learned in July 2011 that Ourand had misappropriated assets after a client complained he could not use one of his credit cards.SFX and Mason agreed to pay $150,000 and $25,000, respectively, to settle related SEC charges, including that SFX failed to properly supervise Ourand and that Mason did not properly monitor client cash. Ourand could not immediately be reached. A lawyer for SFX and Mason declined to comment immediately.In February 2013, Tyson sued Ourand, SFX and Live Nation for $5 million in Los Angeles Superior Court. He alleged that Ourand stole more than $300,000 from him, a theft discovered in July 2011, and that Ourand's misconduct delayed his emergence from bankruptcy and forced him to give up lucrative business opportunities.Tyson said he and his wife Lakiha had once trusted Ourand so much that he attended their wedding.According to Tyson's lawsuit, Ourand's other clients at SFX included former National Basketball Association stars Juwan Howard, Allen Iverson and Dikembe Mutombo.A lawyer for Tyson was not immediately available to comment.   (Reporting by Jonathan Stempel in New York and Sarah N. Lynch in Washington; Editing by Jonathan Oatis)",2015-06-15,TSN,"Mon Jun 15, 2015 | 3:44pm EDT",UPDATE 1-SEC charges ex-Mike Tyson financial adviser with fraud,http://www.reuters.com//article/sec-livenation-sfx-theft-idUSL1N0Z11MU20150615?type=companyNews
120,"   By Jonathan Stempel and Sarah N. Lynch  The former chief of a financial services firm owned by Live Nation Entertainment Inc, who was previously accused of embezzling from former heavyweight boxing champion Mike Tyson, was charged by the U.S. Securities and Exchange Commission with stealing $670,000 from clients.Brian Ourand, 53, the former president of SFX Financial Advisory Management Enterprises, was charged on Monday with fraud for having written checks and initiated wire transfers from client accounts for his own benefit from 2006 to 2011.In bringing administrative proceedings against the Miami resident, the SEC did not identify which clients were defrauded.It said SFX, a Washington-based firm that serves current and former professional athletes, fired Ourand after Chief Compliance Officer Eugene Mason learned in July 2011 that Ourand had misappropriated assets after a client complained he could not use one of his credit cards. SFX and Mason agreed to pay $150,000 and $25,000, respectively, to settle related SEC charges, including that SFX failed to properly supervise Ourand and that Mason did not properly monitor client cash.Ourand could not immediately be reached. A lawyer for SFX and Mason declined to comment immediately. In February 2013, Tyson sued Ourand, SFX and Live Nation for $5 million in Los Angeles Superior Court.He alleged that Ourand stole more than $300,000 from him, a theft discovered in July 2011, and that Ourand's misconduct delayed his emergence from bankruptcy and forced him to give up lucrative business opportunities. Tyson said he and his wife Lakiha had once trusted Ourand so much that he attended their wedding.According to Tyson's lawsuit, Ourand's other clients at SFX included former National Basketball Association stars Juwan Howard, Allen Iverson and Dikembe Mutombo.A lawyer for Tyson was not immediately available to comment.",2015-06-16,TSN,"Mon Jun 15, 2015 | 8:37pm EDT",SEC charges ex-Mike Tyson financial adviser with fraud,http://www.reuters.com//article/us-sec-livenation-sfx-theft-idUSKBN0OV2K020150616?type=companyNews
121,"   By Sruthi Ramakrishnan  Tyson Foods Inc (TSN.N), the biggest U.S. meat processor, cut its full-year profit forecast after posting its slowest sales growth in nine quarters as customers overseas refused to accept shipments delayed by West Coast port disruptions.During the disruptions, Asian buyers were importing meat from other countries and were overwhelmed with supply after the port issues ended in February, Tyson Chief Executive Donnie Smith said on a call on Monday.Tyson was forced to cut prices and take a hit to margins in the third quarter to clear ""significant"" inventory, said Smith, adding that conditions had not improved much so far in the current quarter.The company's shares, which have been trading at record highs over the past month, fell nearly 11 percent.Tyson reported a lower-than-expected profit for the April to June quarter due to losses in its beef business, its biggest by sales and worth about 24 percent of operating profit last year. Beef sales volumes fell 3.9 percent in the quarter and the business posted an operating loss of $7 million, also hurt by low cattle supply.Tyson's total sales rose 4 percent to $10.07 billion in the quarter. The company's sales have grown more than 10 percent in the past four quarters, helped by record high beef prices as the U.S. cattle population fell due to years of drought.But the high domestic prices, low cattle supply and a strong dollar hurt exports. U.S. beef exports declined 14.4 percent in May and will likely remain constrained, the U.S. Department of Agriculture said last month. (bit.ly/1Dksc7O) Smith said U.S. beef supplies will remain tight until the second half of 2016.Springdale, Arkansas-based Tyson cut its full-year adjusted earnings forecast to $3.10-$3.20 per share from $3.30-$3.40.Net income attributable to Tyson rose 32 percent to $343 million, or 83 cents per share, in the third quarter. Excluding items, it earned 80 cents per share, well below analysts average estimate of 92 cents, according to Thomson Reuters I/B/E/S.Analysts were expecting revenue of $10.3 billion.Tyson's shares were down 9.5 percent at $40.08 in midday trading, recovering slightly from a session low of $39.61. (Additional reporting by Ramkumar Iyer in Bengaluru and Tom Polansek in Chicago; Editing by Don Sebastian and Savio D'Souza)",2015-08-03,TSN,"Mon Aug 3, 2015 | 12:40pm EDT",Tyson sales growth slows as port disruptions hit beef exports,http://www.reuters.com//article/us-tyson-foods-results-idUSKCN0Q819B20150803?type=companyNews
122,"  Aug 3 Tyson Foods Inc, the biggest U.S. meat processor, warned it may not be able to achieve its profit forecast for the year ending September due to export disruptions in its beef business and high cattle costs.Tyson's shares were down 7.6 percent premarket on Monday. The company had previously forecast full-year profit of $3.30-$3.40 per share. For the third quarter, Tyson reported a 4 percent rise in sales to $10.07 billion, helped by higher sales of chicken and prepared foods.  Net income attributable to the company rose to $343 million, or 83 cents per share in the quarter ended June 27, from $260 million, or 73 cents per share, a year earlier.    (Reporting by Sruthi Ramakrishnan in Bengaluru; Editing by Saumyadeb Chakrabarty)",2015-08-03,TSN,"Mon Aug 3, 2015 | 7:49am EDT",Tyson Foods warns full-year profit may fall short of forecast,http://www.reuters.com//article/tyson-foods-results-idUSL3N10E3N020150803?type=companyNews
123,"  (Adds comment from Tyson Foods, paragraph 6)Aug 14 Tyson Foods Inc on Friday said it is permanently ceasing beef production at its plant in Denison, Iowa, effective immediately, as cattle ranchers work to rebuild shrunken herds following the severe Midwestern drought.The move by Tyson, the biggest U.S. meat processor, will affect 400 employees at the plant, which will continue by-product rendering operations with about 20 workers.Such closures are becoming more common since fewer cattle are available for slaughter due to several years of drought that hurt feed crops and forced ranchers to trim their herds.""The cattle supply is tight and there's an excess of beef production capacity in the region,"" Steve Stouffer, president of Tyson Fresh Meats, said in a statement. Tyson's Denison plant has a daily estimated slaughter capacity of about 2,000 head of cattle over a five-day work week, which represent 2 percent of U.S. steer and heifer slaughter capacity, according to industry experts.""While we won't share what percentage of our total production comes from Denison, we can tell you it's our smallest beef plant,"" Gary Mickelson, a spokesman for the company said. Animals that will no longer be processed at the plant likely will be transferred to Tyson's other nearby locations, including the newly expanded facility in Dakota City, Nebraska. That plant has an estimated daily kill capacity of 6,000 head, the experts said.Last year, the U.S. cattle herd sank to its lowest level since 1951 at roughly 89 million head based on the government's Jan. 1 inventory report. The U.S. Department of Agriculture's semi-annual cattle report confirmed a turnaround in U.S. cattle herd size. As of July 1 it stood at 98.4 million head, up 2 percent from a year ago, thanks to cheaper feed and healthy grazing pastures.The 400 affected Denison plant workers will have opportunities to apply for jobs at other Tyson plants, the company said.Cargill Inc, one of the country's largest beef processors, on July 30 announced the closure of its Milwaukee, Wisconsin, beef-processing plant due to cattle shortages.Shares of Tyson closed up 0.5 percent at $42.50 on the News York Stock Exchange.   (Reporting by Ramkumar Iyer and Ankush Sharma in Bengaluru, Theopolis Waters in Chicago and Lisa Baertlein in Los Angeles; Editing by Sriraj Kalluvila and Bernards Orr)",2015-08-14,TSN,"Fri Aug 14, 2015 | 7:11pm EDT",UPDATE 2-Tyson cuts beef production due to cattle shortage,http://www.reuters.com//article/tyson-foods-redundancies-idUSL3N10P5BV20150814?type=companyNews
124,"  Aug 14 Tyson Foods Inc said it will cut beef production capacity due to a shortage of cattle and will close beef operations at its plant in Denison, Iowa, effective Friday.Tyson said on Friday the 400 affected workers will be able to apply for jobs at other locations in the company.  ""The cattle supply is tight and there's an excess of beef production capacity in the region,"" said Steve Stouffer, president of Tyson Fresh Meats.    (Reporting by Ramkumar Iyer in Bengaluru; Editing by Sriraj Kalluvila) ",2015-08-14,TSN,"Fri Aug 14, 2015 | 12:13pm EDT",Tyson to cut beef production due to cattle shortage,http://www.reuters.com//article/tyson-foods-redundancies-idUSL3N10P55220150814?type=companyNews
125,"  (Adds Tyson statement)By Jonathan StempelAug 26 Tyson Foods Inc, one of the world's largest meat processors, on Wednesday won the reversal of nearly $24 million of damage awards in two class action lawsuits claiming it cheated thousands of hourly workers in two Nebraska plants out of wages.The 8th U.S. Circuit Court of Appeals in St. Louis overturned an $18.77 million award to workers at a Madison, Nebraska pork processing plant after a non-jury trial.It also threw out a $4.96 million award concerning a Dakota City, Nebraska beef processing plant, following a jury trial. Two-thirds of that sum went to workers and the rest to the state. Workers accused Tyson of failing to pay them properly for ""K-code time,"" representing pre- and post-shift activities such as putting on and taking off required clothing; cleaning and maintaining equipment; and walking to and from the production line, lockers and wash stations.Writing for a three-judge appeals court panel, Circuit Judge Steven Colloton found insufficient evidence of an agreement for Tyson to pay wages sought by the Madison workers, and no evidence of such an agreement for the Dakota City workers. He said the district court misinterpreted the Nebraska Wage Payment and Collection Act, which lets workers sue for unpaid wages. As a result, Colloton said the Tyson workers' claims failed as a matter of law.A lawyer for workers in both lawsuits did not immediately respond to requests for comment. Tyson spokesman Gary Mickelson said the Springdale, Arkansas-based company is pleased with the decisions.""We continue to believe we're paying our people appropriately and, like other businesses, have strived to comply with federal wage and hour laws that are not precise in describing what activities should be compensated,"" he said.Tyson is appealing to the U.S. Supreme Court a $5.8 million award in a wage dispute at a Storm Lake, Iowa pork processing plant. That case could give the nine justices a chance to curb class actions. A decision is expected by next June.The cases are Gomez et al v. Tyson Foods Inc, 8th U.S. Circuit Court of Appeals, No. 13-3500; and Acosta et al v. Tyson Foods Inc in the same court, No. 14-1582.   (Reporting by Jonathan Stempel in New York; Editing by Marguerita Choy and Alan Crosby)",2015-08-26,TSN,"Wed Aug 26, 2015 | 4:34pm EDT",UPDATE 1-Tyson Foods wins reversal of damages in Nebraska wage lawsuits,http://www.reuters.com//article/tysonfoods-lawsuits-idUSL1N1112A020150826?type=companyNews
126,"   By Jonathan Stempel  Tyson Foods Inc, one of the world's largest meat processors, on Wednesday won the reversal of nearly $24 million of damage awards in two class action lawsuits claiming it cheated thousands of hourly workers in two Nebraska plants out of wages.The 8th U.S. Circuit Court of Appeals in St. Louis overturned an $18.77 million award to workers at a Madison, Nebraska pork processing plant after a non-jury trial.It also threw out a $4.96 million award concerning a Dakota City, Nebraska beef processing plant, following a jury trial. Two-thirds of that sum went to workers and the rest to the state. Workers accused Tyson of failing to pay them properly for ""K-code time,"" representing pre- and post-shift activities such as putting on and taking off required clothing; cleaning and maintaining equipment; and walking to and from the production line, lockers and wash stations.Writing for a three-judge appeals court panel, Circuit Judge Steven Colloton found insufficient evidence of an agreement for Tyson to pay wages sought by the Madison workers, and no evidence of such an agreement for the Dakota City workers. He said the district court misinterpreted the Nebraska Wage Payment and Collection Act, which lets workers sue for unpaid wages. As a result, Colloton said the Tyson workers' claims failed as a matter of law. A lawyer for workers in both lawsuits did not immediately respond to requests for comment. A spokesman for Tyson had no immediate comment. The company is based in Springdale, Arkansas.Tyson is appealing to the U.S. Supreme Court a $5.8 million award in a wage dispute at a Storm Lake, Iowa pork processing plant. That case could give the nine justices a chance to curb class actions. A decision is expected by next June.The cases are Gomez et al v. Tyson Foods Inc, 8th U.S. Circuit Court of Appeals, No. 13-3500; and Acosta et al v Tyson Foods Inc in the same court, No. 14-1582.",2015-08-26,TSN,"Wed Aug 26, 2015 | 1:57pm EDT",Tyson Foods wins reversal of damages in Nebraska wage lawsuits,http://www.reuters.com//article/tysonfoods-lawsuits-idUSL1N1111N820150826?type=companyNews
127,"   By Jonathan Stempel  Tyson Foods Inc, one of the world's largest meat processors, on Wednesday won the reversal of nearly $24 million of damage awards in two class action lawsuits claiming it cheated thousands of hourly workers in two Nebraska plants out of wages.The 8th U.S. Circuit Court of Appeals in St. Louis overturned an $18.77 million award to workers at a Madison, Nebraska pork processing plant after a non-jury trial.It also threw out a $4.96 million award concerning a Dakota City, Nebraska beef processing plant, following a jury trial. Two-thirds of that sum went to workers and the rest to the state.Workers accused Tyson of failing to pay them properly for ""K-code time,"" representing pre- and post-shift activities such as putting on and taking off required clothing; cleaning and maintaining equipment; and walking to and from the production line, lockers and wash stations. Writing for a three-judge appeals court panel, Circuit Judge Steven Colloton found insufficient evidence of an agreement for Tyson to pay wages sought by the Madison workers, and no evidence of such an agreement for the Dakota City workers.He said the district court misinterpreted the Nebraska Wage Payment and Collection Act, which lets workers sue for unpaid wages. As a result, Colloton said the Tyson workers' claims failed as a matter of law. A lawyer for workers in both lawsuits did not immediately respond to requests for comment. A spokesman for Tyson had no immediate comment. The company is based in Springdale, Arkansas.Tyson is appealing to the U.S. Supreme Court a $5.8 million award in a wage dispute at a Storm Lake, Iowa pork processing plant. That case could give the nine justices a chance to curb class actions. A decision is expected by next June. The cases are Gomez et al v. Tyson Foods Inc, 8th U.S. Circuit Court of Appeals, No. 13-3500; and Acosta et al v Tyson Foods Inc in the same court, No. 14-1582. (Reporting by Jonathan Stempel in New York; Editing by Marguerita Choy)",2015-08-26,TSN,"Wed Aug 26, 2015 | 1:37pm EDT",Tyson Foods wins reversal of damages in Nebraska wage lawsuits,http://www.reuters.com//article/us-tysonfoods-lawsuits-idUSKCN0QV23220150826?type=companyNews
128,"   By Jonathan Stempel  Aug 26 Tyson Foods Inc, one of the world's largest meat processors, on Wednesday won the reversal of nearly $24 million of damage awards in two class action lawsuits claiming it cheated thousands of hourly workers in two Nebraska plants out of wages.The 8th U.S. Circuit Court of Appeals in St. Louis overturned an $18.77 million award to workers at a Madison, Nebraska pork processing plant after a non-jury trial.It also threw out a $4.96 million award concerning a Dakota City, Nebraska beef processing plant, following a jury trial. Two-thirds of that sum went to workers and the rest to the state. Workers accused Tyson of failing to pay them properly for ""K-code time,"" representing pre- and post-shift activities such as putting on and taking off required clothing; cleaning and maintaining equipment; and walking to and from the production line, lockers and wash stations.Writing for a three-judge appeals court panel, Circuit Judge Steven Colloton found insufficient evidence of an agreement for Tyson to pay wages sought by the Madison workers, and no evidence of such an agreement for the Dakota City workers. He said the district court misinterpreted the Nebraska Wage Payment and Collection Act, which lets workers sue for unpaid wages. As a result, Colloton said the Tyson workers' claims failed as a matter of law. A lawyer for workers in both lawsuits did not immediately respond to requests for comment. A spokesman for Tyson had no immediate comment. The company is based in Springdale, Arkansas.Tyson is appealing to the U.S. Supreme Court a $5.8 million award in a wage dispute at a Storm Lake, Iowa pork processing plant. That case could give the nine justices a chance to curb class actions. A decision is expected by next June.The cases are Gomez et al v. Tyson Foods Inc, 8th U.S. Circuit Court of Appeals, No. 13-3500; and Acosta et al v Tyson Foods Inc in the same court, No. 14-1582.   (Reporting by Jonathan Stempel in New York; Editing by Marguerita Choy)",2015-08-26,TSN,"Wed Aug 26, 2015 | 1:28pm EDT",Tyson Foods wins reversal of damages in Nebraska wage lawsuits,http://www.reuters.com//article/tysonfoods-lawsuits-idUSL1N1111GX20150826?type=companyNews
