,Article,Date,Symbol,Time,Title,Url
77,"  (Updates Oi SA; adds Dow Chemical, Tyson and others)Aug 27 The following bids, mergers, acquisitions and disposals were reported by 2000 GMT on Wednesday:** Brazil's Grupo Oi SA unveiled plans to take over Telecom Italia's local mobile unit, in a move sources said was aimed at breaking up the country's second-biggest wireless carrier and upstaging merger bids by foreign rivals.Oi said it hired Brazilian investment bank and shareholder Grupo BTG Pactual SA to explore alternatives to acquire Telecom Italia SpA's 67 percent stake in TIM Participações SA, the country's second-biggest wireless carrier.** Dow Chemical Co has kicked off a processes to sell two of its specialty chemical subsidiaries that could fetch close to $2 billion combined, according to people familiar with the matter, part of its effort to divest several billion dollars worth of non-core assets by 2015.** HSBC Holdings Plc and two Indian investment banks will manage the Indian government's planned stake sale in hydropower producer NHPC Ltd, two sources with direct knowledge of the deal said on Wednesday.IDFC Capital Ltd and Edelweiss Financial Services Ltd are the other two advisors for the sale of an 11.36 percent government stake in NHPC. The stake is worth about $436 million at the current market price.** Tyson Foods Inc, the largest U.S. meat processor, won U.S. antitrust approval for its purchase of Hillshire Brands Co, the U.S. Justice Department said.** A former chief executive of major Dubai construction firm Arabtec said he was in talks to sell a part of his stake to Abu Dhabi's Aabar Investments and wanted over 5 dirhams per share, about 4 percent above the current market price.** Private equity firm Terra Firma Capital Partners  is looking to sell the Garden Centre Group two years after buying the business, Bloomberg reported on Wednesday, citing people familiar with the matter.Terra Firma has held talks with potential advisers about a sale or a public floatation, which could value the company at up to 700 million pounds ($1.16 billion), Bloomberg said.** Ratan Tata, the former chairman of India's salt-to-steel Tata conglomerate, has bought a stake in Indian online retailer Snapdeal, the company said, joining a list of funds who have invested in the country's growing e-commerce industry.Snapdeal did not give the size or financial details of the deal. ** German property company IVG Immobilien is planning a new attempt to sell The Squaire, the office and hotel building perched on top of the train station at Frankfurt airport, a source familiar with the process told Reuters.According to the most recent figures available, The Squaire had a book value of 800 million euros ($1.06 billion), against building costs of over 1 billion euros in the company's 2012 accounts.** Juice maker Cutrale and investment firm Safra Group questioned a decision by Chiquita Brands International Inc's  board to reject their $611 million takeover bid in favor of a merger with Ireland's Fyffes Plc, saying the move will destroy shareholder value and face unnecessary headwinds.** The board of Spain's Telefonica is set to meet to decide on an improved offer for Vivendi's Brazilian broadband unit GVT, a source familiar with the situation said, potentially topping an expected 7 billion euro ($9.2 billion) offer from Telecom Italia.** Royal Dutch Shell PLC has sold some of the four oil fields up for grabs in Nigeria, it said, as the oil and gas company pushes ahead with global asset sales to cut costs. No details were available on the value of the deals signed, nor when the full process will be completed.** Ryanair Holdings PLC has moved a step closer to making an offer to buy Cyprus Airways and may make a firm offer early next year if this is approved by the Cypriot government.** Allergan Inc said on Tuesday that it has scheduled a special shareholders meeting for Dec. 18, when activist investor Bill Ackman, who supports a hostile bid for the company by Valeant Pharmaceuticals Inc, will attempt to oust most of its board. ** Venture capital firm Kleiner Perkins Caufield & Byer has agreed to invest in fast-growing messaging startup Snapchat at a valuation close to $10 billion, the Wall Street Journal reported on Tuesday, citing people with knowledge of the matter.** Vietnam Airlines is in talks with several partners to sell a 20 percent stake after it launches an initial public offering to raise 1.5 trillion dong ($70 million) later this year, ahead of a stock listing that could be overseas, it said on Wednesday.** Global private equity firm Carlyle Group is in advanced talks with China Vanke Co Ltd, the country's largest property developer, to buy stakes in nine of its shopping malls, two people with direct knowledge of the matter told Reuters. One source said the deal was valued at between 6-7 billion yuan ($976 million to $1.14 billion), while the other said it could be worth up to 10 billion yuan.** Spanish energy company Repsol SA's talks to buy Canadian producer Talisman Energy Inc are in difficulty, three sources familiar with the matter said, with Talisman's North Sea assets the stumbling block.** A former chief executive of Dubai construction firm Arabtec said he was in talks on selling some of his stake to Abu Dhabi's Aabar Investments and wanted over 5 dirhams per share, a level that is about 4 percent above the current market price. Hasan Ismaik said he was in talks with Aabar to sell part of his 27.90 percent stake. ** New Zealand's Fonterra Cooperative Group Ltd  said it will take a stake in China's biggest baby food and formula maker Beingmate Baby and Child Food Co. Ltd  in the dairy giant's first tie-up with a Chinese processor since its involvement in a tainted infant formula scandal in 2008.** China's privately-held Dalian Wanda Group is set to launch a 5 billion yuan ($813 million) e-commerce joint venture with domestic internet giants Tencent Holdings Ltd and Baidu Inc, according to two sources familiar with the investment.** Shareholders of South Korean internet portal operator Daum Communications Corp and messaging application firm Kakao Corp approved an all-stock merger between the two firms, paving the way for a back-door listing that values Kakao at over $3 billion.** Norwegian IT outsourcer Evry ASA, which serves banks and other data-heavy clients, is considering whether to find a buyer for the whole firm, its board said, sending the shares up to a three-year high.** Chiquita Brands International on Wednesday re-affirmed its commitment to a merger with Irish tropical fruit company Fyffes Plc and said it expected the deal to yield cost synergies of $60 million.** Taiwan's Cathay Financial Holding Co is in talks to acquire a 20 percent stake in medium-sized Philippine lender Rizal Commercial Banking Corp amid plans to expand in Southeast Asia, people with knowledge of the discussions said. The stake could be worth around 14.3 billion pesos ($327 million) at the current share price.** Singapore's Oversea-Chinese Banking Corporation (OCBC)  and its insurance arm Great Eastern Holdings  said they are in exclusive talks with a company controlled by Thai billionaire Charoen Sirivadhanabhakdi to sell their stake in United Engineers Ltd.** Brazil's state-run power utility Eletrobras  said on Tuesday it agreed to buy a 51 percent stake in power distributor Celg Distribuição for 59.5 million reais ($26.3 million).** Poland's Alior Bank SA is selling its wholly owned drugstore chain Polbita to drug distributor Pelion SA  for an undisclosed sum.** As hopes for a last-minute buyer dim, Atlantic City's Revel casino has laid out its closure plans, from disposing of opened bottles of alcohol to cashing unredeemed poker chips. The plans, detailed in court documents, will go into effect on Sunday, marking the end of a $2.4 billion hotel-casino.($1 = 0.76 euro)  ($1 = 6.14 Chinese yuan)  ($1 = 43.69 Philippine peso)  (1 US dollar = 0.6033 British pound)   (Compiled by Manya Venkatesh and Mridhula Raghavan in Bangalore)",2014-08-27,TSN,"Wed Aug 27, 2014 | 4:11pm EDT",Deals of the day- Mergers and acquisitions,http://www.reuters.com//article/deals-day-idUSL3N0QX37720140827?type=companyNews
78,"  WASHINGTON Tyson Foods Inc has won U.S. antitrust approval for its purchase of Hillshire Brands Company, the Justice Department said on Wednesday.The companies agreed to sell Heinold Hog Markets to win approval for the $8.5 billion deal, the department said.    (Reporting by Diane Bartz; Editing by Sandra Maler)",2014-08-27,TSN,"Wed Aug 27, 2014 | 3:00pm EDT",Tyson wins U.S. antitrust approval of Hillshire deal: U.S. Justice Department,http://www.reuters.com//article/us-hillshire-brands-tyson-foods-antitrus-idUSKBN0GR21V20140827?type=companyNews
79,"  WASHINGTON Aug 27 Tyson Foods Inc has won U.S. antitrust approval for its purchase of Hillshire Brands Company, the Justice Department said on Wednesday. The companies agreed to sell Heinold Hog Markets to win approval for the $8.5 billion deal, the department said.   (Reporting by Diane Bartz; Editing by Sandra Maler)  ",2014-08-27,TSN,"Wed Aug 27, 2014 | 2:26pm EDT",Tyson wins U.S. antitrust approval of Hillshire deal - U.S. Justice Dept,http://www.reuters.com//article/hillshire-brands-tyson-foods-antitrust-idUSL1N0QX1W820140827?type=companyNews
80,"   By Diane Bartz | WASHINGTON  WASHINGTON Tyson Foods Inc (TSN.N), the largest U.S. meat processor, on Wednesday won U.S. antitrust approval for its $8.5 billion purchase of Hillshire Brands Co HSH.N. To win approval for the merger, the companies agreed to sell Heinold Hog Markets, the U.S. Department of Justice said. The attorneys general of Iowa, Illinois and Missouri, all big hog-producing states, joined the settlement. ""Today's proposed settlement will help ensure that hog breeders in the United States will continue to receive the benefits of vigorous competition when selling sows,"" said Bill Baer, assistant attorney general for DOJ's antitrust division.The two companies combined buy about 35 percent of all sows sold in the United States. Tyson's share price rallied on the approval, rising as much as 2 percent before closing at $37.71, up 1.5 percent. Hillshire closed near steady at $62.96. But about 10 minutes before the Justice Department announced the deal, the share prices of both companies dropped sharply and there was a large increase in stock and options volume, suggesting that traders were bracing for bad news. Trading volume for Hillshire totaled 8.07 million shares, compared with the 50-day average of 2.54 million; of the total,  trading volume, almost 5.5 million came several minutes before and after the DOJ's release, according to Reuters data.     Springdale, Arkansas-based Tyson is a massive seller of chicken, beef and pork while Chicago's Hillshire sells packaged meat brands such as Jimmy Dean, Ball Park and State Fair as well as bakery products like Sara Lee. The companies overlap in the business of buying sows when they are too old to breed, the Justice Department said. Heinold Hog Markets, which had revenues of $270 million and has operations in Illinois, Iowa, Indiana, Michigan, Minnesota and Nebraska, buys the animals from farmers and resells them to manufacturers. Hillshire buys them to make sausage for its Jimmy Dean and Hillshire Farm brands. ""Although the sale of sows constitutes a small percentage of overall revenues, farmers rely on this source of income as an important contribution to their earnings,"" the Justice Department said in a competitive impact statement filed with the U.S. District Court for the District of Columbia.That court must approve the proposed settlement. The deal had came under fire from some farm, consumer and rural organizations, as well as lawmakers like Senator Charles Grassley of Iowa, who worried that a larger Tyson will have power to push down the prices paid to hog farmers and drive up the prices paid by consumers at the grocery store.""Because Tyson can align its pork slaughter business with Hillshire’s branded processing business, Hillshire products will have a leg up on competitors, who will likely have to raise prices,"" said Wenonah Hunter, executive director of Food & Water Watch. In a statement, Grassley said that requiring the sale of Heinold showed the Justice Department ""took my concerns into consideration in regard to the slaughter sow market.""  (Reporting by Diane Bartz; Editing by Ros Krasny, Sandra Maler, Lisa Shumaker and Leslie Adler)",2014-08-28,TSN,"Wed Aug 27, 2014 | 8:24pm EDT",Tyson wins U.S. Justice Dept antitrust nod for Hillshire deal,http://www.reuters.com//article/us-hillshire-brands-tyson-foods-antitrus-idUSKBN0GR21420140828?type=companyNews
81,"  MLB Team Report - San Diego Padres - INSIDE PITCHSAN DIEGO -- Tyson Ross won't start as scheduled Thursday against the Philadelphia Phillies, the San Diego Padres making the decision to help preserve his arm.With the move, the right-hander will make a maximum of two starts over the final two weeks of the season.Padres manager Bud Black would not say if it is possible that Ross might be shut down for the rest of the season, but he did hint it is a possibility.In his last two starts, Ross, 27, has allowed nine runs (seven earned) on 12 hits and six walks with 11 strikeouts in 8 2/3 innings. In those two games, his ERA climbed from 2.60 to 2.81.On Saturday in Arizona, Ross gave up six runs (four earned) on five hits and two walks in just three innings -- his shortest outing of the season.""We're going to push Tyson back a few days,"" Black said. ""After his last start, Tyson felt general soreness in his arm. ... He was a little tired. We talked. I didn't think he looked tired. His velocity was OK (topping at 97 mph on his fastball in Arizona). He wasn't as crisp. He's had better command than that. There were indicators.""Tyson has pitched a lot more innings this year than ever before, and in close games. It's a grind. We just came to a decision to give him more time.""Ross has pitched 195 2/3 innings this season. The most he worked previously as a pro was 151 2/3. Had Ross made his final three starts, he would have equaled the most starts by a Padres pitcher since Kevin Brown made 35 starts in 1998.Left-hander Robbie Erlin will make Ross' scheduled start Thursday. Black did not mention a possible date for Ross' next start.----------------------------------------------- MLB Team Report - San Diego Padres - NOTES, QUOTESRECORD: 69-80 STREAK: Won oneNEXT: Phillies (RHP A.J. Burnett, 8-16, 4.34 ERA) at Padres (RHP Ian Kennedy, 10-13, 3.77 ERA)PLAYER NOTES: --RHP Joaquin Benoit will throw a bullpen session Tuesday for what could be the final test of his balky shoulder. If all goes well, the closer could return to action later this week. He has not pitched for the Padres since Aug. 26.--SS Everth Cabrera flew to Arizona to work out with the Padres' prospects involved in the instructional league. Despite two left hamstring injuries and a DUI arrest, Cabrera likely will rejoin the club before the end of the season, Padres manager Bud Black said.--RHP Andrew Cashner's third career shutout Monday night marked the 17th consecutive home start in which he allowed two or fewer runs -- a franchise-record streak that dates back to June 11, 2013. Cashner has a 1.39 ERA during the streak. Over his past 23 starts overall dating back to Aug. 19, 2013, Cashner has a 1.80 ERA. The only major league pitcher with a lower ERA over the span is Dodgers LHP Clayton Kershaw (1.74). Cashner threw a two-hitter Monday, beating the Phillies 1-0.--LHP Robbie Erlin will make his first start since May 17 when he fills in RHP Tyson Ross on Thursday against Philadelphia. Erlin is 3-4 with a 4.63 ERA in 13 starts for the Padres this season. He was placed on the 15-day disabled list with elbow soreness on May 22 and didn't resume pitching until starting a rehab assignment in August. He was recalled from Triple-A El Paso on Sept. 2.--2B Jedd Gyorko went 1-for-3 with a walk Monday night to stretch his season-best hitting streak to six games (8-for-24). In that span, he has two doubles, a homer and three RBIs. He has also hit safely in eight of the past nine games (12-for-35 with four doubles, a homer and five RBIs). While his .208 batting average is still below expectations, it is at its highest since the season started. Gyorko has raised his average 44 points in 43 games since returning from the disabled list July 28. He missed the previous 44 games due to plantar fasciitis.--C Rene Rivera doubled and scored the Padres' lone run Monday night. He is 4-for-10 in a four-game hitting streak with a double, a triple, a home run and five runs. He is hitting .379 (11-for-29) with three doubles, a homer and three RBIs in his past nine games at Petco Park.QUOTE TO NOTE: ""Our guy outpitched their guy. There weren't many pitches that he mis-located. He pitched. He had the slider, the curve and the change. He was low in the zone."" -- Manager Bud Black, on RHP Andrew Cashner, who threw a two-hitter Monday in the Padres' 1-0 win over the Philadelphia Phillies.-----------------------------------------------  MLB Team Report - San Diego Padres - ROSTER REPORTMEDICAL WATCH: --RHP Blaine Boyer (sore right shoulder) did not pitch Sept. 5-15. He played catch Sept. 10.--RHP Joaquin Benoit (right shoulder soreness) did not pitch Aug. 27-Sept. 15. He threw a bullpen session Sept. 14, and he will throw another Sept. 16. There is a chance he could return during the weekend of Sept. 19-21.--SS Everth Cabrera (strained left hamstring) went on the 15-day disabled list retroactive to Aug. 10. A separate left hamstring injury sidelined him for 21 games earlier this season. He will rehab with the Padres' instructional league players in mid-September, and he is expected to return to action before the end of the season.--INF Ryan Jackson (right wrist strain) was called up from Triple-A El Paso and placed on the 60-day disabled list Sept. 2. Jackson was hurt in April.--1B Yonder Alonso (torn right forearm tendon) went on the 15-day disabled list retroactive to Aug. 13, and he was transferred to the 60-day DL on Sept. 1. He will miss the rest of the season, and he might need surgery.--LF Carlos Quentin (left knee soreness) went on the 15-day disabled list retroactive to July 27, and he was transferred to the 60-day DL on Sept. 1. He is likely finished for the season, although a second opinion said he will not need surgery on his left knee.--RHP Casey Kelly (Tommy John surgery in April 2013) went on the 15-day disabled list retroactive to March 21, and he was transferred to the 60-day DL on June 23. He made rehab appearances for Class A Lake Elsinore on May 3 and May 8, then pitched for Double-A San Antonio on May 14 and May 19. He reported soreness after the May 19 start and was shut down.--RHP Josh Johnson (sore flexor pronator muscles in right forearm) went on the 15-day disabled list retroactive to March 21, and he was transferred to the 60-day DL on April 25. He underwent season-ending Tommy John surgery April 24.--LHP Cory Luebke (Tommy John surgery in February 2014) went on the 60-day disabled list March 7. He will miss the entire season. He resumed playing catch in August. ROTATION: RHP Ian KennedyRHP Tyson RossLHP Eric StultsRHP Odrisamer DespaigneRHP Andrew CashnerLHP Robbie ErlinBULLPEN: RHP Joaquin Benoit (closer)LHP Alex TorresRHP Dale ThayerRHP Kevin QuackenbushRHP Blaine Boyer RHP Nick VincentRHP Tim StaufferRHP Jesse HahnRHP Leonel CamposLHP Frank GarcesRHP R.J. AlvarezRHP Joe WielandCATCHERS: Yasmani GrandalRene RiveraAdam MooreINFIELDERS: 1B Tommy Medica2B Jedd GyorkoSS Alexi Amarista3B Yangervis SolarteINF Cory SpangenbergINF/OF Jake GoebbertOUTFIELDERS: LF Seth SmithCF Abraham AlmonteRF Rymer LirianoOF Will VenableOF Cameron Maybin",2014-09-16,TSN,"Tue Sep 16, 2014 | 4:45am EDT",San Diego Padres - TeamReport,http://www.reuters.com//article/bbo-padres-teamreport-idUSMTZEA9GZKCK3I20140916?type=companyNews
82,"   By Lisa Baertlein  Tyson Foods Inc (TSN.N), the largest U.S. meat processor, on Monday forecast 2015 profit that could top Wall Street's view due to record beef prices, lower feed costs and its recent purchase of sausage seller Hillshire Brands.Shares of Tyson, which also reported better-than-expected profit for the latest quarter, were up more than 5 percent at midday.Tight supplies sent average beef prices up 21.5 percent in the latest quarter, while pork was up 16.5 percent, Tyson said.  Trade-down to lower-priced chicken products should continue,  and the recent drop in prices at the gas pump could free up more money for restaurant visits, Chief Executive Officer Donnie Smith told analysts on a conference call.The company, which derives almost 15 percent of sales from Wal-Mart Stores Inc (WMT.N), forecast adjusted profit of $3.30 to $3.40 per share for the fiscal year ending September 2015. Analysts, on average, expected a profit of $3.33 per share. Tyson also forecast 2015 revenue of $42 billion, including an expected $4 billion in revenue from the Hillshire acquisition. Fed cattle supplies are expected to shrink about 4 percent in 2015. Those supplies are forecast to be flat to down about 1 percent in 2016, Smith said.Hog supplies, hard hit by the deadly Porcine Epidemic Diarrhea virus (PEDv) in 2014, are expected to expand 2 to 3 percent this year, Smith said. ""It appears there will be fewer instances of PEDv,"" Smith said. Smith forecast an increase of roughly 3 percent in chicken supplies this fiscal year. Chicken sales were up in the latest quarter, but prices fell 4 percent as feed costs declined.Demand in China, where Tyson's customers include Yum Brands Inc's (YUM.N) KFC restaurant chain, remains weak after a meat scandal involving a major supplier to McDonald's Corp (MCD.N).""China remains in somewhat of a holding pattern,"" Smith said.   Tyson's net income nearly halved to $137 million, or 35 cents per share, for the fiscal fourth quarter ended Sept. 27. Still, earnings excluding acquisition charges and other items came in at 87 cents per share, besting analysts' average estimate of 76 cents, according to Thomson Reuters I/B/E/S.Tyson shares were up 5.3 percent at $42.81 at midday.  (Reporting by Ramkumar Iyer in Bangalore and Lisa Baertlein in Los Angeles; editing by Joyjeet Das and Matthew Lewis)",2014-11-17,TSN,"Mon Nov 17, 2014 | 12:13pm EST","Tyson profit beats expectations, helped by high meat prices",http://www.reuters.com//article/us-tyson-foods-results-idUSKCN0J119Z20141117?type=companyNews
83,"  (Adds details on China demand; U.S. beef prices, updates stock price)By Lisa BaertleinNov 17 Tyson Foods Inc, the largest U.S. meat processor, on Monday forecast 2015 profit that could top Wall Street's view due to record beef prices, lower feed costs and its recent purchase of sausage seller Hillshire Brands.Shares of Tyson, which also reported better-than-expected profit for the latest quarter, were up more than 5 percent at midday.Tight supplies sent average beef prices up 21.5 percent in the latest quarter, while pork was up 16.5 percent, Tyson said.Trade-down to lower-priced chicken products should continue,  and the recent drop in prices at the gas pump could free up more money for restaurant visits, Chief Executive Officer Donnie Smith told analysts on a conference call. The company, which derives almost 15 percent of sales from Wal-Mart Stores Inc, forecast adjusted profit of $3.30 to $3.40 per share for the fiscal year ending September 2015. Analysts, on average, expected a profit of $3.33 per share.Tyson also forecast 2015 revenue of $42 billion, including an expected $4 billion in revenue from the Hillshire acquisition.Fed cattle supplies are expected to shrink about 4 percent in 2015. Those supplies are forecast to be flat to down about 1 percent in 2016, Smith said. Hog supplies, hard hit by the deadly Porcine Epidemic Diarrhea virus (PEDv) in 2014, are expected to expand 2 to 3 percent this year, Smith said.""It appears there will be fewer instances of PEDv,"" Smith said.Smith forecast an increase of roughly 3 percent in chicken supplies this fiscal year. Chicken sales were up in the latest quarter, but prices fell 4 percent as feed costs declined. Demand in China, where Tyson's customers include Yum Brands Inc's KFC restaurant chain, remains weak after a meat scandal involving a major supplier to McDonald's Corp.""China remains in somewhat of a holding pattern,"" Smith said.Tyson's net income nearly halved to $137 million, or 35 cents per share, for the fiscal fourth quarter ended Sept. 27. Still, earnings excluding acquisition charges and other items came in at 87 cents per share, besting analysts' average estimate of 76 cents, according to Thomson Reuters I/B/E/S.Tyson shares were up 5.3 percent at $42.81 at midday.(Reporting by Ramkumar Iyer in Bangalore and Lisa Baertlein in Los Angeles; editing by Joyjeet Das and Matthew Lewis)",2014-11-17,TSN,"Mon Nov 17, 2014 | 12:12pm EST","UPDATE 3-Tyson profit beats expectations, helped by high meat prices",http://www.reuters.com//article/tyson-foods-results-idUSL3N0T74PK20141117?type=companyNews
84,"  (Corrects dateline to Nov. 17)Nov 17 Tyson Foods Inc, the largest U.S. meat processor, said its quarterly profit nearly halved as beef sales fell. Net income attributable fell to $137 million, or 35 cents per share, in the fourth quarter ended Sept. 27, from $261 million, or 70 cents per share, a year earlier.  Revenue rose 13.6 percent to $10.10 billion.   (Reporting by Ramkumar Iyer in Bangalore; Editing by Joyjeet Das)",2014-11-17,TSN,"Mon Nov 17, 2014 | 9:51am EST",REFILE-Tyson Foods profit halves as beef sales fall,http://www.reuters.com//article/tyson-foods-results-idUSL3N0T477I20141117?type=companyNews
