,Article,Date,Symbol,Time,Title,Url
43,"  June 5 Pilgrim's Pride Corp, the second largest U.S. chicken processor, has lined up a number of banks to help finance its offer for Hillshire Brands Co as it escalates its bidding war with Jimmy Dean sausage maker Tyson Foods Inc, according to people familiar with the matter.Pilgrim's Pride, which is majority owned by Brazilian meat processing company JBS S.A., has lined up banks including Barclays PLC, Bank of Montreal, Rabobank and Wells Fargo & Co to finance a potential bid, the people said.  Pilgrim's Pride and the banks declined to comment. The people declined to be named because the matter is private.    (Reporting by Olivia Oran and Mariana Santibanez of IFR in New York; Editing by Chris Reese) ",2014-06-05,TSN,"Thu Jun 5, 2014 | 2:36pm EDT",Pilgrim's Pride lines up banks for Hillshire bid: sources,http://www.reuters.com//article/pilgrims-prid-hillshire-brands-banks-idUSL1N0OM20Z20140605?type=companyNews
44,"  June 6 The following corporate finance-related stories were reported by media:* A consortium of private equity firms led by KKR & Co LP  has agreed to invest about $270 million for a stake of up to 70 percent in COFCO Meat, a subsidiary of China's state-owned COFCO Group, a source with direct knowledge of the matter said.* Deutsche Boerse is considering selling its International Securities Exchange (ISE), a source familiar with the company's thinking said on Thursday.* Pilgrim's Pride Corp, the second largest U.S. chicken processor, has lined up a number of banks to help finance its offer for Hillshire Brands Co as it escalates its bidding war with Jimmy Dean sausage maker Tyson Foods Inc, according to people familiar with the matter. * Video games retailer, Game Digital IPO-GAME.L is to be valued at up to 360 million pounds ($604.47 million) in its London share flotation, sources familiar with the matter told Reuters on Thursday.* Arista Networks Inc shares have been priced at $43 each, the Wall Street Journal said, citing sources, valuing the network switch maker at about $2.75 billion. * Refresco Gerber, a Dutch soft drinks bottler backed by private equity firms including 3i Group, is considering a UK listing that could take place as soon as this year, the Financial Times reported on Thursday, citing four sources. * Britain's Automobile Association (AA) is planning a 4 billion pound ($6.72 billion) stock market flotation that its parent, Acromas Holdings, could announce as early as Friday, Sky News reported on its website.* Private equity firm Everstone Capital is in talks to buy up to 30 percent stake in India's Essel Group company, the Economic Times reported, citing three people with direct knowledge of the development. (link.reuters.com/syp89v)For the deals of the day click onFor the Morning News Call-EMEA newsletter click on    ($1 = 0.5956 British Pounds)   (Compiled by Aastha Agnihotri in Bangalore)",2014-06-06,TSN,"Fri Jun 6, 2014 | 12:20am EDT",Market Chatter- Corporate finance press digest,http://www.reuters.com//article/market-chatter-idUSL3N0ON0XJ20140606?type=companyNews
45,"  (Updates Tyson Foods, Lloyds Banking, Family Dollar; adds all items below Family Dollar)June 9 The following bids, mergers, acquisitions and disposals were reported by 2030 GMT on Monday:** Tyson Foods Inc won the bidding war for Hillshire Brands Co with an all-cash offer that values the maker of Jimmy Dean sausages at $8.55 billion and would be the biggest deal yet for the global meat business.** Credit Suisse is mulling a plan to spin off part of its fixed income business in the United States to help trim costs, according to a report in the Financial Times.** Britain's Lloyds Banking Group has priced the stock market listing of its TSB business at below book value, aiming to attract investors amid a flurry of new issues and make progress on a much-delayed, costly sale.** Gazit-Globe, Israel's largest real estate investment firm, said on Sunday its wholly owned subsidiary ProMed Properties sold five medical office buildings in the United States and is in the final stages of selling another property.** Israeli property developer Azrieli Group said on Sunday it is in talks to sell energy company Sonol Israel to holding company S. Shlomo Holdings.** Saudi International Petrochemical Co (Sipchem) has postponed merger talks with Sahara Petrochemical, it said on Sunday, blaming the current regulatory framework for the collapse of the tie-up.** Microsoft Corp co-founder Bill Gates has sold his entire stake in G4S Plc, the British security firm trying to bounce back from a series of scandals that have hurt its reputation and profits.** Spanish builder Metrovacesa said it agreed to sell its 27 percent stake in French peer Gecina to a group of investors as it unwinds a costly acquisition made during Spain's housing boom in an effort to pay down debt.** Family Dollar Stores Inc adopted a poison pill to buy time to consider any possible deal that activist investor Carl Icahn could push for after becoming its largest shareholder.Icahn told Reuters on Monday that the poison pill is a ""quintessential example"" of attorneys ""simply earning fees"" and that the move ""puts a damper"" on prospects for a ""friendly dialogue"" with Family Dollar executives.** Bank Muscat, the sultanate's largest lender, is considering a sale of its brokerage unit as one of several ""strategic options"" for the business, the bank said. ** Michelin & Cie agreed on Monday to buy Brazilian digital truck-fleet management company Sascar Participações SA for 440 million euros ($600 million) to tap into robust growth in the South American nation's truck industry.** Philippine National Bank may make an aggressive bid for state-owned United Coconut Planters Bank, as the country's fourth-largest listed lender pursues growth through acquisitions, its CEO said.** Swedish management and IT consultancy firm Acando  has made a bid for IT consultancy Connecta, sending Conncta's share price up 21 percent on Monday.The total value of the offer is approximately 480 million Swedish crowns ($72.4 million).** State-owned China Mobile Ltd has agreed to buy an 18 percent stake in Thai telecoms group True Corp  for $881 million, in Thailand's first major corporate deal since the military coup last month.** Private equity firm Nordic Capital said on Monday it had agreed to buy a majority stake in Gina Tricot from the Appelqvist family, the founders of the Swedish clothing retailer who will retain a significant stake in the company. Nordic Capital did not disclose the purchase price nor the size of the stake acquired.** Slovenia will invite investors to submit binding bids for the purchase of its largest telecom operator Telekom  later this week, state investment fund SOD, which is coordinating the sale, said on Monday. Telekom has a market capitalization of 947.6 million euros. ** British hedge fund manager Man Group said on Monday it is buying credit-focused privately held fund of hedge fund firm Pine Grove Asset Management, stepping up a push into the United States. Financial terms of the deal were not disclosed.** Dubai Islamic Bank has completed the acquisition of a 24.9 percent stake in Bank Panin Syariah  and will now seek regulatory approval to increase its holding in the Indonesian lender to 40 percent.** Alitalia needs a few weeks to seal a deal with Etihad which could see the Abu Dhabi airline invest 560 million euros in its struggling Italian peer in return for hefty job cuts, Alitalia chief executive Gabriele del Torchio said.** Israel's parliamentary finance committee gave approval on Monday for the government to sell its remaining 6.03 percent stake in Leumi, Israel's largest bank, worth about 1.2 billion shekels ($346.78 million).** Allergan Inc shareholders have told activist investor William Ackman, who along with Valeant Pharmaceuticals  is trying to buy the Botox maker, that they would support a deal at $180 per share, Ackman said Monday.** Merck & Co Inc said Monday it would buy Idenix Pharmaceuticals Inc for $3.85 billion and plans to combine the two companies' most promising drugs to produce a faster, more effective cure for hepatitis C. ** Analog Devices Inc said it would buy Hittite Microwave Corp in a deal valued at $2 billion to strengthen its radio frequency (RF) and signal conversion chip offerings.** GP Investments Ltd, the largest Latin American private equity firm, said on Monday it would earn about $260 million from the sale of its 46 percent stake in Sascar Participações SA, a Brazilian fleet monitoring system provider.** European private equity firm Cinven has bought the fiber network arm of Spanish utility Gas Natural  for 510 million euros, the companies said on Monday, in Spain's biggest private equity buyout of the year.** Malaysian builder IJM Corporation Bhd on Monday proposed to buy the shares in IJM Land it does not own for 1.98 billion ringgit ($619.43 million).** Mexican frozen food company Sigma Alimentos and Chinese pork producer WH Group have raised their joint stake in Spanish meat processor Campofrio to 97 percent under a tender offer launched last month, a regulatory filing showed.** The top investor in Banca Carige plans to sell 10.9 percent of the Italian mid-sized bank by Tuesday, a source close to the matter said, ahead of a planned 800 million euro share sale needed to boost the lender's capital base.** Nigeria is seeking buyers for the assets of distressed state-owned former telecom monopoly Nitel, the state-appointed liquidator said on Monday.** Aubrey McClendon's firm American Energy Partners LLP said on Monday it plans to buy shale oil and gas assets for $4.25 billion, the former Chesapeake Energy Corp CEO's biggest deal package yet in an aggressive bid to build a new company.** TrailStone, a start-up commodity merchant backed by private equity firm Riverstone Holdings LLC, has gained entry to the North American physical oil markets with a deal to buy a small refinery and logistics firm in the Pacific Northwest.** Morgan Stanley is selling its controlling stake in oil storage and transport company TransMontaigne Inc to NGL Energy Partners LP for $200 million, essentially ending its long run as the biggest physical oil trader on Wall Street.** International Game Technology, the Las Vegas-based slot machine maker, has hired Morgan Stanley  to explore a sale as the gaming industry pursues consolidation to combat slow growth, people familiar with the matter said on Monday.** Spanish cooperative banking group Cajamar is in talks to sell its property management unit to U.S. investment firms, a source familiar with the matter said on Monday, as foreign buyers increase their control of the country's real estate businesses.** French telecoms group Orange has ended talks with Vivendi's Canal+ over the pay-television operator taking a stake in online video-sharing website Dailymotion, newspaper Les Echos said on Monday.** The main foundation shareholder in Italy's Banca Carige said on Monday it had sold a 10.86 percent stake in the mid-sized lender. In a statement, the foundation said it had sold the stake for about 91.2 million euros.  ($1 = 0.7345 Euros) ($1 = 6.6296 Swedish Kronas) ($1 = 1.0906 Canadian Dollars)   (Compiled by Shailaja Sharma and Ankit Ajmera in Bangalore)",2014-06-09,TSN,"Mon Jun 9, 2014 | 4:36pm EDT",Deals of the day- Mergers and acquisitions,http://www.reuters.com//article/deals-day-idUSL4N0OQ3WR20140609?type=companyNews
46,"  * Merck to buy Idenix; Analog to purchase Hittite* Apple sees heavy trading following stock split* CBOE Volatility Index up, day after hitting lowest since Feb '07* Dow up 0.1 pct; S&P 500 down 0.01 pct; Nasdaq up 0.2 pct   (Updates to late afternoon)By Caroline ValetkevitchNEW YORK, June 9 U.S. stocks were nearly flat on Monday after the Dow and S&P 500 hit intraday record highs again on more deal news, while Wall Street's fear gauge rebounded.The CBOE Volatility index gained 6.3 percent to 11.41 after falling on Friday to its lowest level since February 2007. The VIX remains at nearly half of its historical average, which some analysts worry is a signal that the market is not fully accounting for issues that could derail the rally. The S&P 500 and Dow have repeatedly hit record highs in recent sessions. If the S&P 500 ends Monday's session higher, it will mark its 11th rise of the past 13 sessions, and its seventh record close of the past eight trading days.There's ""still skepticism about this rally, so consequently, we're not in an overbought position here,"" said Bucky Hellwig, senior vice president of BB&T Wealth Management in Birmingham, Alabama.Merger activity gave investors a reason to buy some stocks on Monday. Merck & Co said it has agreed to buy Idenix Pharmaceuticals Inc in a deal valued at about $3.85 billion. Analog Devices Inc said it would buy Hittite Microwave Corp in a deal valued at $2 billion. Tyson Foods Inc prevailed over Pilgrim's Pride Corp  in a bidding war over Hillshire Brands Co, offering to buy the maker of Jimmy Dean sausages for $8.55 billion, including debt.Shares of Idenix, which has three drugs in development to treat hepatitis C, more than tripled, soaring 231.2 percent to $23.95 on heavy volume. In contrast, Gilead Sciences  the maker of the market-leading hepatitis C treatment, Sovaldi, fell 4.1 percent to $79.04. Gilead was the biggest negative influence on the S&P 500 and Nasdaq.Hittite jumped 28.6 percent to $77.89. Hillshire rose 5.4 percent to $62.10. Merck, a Dow component, dipped 0.02 percent to $57.84. Analog gained 5 percent to $55.34. Tyson slid 5.6 percent to $37.89. The Dow Jones industrial average rose 8.38 points or 0.05 percent, to 16,932.66. The S&P 500 slipped 0.15 point or 0.01 percent, to 1,949.29. The Nasdaq Composite  added 6.74 points or 0.16 percent, to 4,328.14.Earlier, the Dow set an intraday record high at 16,970.17, while the S&P 500 touched an all-time intraday high at 1,955.55.Apple Inc was the Nasdaq's most active name, rising 1.5 percent to $93.58 in heavy volume in the tech titan's first trading session after a seven-for-one stock split.On Friday, Nikkei news service reported that Apple was preparing to sell its first wearable device in October, aiming to produce 3 million to 5 million smartwatches a month in its initial run.Family Dollar Stores Inc jumped 13.6 percent to $68.75 as the S&P 500's biggest percentage gainer after hedge fund billionaire Carl Icahn disclosed late on Friday a 9.39 percent stake, making him the discount retailer's largest shareholder. Dollar General Corp rose 7.9 percent to $62.56.(Additional reporting by Ryan Vlastelica; Editing by Jan Paschal)",2014-06-09,TSN,"Mon Jun 9, 2014 | 2:59pm EDT",US STOCKS-Wall St near flat after hitting new highs; VIX gains,http://www.reuters.com//article/markets-usa-stocks-idUSL2N0OQ1EC20140609?type=companyNews
47,"  June 9 The following bids, mergers, acquisitions and disposals were reported by 1830 GMT on Monday:** Tyson Foods Inc has prevailed over Pilgrim's Pride Corp in a bidding war for Jimmy Dean sausage maker Hillshire Brands Co.** Credit Suisse is mulling a plan to spin off part of its fixed income business in the United States to help trim costs, according to a report in the Financial Times.** Lloyds Banking Group will on Monday price the sale of a 25 percent stake in its TSB IPO-LLTS.L business at below its book value, according to industry sources. ** Gazit-Globe, Israel's largest real estate investment firm, said on Sunday its wholly owned subsidiary ProMed Properties sold five medical office buildings in the United States and is in the final stages of selling another property. ** Israeli property developer Azrieli Group said on Sunday it is in talks to sell energy company Sonol Israel to holding company S. Shlomo Holdings.** Saudi International Petrochemical Co (Sipchem) has postponed merger talks with Sahara Petrochemical, it said on Sunday, blaming the current regulatory framework for the collapse of the tie-up. ** Microsoft Corp co-founder Bill Gates has sold his entire stake in G4S Plc, the British security firm trying to bounce back from a series of scandals that have hurt its reputation and profits.** Spanish builder Metrovacesa said it agreed to sell its 27 percent stake in French peer Gecina to a group of investors as it unwinds a costly acquisition made during Spain's housing boom in an effort to pay down debt.** Hedge fund billionaire Carl Icahn became the largest shareholder in Family Dollar Stores Inc after reporting a 9.39 percent stake in the company on Friday.    (Compiled by Shailaja Sharma in Bangalore)",2014-06-09,TSN,"Mon Jun 9, 2014 | 2:34pm EDT",Deals of the day- Mergers and acquisitions,http://www.reuters.com//article/deals-day-idUSL4N0OQ3VS20140609?type=companyNews
48,"  * Merck to buy Idenix; Analog to purchase Hittite* Apple sees heavy trading following stock split* CBOE Volatility Index up, day after hitting lowest since Feb '07* Dow up 0.1 pct; S&P 500 up 0.1 pct; Nasdaq up 0.3 pct   (Updates to mid-afternoon, changes byline)By Caroline ValetkevitchNEW YORK, June 9 U.S. stocks edged higher on Monday, pushing the Dow and S&P 500 to intraday record highs again after a series of deals, though Wall Street's fear gauge also bounced back. If the S&P 500 ends higher on Monday, that will mark its 11th rise of the past 13 sessions, and its seventh record close of the past eight trading days.The CBOE Volatility index rose 5.8 percent to 11.35 following its drop on Friday to its lowest level since February 2007. The VIX remains at nearly half of its historical average, which some analysts worry is a signal that the market is not fully accounting for issues that could derail the rally.A flurry of merger activity gave investors a reason to buy some stocks on Monday. Merck & Co said it has agreed to buy Idenix Pharmaceuticals Inc in a deal valued at about $3.85 billion. Analog Devices Inc said it would buy Hittite Microwave Corp in a deal valued at $2 billion. Tyson Foods Inc prevailed over Pilgrim's Pride Corp  in a bidding war over Hillshire Brands Co, offering to buy the maker of Jimmy Dean sausages for $8.55 billion, including debt.Shares of Idenix more than tripled, surging 231.4 percent to $23.96 on heavy volume, while Hittite shot up 28.7 percent to $77.92. Hillshire rose 5.2 percent to $61.98. Merck, a Dow component, was flat at $57.85. Analog gained 5.1 percent to $55.40. Tyson slid 5.2 percent to $38.03.The Dow Jones industrial average rose 10.61 points or 0.06 percent, to 16,934.89. The S&P 500 gained 1.31 points or 0.07 percent, to 1,950.75. The Nasdaq Composite  added 11.96 points or 0.28 percent, to 4,333.36. Earlier, the Dow set an intraday record high at 16,970.17, while the S&P 500 touched an all-time intraday high at 1,955.55.Apple Inc was the Nasdaq's most active name, rising 1.6 percent to $93.73 in heavy volume in the tech titan's first trading session after a seven-for-one stock split.On Friday, the Nikkei news service reported that Apple was preparing to sell its first wearable device in October, aiming to produce 3 million to 5 million smartwatches a month in its initial run.Family Dollar Stores Inc jumped 13.6 percent to $68.75 as the S&P 500's biggest percentage gainer after hedge fund billionaire Carl Icahn disclosed late on Friday a 9.39 percent stake in the company, making him the discount retailer's largest shareholder. Dollar General Corp climbed 9 percent to $63.23.(Additional reporting by Ryan Vlastelica; Editing by Jan Paschal)",2014-06-09,TSN,"Mon Jun 9, 2014 | 2:15pm EDT","US STOCKS-Wall St slightly extends gains, lifted by deals",http://www.reuters.com//article/markets-usa-stocks-idUSL2N0OQ19620140609?type=companyNews
49,"   By Lisa Baertlein  Tyson Foods Inc (TSN.N) won the bidding war for Hillshire Brands Co HSH.N with an all-cash offer that values the maker of Jimmy Dean sausages at $8.55 billion and would be the biggest deal yet for the global meat business.Tyson, the largest U.S. meat processor, on Monday announced an agreement to buy Hillshire for $63 per share. That topped last week's $55 bid from Pilgrim's Pride Corp (PPC.O), which is majority owned by Brazilian meatpacking giant JBS SA (JBSS3.SA).The high-stakes battle for Hillshire, which also sells Ball Park hot dogs, Jimmy Dean frozen breakfast sandwiches and Aidells artisan sausages, underscores how urgently large commodity meat companies want to gobble up popular, and more profitable, brands. ""We want to buy this business for what it can become, not just for what it is now. Great brands like Hillshire, Jimmy Dean and Ball Park just don't come available very often,"" Tyson Chief Executive Donnie Smith said on a conference call with reporters. ""We determined that it was in the best interests of our shareholders not to increase our proposed price,"" Pilgrim's said in a statement on Monday. Pilgrim's $45 per share offer on May 27 sparked the bidding war.Investors cheered the final deal, sending shares in Hillshire up 5.1 percent to $61.92 in afternoon trading.Analysts had warned that a bidding war could result in the winner overpaying for Hillshire. They also said such a merger could give the winner a competitive advantage that would be hard for the loser to match.  To that end, shares in Tyson and Pilgrim's were down 4.9 percent and 6.1 percent, respectively.Athlos Research principal Jonathan Feeney said Tyson overpaid ""in a conventional sense."" But, he said, Tyson can afford it because of what Hillshire brings to the table with its popular grocery brands.With the Hillshire deal coming to a close, Feeney and others say Kraft Foods Group Inc's KRFT.O Oscar Mayer lunch meat and hot dog brand could be the next target.  Tyson's offer for Hillshire expires Dec. 12. It is contingent on Hillshire dropping plans to buy Birds Eye frozen vegetable seller Pinnacle Foods Inc (PF.N) for $6.6 billion deal, including debt.Hillshire on Monday said it had not approved the Tyson offer and had not changed its recommendation that shareholders vote for the Pinnacle deal. Some analysts say China's Shuanghui International Holdings Ltd set the current food fight in motion last May when the company, now called WH Group Ltd, bought Smithfield Foods Inc for $4.7 billion, excluding debt.Tyson's Hillshire offer, excluding debt, comes to $7.7 billion.  Tyson plans to fund the deal with existing cash and a fully committed bridge facility from Morgan Stanley Senior Funding Inc and JP Morgan Securities LLC.Four antitrust experts told Reuters the deal likely would win approval from regulators since the companies tend to sell different products.""If there is a category on the branded side that raises an (antitrust) issue, there's always an opportunity to sell off the brand,"" said Jonathan Lewis, an antitrust expert with the law firm Baker Hostetler. (Reporting by Devika Krishna Kumar, Olivia Oran, Diane Bartz and Supriya Kurane; Editing by Kirti Pandey, Ted Kerr and Andrew Hay)",2014-06-09,TSN,"Mon Jun 9, 2014 | 2:11pm EDT",Tyson wins bid for Hillshire in battle of meat titans,http://www.reuters.com//article/us-tyson-hillshire-brands-idUSKBN0EK02N20140609?type=companyNews
