,Article,Date,Symbol,Time,Title,Url
0,"   By P.J. Huffstutter | CHICAGO  CHICAGO Jan 9 Tyson Foods Inc., the nation's second largest pork producer, said Thursday it will require more humane animal treatment farmers that raise its pigs and keep a closer eye on all of its hog suppliers in North America.Tyson said it will be rolling out more third-party inspections this year of sow farms that supply it animals. And after an undercover video last year caught an Oklahoma farm operation abusing some of Tyson's own pigs, the company will require all to install video-monitoring systems by year's end, according to a letter Tyson sent out to farmers on Wednesday.Tyson also said in the letter it will force its contract farmers to stop euthanizing sick or injured piglets by blunt force, such as slamming a piglet's head against the ground in order to kill it.Many of these new hog rules for hog producers, according to the letter sent out this week, are required for only those farmers that raise pigs owned by Tyson: Less than 5 percent of the company's annual hog supply in North America comes from these operations, Mickelson said. The company is also asking these contract farmers to roll out pens for pregnant sows that have improved ""quality and quantity of space,"" according to the letter.The letter did not specify what such enclosures should be, but noted that ""we believe future sow housing should allow sows of all sizes to stand, turn around, lie down and stretch their legs."" The majority of Tyson's hogs are supplied by more than 3,000 independent operators, the company said.Tyson said it is encouraging these independent farmers, who sell their animals to Tyson's slaughter plants, to adopt all these new changes, but only the additional third-party audits will be required of such operators this year. The letter was delivered weeks after Tyson Foods terminated its contract with the Oklahoma-based operation after undercover video footage was released showing farm workers hitting pigs with wooden boards, kicking animals and gouging their eyes.The company's policy changes were not in reaction to any one incident, but part of an ongoing push for ""responsible animal practices"" among all of its suppliers, said company spokesman Gary Mickelson.""We're trying to balance the expectations of consumers with the realities of today's hog farming business,"" Mickelson said.",2014-01-09,TSN,"Thu Jan 9, 2014 | 5:29pm EST",Tyson demands better treatment of hogs by its suppliers,http://www.reuters.com//article/usa-tyson-hogs-housing-idUSL2N0KJ26Q20140109?type=companyNews
1,"  (Adds Warsaw bourse, Ally Financial, RCS Capital, Apollo Global, Vattenfall, Loewe AG, Tyson Foods; Updates Johnson & Johnson, Bidvest Group, Tyson Foods)Jan 16 The following bids, mergers, acquisitions and disposals were reported by 2100 GMT on Thursday:** Dubai Group has signed a $10 billion debt restructuring deal, two sources with knowledge of the matter told Reuters, marking the end of a perilous period which saw the emirate risk collapse under a mountain of debt obligations. The unit of Dubai Holding, the investment vehicle of Dubai's ruler, was one of a number of state-linked entities which borrowed heavily from banks to fund an acquisitions spree during the boom years of 2006-08.** Johnson & Johnson said on Thursday it would sell its ortho clinical diagnostics unit to buyout firm Carlyle Group LP for $4.15 billion, shedding a slow-growing business to focus on more lucrative products.** The U.S. Treasury Department announced plans to sell 410,000 shares in auto lender Ally Financial as part of its effort to unwind its financial bailout fund. The Treasury said it expected taxpayers to recover about $3 billion from the private offering of Ally common stock at $7,375 per share. The sale would reduce the government's stake to 37 percent, it said.** Tyson Foods Inc is exploring a bid for Michael Foods Group Inc, a deal that would combine one of the world's largest chicken processors with a large distributor of egg and dairy products, according to three people familiar with the matter.** Shareholders in Poland's largest media group Cyfrowy Polsat on Thursday agreed to a 6.15 billion zloty ($2 billion) share issue to buy the country's No.3 mobile operator Polkomtel in a share-swap deal.** The Warsaw bourse hopes to conclude a tie-up with Vienna's stock exchange this year and is awaiting approval from its supervisory board to begin the second stage of talks, its CEO said on Thursday. The Polish state-controlled bourse, already the biggest stock market in central Europe, wants to become a regional leader and as part of that plan aims to merge with the CEE Stock Exchange Group.** RCS Capital Corp on Thursday announced it would buy independent broker-dealer Cetera Financial Group from private equity firm Lightyear Capital LLC for about $1.15 billion in cash to expand its retail brokerage business.** Apollo Global Management LLC said it would buy CEC Entertainment Inc, the parent of Chuck E Cheese restaurant chain, for about $948 million, adding to a portfolio that includes companies ranging from cruise ship operators to casinos.** Mexican telecoms tycoon Carlos Slim has agreed to consolidate his company and family stakes in Telekom Austria , clarifying his position in the eyes of regulators that monitor when stakeholdings become large enough to trigger takeover bids. ** A panel of Indian ministers has approved the sale of a 10 percent stake in state refiner Indian Oil Corp to two state exploration firms, a move that will help the cash-strapped government raise funds to narrow its budget deficit. The government, which has a 79 percent stake in IOC, expects to garner between 48 billion to 50 billion rupees ($812 million).** German television maker Loewe AG said it would be taken over by a group of investors that include former senior managers at Apple Inc and Bang & Olufsen A/S, six months after seeking creditor protection.** The French state has raised 451 million euros ($613 million) by selling about 1 percent of the capital of European aerospace company Airbus Group NV, Finance Minister Pierre Moscovici said.** Two private healthcare groups may be forced to sell nine hospitals, mainly in London, after an investigation by Britain's Competition Commission found patients were not getting value for money.** Vattenfall AB will sell its 74.9 percent stake in the Hamburg electricity grid back to the city of Hamburg, making a capital gain of at least 300 million euros, the state-owned Swedish utility said. ** Telecom Italia SpA said on Thursday there were no plans or talks under way for a possible sale of its TIM Brasil unit.** Formosa Petrochemical Corp's three largest shareholders plan to raise up to T$10.24 billion ($340 million) from the sale of shares in Taiwan's top plastics conglomerate, IFR reported, citing a term sheet for the deal.** Spanish banks Bankia and Caixabank on Thursday announced stake sales in other companies as lenders bulk up capital ahead of Europe-wide health checks of their balance sheets this year.** Israeli holding company Koor Industries Ltd sold off its remaining 3.68 million shares, or 0.23 percent stake, in Credit Suisse Group AG for 110.5 million Swiss francs ($121.5 million), the company said. ** ProsiebenSat.1 shareholders KKR and Permira will sell on the open market the remaining 17 percent stake they hold jointly in the German broadcaster, completing a gradual exit.** French commodities company Louis Dreyfus may sell the biomass energy plants of its Brazilian subsidiary Biosev , which has struggled to turn a profit in the local sugar and ethanol industry, a newspaper said on Thursday.** Unilever Plc  said it had agreed to sell its Royal pasta brand in the Philippines to RFM Corp  for $47.8 million, as the Anglo-Dutch company streamlines its business.** Australia's Bega Cheese Ltd said it will sell its 18.8 percent stake in Warrnambool Cheese and Butter Factory Co Holdings Ltd to Saputo Inc for between A$94.7 million ($84.51 million) and A$101 million, in a major breakthrough for the Canadian company in an extended takeover battle.** South Africa's Bidvest Group will close its offer for a stake in drugmaker Adcock Ingram early next month, it said on Thursday, in what may be an attempt to speed up a takeover battle that has been waylaid by delays.** Indonesia plans for state-owned energy company Pertamina  to acquire state gas utility Perusahaan Gas Negara , a minister said, as Southeast Asia's largest economy moves to free up supply bottlenecks.** Masraf Al Rayan QSC, Qatar's largest sharia-compliant bank by market value, said it had completed its acquisition of Islamic Bank of Britain.** AOL Inc is handing majority ownership of Patch, a money-losing network of local news websites, to New York investment firm and turnaround specialist Hale Global in a joint venture announced by the companies on Wednesday.** CITIC Capital Holdings Ltd, a unit of China's sovereign wealth fund, has invested in a new U.S.-based asset management fund set up by former executives of bankrupt hedge fund FX Concepts, two sources familiar with the matter said on Wednesday.** Mike Ashley's Sports Direct has sold the stake in Debenhams it bought just days ago, making a profit of about 4.6 million pounds ($7.5 million), and replaced it with a complex option that bets on the department store's shares staying underpinned.   ($1 = 0.9095 Swiss francs)  ($1 = 0.7356 euros)  ($1 = 30.0765 Taiwan dollars)  ($1 = 1.1206 Australian dollars)  ($1 = 61.55 rupees)  ($1 = 3.06 Polish zloty)  ($1 = 0.61 British pound sterling)   (Compiled by Shivani Mody and Shubhankar Chakravorty in Bangalore)",2014-01-16,TSN,"Thu Jan 16, 2014 | 4:02pm EST",Deals of the day- Mergers and acquisitions,http://www.reuters.com//article/deals-day-idUSL3N0KQ33Y20140116?type=companyNews
2,"   By Olivia Oran, Soyoung Kim and Greg Roumeliotis | NEW YORK  NEW YORK Tyson Foods Inc (TSN.N) is exploring a bid for Michael Foods Group Inc, a deal that would combine one of the world's largest chicken processors with a large distributor of egg and dairy products, according to three people familiar with the matter.A potential deal for Michael Foods, which is seen worth between $2 billion and $2.5 billion according to the people, would place Tyson, the nation's largest meat producer, into an adjacent category within poultry and protein.Michael Foods, the egg and dairy products producer owned by Goldman Sachs Group Inc's (GS.N) private equity unit, is in the early stages of finding a buyer, and Tyson may ultimately choose not to move forward with an offer, the people cautioned.Michael Foods is working with Goldman Sachs' investment banking unit and Bank of America Merrill Lynch (BAC.N) on a potential sale, Reuters reported in December. The sources declined to be named because the matter is private. Tyson Foods and Michael Foods declined to comment. A Goldman Sachs spokeswoman did not immediately respond to a request for comment.Minnetonka, Minnesota-based Michael Foods produces and distributes products including specialty eggs, refrigerated potatoes, cheese and other dairy products. Tyson Foods, which has a market cap of around $12 billion, has traditionally shunned large acquisitions. The last major acquisition it made was its 2001 purchase of IBP Inc for $3.2 billion, which helped transform the company into the world's largest meat producer and processor.A tie-up between Tyson and Michael Foods would bring synergies on the poultry side of the business as both companies raise chickens. Goldman Sachs Capital Partners bought Michael Foods from private equity firm Thomas H. Lee Partners LP in 2010 for around $1.7 billion. Thomas H. Lee retained an ownership stake of about 20 percent as part of the transaction.In the nine months ending September 28, Michael Foods posted adjusted earnings before interest, tax, depreciation and amortization (EBITDA) of $188 million, up 7.2 percent from the same period last year.For the full 2013 year, the company was on track to report EBITDA of around $250 million. Michael Foods is hoping to fetch roughly 9 or ten times that amount, according to the people familiar with the matter.(Reporting by Olivia Oran, Soyoung Kim and Greg Roumeliotis in New York; Editing by Nick Zieminski)",2014-01-16,TSN,"Thu Jan 16, 2014 | 10:56am EST",Exclusive: Tyson weighs $2 billion-plus deal for Michael Foods - sources,http://www.reuters.com//article/us-michaelfoods-tyson-idUSBREA0F17220140116?type=companyNews
3,"  By Meredith DavisJan 31 Tyson Foods Inc, the largest U.S. meat processor, said on Friday it expects pork supplies to drop 2 to 4 percent this fiscal year, raising wholesale prices, as a deadly pig virus spreads through the U.S. hog belt.Heavier hogs will offset some of the loss in headcount, Jim Lochner, Tyson's chief operating officer, said during a conference call after the company's quarterly earnings release.Porcine Epidemic Diarrhea virus (PEDv), a highly contagious and potentially fatal pig virus, has contributed to higher hog prices, which are beginning to eat into pork processors' profits. Average prices for live sows surged 28 percent in the last year, according to USDA figures. ""I do want to emphasize information does come out fairly regularly ... and we're just staying on top of it region to region, producer to producer,"" Lochner said, referring to the spread of the disease.Industry analysts estimate up to 4 million may have died from the virus, but there are no official figures for pig fatalities from the disease.  The U.S. hog herd stood at 65.9 million head as of December 2013, U.S. Department of Agriculture data showed. PEDv was first discovered in April 2013 in the United States, the world's the largest pork exporter, and has spread to 23 states and Canada. Transmitted orally and through pig feces, the disease causes diarrhea, vomiting and severe dehydration in the animals, but does not affect humans.Older pigs have a chance of survival, but the virus kills 80 to 100 percent of piglets that are infected. Tyson also said it was monitoring the number of sows affected by the virus.Based in Springdale, Arkansas, Tyson reported quarterly net income of $254 million, or 72 cents per share, up from $173 million, or 49 cents per share, a year earlier, beating analysts estimates.Shares of Tyson were up nearly 10 percent at $37.89 in afternoon trading on the New York Stock Exchange.Hillshire Brands Co, the Chicago-based maker of Jimmy Dean sausages and Ball Park hot dogs, said on its earnings call on Thursday that it was watching the spread of the virus and its effect on sow prices.",2014-01-31,TSN,"Fri Jan 31, 2014 | 2:06pm EST",UPDATE 1-Tyson Foods says pig virus to cut pork supply by 2-4 percent,http://www.reuters.com//article/tyson-pork-virus-idUSL2N0L51D220140131?type=companyNews
4,"  Tyson Foods Inc (TSN.N), the largest U.S. meat processor, on Friday said higher beef prices and robust chicken sales helped quarterly profits grow more than Wall Street expected, sending shares up nearly 10 percent.The company's shares rose 9.6 percent to $37.81 in midday trading after Tyson also reaffirmed its sales and meat production forecast for fiscal 2014.Chicken sales rose $61 million, or 2 percent, to $2.98 billion, while beef sales increased $249 million, or 7 percent to $3.73 billion in the fiscal first quarter ended December 28.Springdale, Arkansas-based Tyson said stronger demand resulted in higher prices on its beef sales.""Record high beef prices should continue to 2014, meaning fewer beef promotions and retail and food service,"" Tyson's President and Chief Executive Donnie Smith said on a conference call with analysts.""Chicken should continue to be the winner,"" Smith said, referring to buyers' tendency to switch to lower-cost poultry when beef prices rise.Total revenue increased nearly 5 percent to $8.76 billion.Net income attributable to Tyson rose to $254 million, or 72 cents per share, from $173 million, or 49 cents per share, a year earlier.Analysts on average were expecting a profit of 63 cents per share, on revenue of $8.75 billion, according to Thomson Reuters I/B/E/S. U.S. meat producers last year struggled as rising feed costs crimped margins and forced them to raise prices.Tyson said that it expects grain supplies to increase this year, reducing its costs.The company reaffirmed its sales forecast of about $36 billion for fiscal 2014 and said it still expects a 1 percent rise in overall domestic production of chicken, beef, pork and turkey in fiscal 2014, which ends in September. Pork sales were up $61 million, or 4.5 percent, to $1.4 billion during the latest quarter.Executives said the Porcine Epidemic Diarrhea virus (PEDv) will decrease pork production by 2 percent to 4 percent.PEDv is a piglet-killing virus, which causes diarrhea, vomiting and severe dehydration in hogs. It has turned up in 23 of the 50 states since its discovery in the United States last April.The virus, which is already established in Europe and Asia, poses no threat to humans and is not a food safety risk. In Canada, it has been contained in Canada to southern Ontario farms. Disappointing results from China, where Tyson is making significant investments to build poultry operations, accounted for most of the $28 million loss in the company's international business.Smith said concerns about the return of avian flu in China threatens to further hamper demand, which is still weak due to a softening economy, food safety concerns and an outbreak of the disease that scared Chinese buyers away from chicken last year.""Demand hasn't recovered, which has led to a substantial oversupply of chicken,"" Smith said, who said on a call with reporters that demand is down as much as 30 percent in China.Due to that, the company is slowing construction of chicken farms until market conditions improve.Smith said Tyson no longer expects its China operations to break even by the end of fiscal 2014.""I think it will take longer,"" he said.Tyson shares have risen more than 50 percent in the last 52 weeks.(Reporting by Lisa Baertlein in Los Angeles, Meredith Davis and PJ Huffstutter in Chicago and Maria Ajit Thomas in Bangalore; Editing by Savio D'Souza and Jonathan Oatis)",2014-01-31,TSN,"Fri Jan 31, 2014 | 12:50pm EST","Tyson results beat estimates on higher chicken, beef sales",http://www.reuters.com//article/us-tyson-results-idUSBREA0U0R520140131?type=companyNews
5,"  Jan 31 Tyson Foods Inc, the largest U.S. meat processor, on Friday said higher beef prices and robust chicken sales helped quarterly profits grow more than Wall Street expected, sending shares up nearly 10 percent.The company's shares rose 9.6 percent to $37.81 in midday trading after Tyson also reaffirmed its sales and meat production forecast for fiscal 2014.Chicken sales rose $61 million, or 2 percent, to $2.98 billion, while beef sales increased $249 million, or 7 percent to $3.73 billion in the fiscal first quarter ended Dec. 28.Springdale, Arkansas-based Tyson said stronger demand resulted in higher prices on its beef sales.""Record high beef prices should continue to 2014, meaning fewer beef promotions and retail and food service,"" Tyson's President and Chief Executive Donnie Smith said on a conference call with analysts.""Chicken should continue to be the winner,"" Smith said, referring to buyers' tendency to switch to lower-cost poultry when beef prices rise.Total revenue increased nearly 5 percent to $8.76 billion.Net income attributable to Tyson rose to $254 million, or 72 cents per share, from $173 million, or 49 cents per share, a year earlier. Analysts on average were expecting a profit of 63 cents per share, on revenue of $8.75 billion, according to Thomson Reuters I/B/E/S.U.S. meat producers last year struggled as rising feed costs crimped margins and forced them to raise prices.Tyson said that it expects grain supplies to increase this year, reducing its costs.The company reaffirmed its sales forecast of about $36 billion for fiscal 2014 and said it still expects a 1 percent rise in overall domestic production of chicken, beef, pork and turkey in fiscal 2014, which ends in September. Pork sales were up $61 million, or 4.5 percent, to $1.4 billion during the latest quarter.Executives said the Porcine Epidemic Diarrhea virus (PEDv) will decrease pork production by 2 percent to 4 percent.PEDv is a piglet-killing virus, which causes diarrhea, vomiting and severe dehydration in hogs. It has turned up in 23 of the 50 states since its discovery in the United States last April.The virus, which is already established in Europe and Asia, poses no threat to humans and is not a food safety risk. In Canada, it has been contained in Canada to southern Ontario farms. Disappointing results from China, where Tyson is making significant investments to build poultry operations, accounted for most of the $28 million loss in the company's international business.Smith said concerns about the return of avian flu in China threatens to further hamper demand, which is still weak due to a softening economy, food safety concerns and an outbreak of the disease that scared Chinese buyers away from chicken last year.""Demand hasn't recovered, which has led to a substantial oversupply of chicken,"" Smith said, who said on a call with reporters that demand is down as much as 30 percent in China.Due to that, the company is slowing construction of chicken farms until market conditions improve.Smith said Tyson no longer expects its China operations to break even by the end of fiscal 2014.""I think it will take longer,"" he said.Tyson shares have risen more than 50 percent in the last 52 weeks.",2014-01-31,TSN,"Fri Jan 31, 2014 | 12:48pm EST","UPDATE 3-Tyson results beat estimates on higher chicken, beef sales",http://www.reuters.com//article/tyson-results-idUSL3N0L547Y20140131?type=companyNews
