,Article,Date,Symbol,Time,Title,Url
20,"  Oct 20 The following bids, mergers, acquisitions and disposals were reported by 1030 GMT on Monday:** An investor group that includes Jynwel Capital and funds affiliated with the Abu Dhabi government is launching a bid to buy Reebok from Adidas AG for about $2.2 billion, the Wall Street Journal reported on Sunday.** British pub chain Spirit Pub Company Plc said its board was in talks with ale maker Greene King Plc  over a revised 109.5 pence-per-share takeover offer, valuing Spirit Pub at 723.3 million pounds ($1.16 billion).** An investor group led by Macquarie Infrastructure and Real Assets has agreed to buy Louisiana electricity supplier Cleco Corp in a deal valued at about $4.7 billion, including about $1.3 billion of assumed debt. ** SHV, a family-owned Dutch investment firm, has reached a conditional agreement to buy animal feed and nutrition company Nutreco for 2.7 billion euros ($3.4 billion), expanding into food-related businesses.** British pay-TV group BSkyB said it would own at least 69 percent of Sky Deutschland once the takeover period closes, after more minority investors than expected signed up for the offer. ** Brazil's Vale SA said on Friday that a revised nickel-mining contract with Indonesia would raise maximum royalties, cut land holdings and require its Indonesian unit to sell another 20 percent of its shares to local investors.** Brazilian juice maker Grupo Cutrale and investment firm Safra Group are not considering raising their $14-per-share definitive offer for Chiquita Brands International Inc, a source familiar with the situation told Reuters on Friday. ** Williams Companies Inc is said to be one of the bidders for QEP Resources Inc's natural gas pipeline unit, Bloomberg reported, citing people familiar with the matter.** Australian management firm Transfield Services Ltd  said it had received an indicative takeover proposal from Spain's Ferrovial, valuing the company at around A$1 billion ($876 million).** Qatar Holding LLC has agreed to pay $616 million for about one fifth of Lifestyle International Holdings, a department operator in Hong Kong and mainland China - the latest addition of a high-end retail brand to the sovereign wealth fund's portfolio.($1 = 0.6213 British pound)  ($1 = 0.7837 euro)  ($1 = 1.1418 Australian dollar)   (Compiled by Anannya Pramanick in Bangalore)",2014-10-20,WMB,"Mon Oct 20, 2014 | 6:30am EDT",Deals of the day- Mergers and acquisitions,http://www.reuters.com//article/deals-day-idUSL3N0SF43M20141020?type=companyNews
21,"  (Adds details, management changes, background)Oct 27 Pipeline operator Williams Companies Inc , which owns controlling interests in Williams Partners LP and Access Midstream Partners LP, said the two master limited partnerships have amended the terms of their merger agreement.Under the revised terms, Williams Partners will merge with a subsidiary of Access Midstream in a unit-for-unit exchange of 0.86672 common units of Access Midstream for every Williams common unit.Williams first proposed the merger in June, with Access Midstream acquiring William Partners at an exchange ratio of 0.85 plus an additional $0.81 per Williams Partners' common unit in cash or additional Access Midstream common units.Williams, based in Tulsa, Oklahoma, said it agreed to reduce the exchange ratio it would receive in the merger to offset the about $1.02 of value provided to the Williams Partners' public unit holders. After the completion deal, Williams Partners will be wholly owned by Access Midstream and the merged master limited partnership (MLP) will be named Williams Partners LP.MLPs are exempt from federal income tax and have been hugely popular among investors seeking higher yields, even though their structures often have corporate governance standards weaker than those of corporations. The deal has a total transaction value of about $50 billion, the companies said in a statement late on Sunday.""This is another big step toward our goal of becoming the leading natural gas infrastructure provider in North America"" said Williams' Chief Executive Alan Armstrong. The deal is expected to be completed by early 2015. The combined entity expects to generate adjusted EBITDA of about $5 billion in 2015 and distribute $3.65 per unit in 2015.Williams Partners owns interests in three major interstate pipelines which, combined, deliver 14 percent of the natural gas consumed in the United States. Access owns and operates more than 6,300 miles of natural gas pipelines across nine states.Upon closing of the deal, Williams CEO Armstrong will serve as the merged MLP's CEO, while Donald Chappel, current CFO of Williams and Williams Partners, will be the merged MLP's CFO.J. Michael Stice, Access Midstream's CEO, will retire but continue as a director of the merged MLP. David Shiels, ACMP's CFO will leave the company to pursue other opportunities, the companies said.    (Reporting by Supriya Kurane in Bangalore; Editing by Gopakumar Warrier)",2014-10-27,WMB,"Mon Oct 27, 2014 | 12:57am EDT","UPDATE 1-Williams Partners, Access Midstream Partners amend deal terms",http://www.reuters.com//article/williams-de-access-midstream-idUSL4N0SM14U20141027?type=companyNews
22,"  Oct 26 Williams Partners LP and Access Midstream Partners LP amended the terms of their merger agreement, said pipeline operator Williams Companies Inc , which owns controlling interests in the two master limited partnerships.Under the revised terms, Williams Partners will merge with a subsidiary of Access Midstream in a unit-for-unit exchange at a ratio of 0.86672 common units of Access Midstream for every Williams common unit.Williams first proposed the merger in June, with Access Midstream acquiring William Partners at an exchange ratio of 0.85 plus an additional $0.81 per Williams Partners' common unit in cash or additional Access Midstream common units. Williams said it agreed to reduce the exchange ratio it would receive in the merger to offset the about $1.02 of value provided to the Williams Partners' public unit holders.After the deal, Williams Partners will be wholly owned by Access Midstream and the merged master limited partnership (MLP) will be named Williams Partners LP. The transaction between Access Midstream and Williams gives the deal a total transaction value of about $50 billion, the companies said in a statement late on Sunday. Upon completion of the deal, expected by early 2015, the merged MLP is expected to generate adjusted EBITDA of about $5 billion in 2015, the companies said.Williams Partners owns interests in three major interstate pipelines which, combined, deliver 14 percent of the natural gas consumed in the United States. Access owns and operates more than 6,300 miles of natural gas pipelines across nine states.   (Reporting by Supriya Kurane in Bangalore; Editing by Gopakumar Warrier)",2014-10-27,WMB,"Mon Oct 27, 2014 | 12:00am EDT","Williams, Access Midstream Partners amend deal terms",http://www.reuters.com//article/williams-de-access-midstream-idUSL4N0SM0ZV20141027?type=companyNews
23,"   By Sneha Banerjee  Pipeline giant Williams Cos is scrapping its master limited partnership unit by buying Williams Partners LP for about $13.8 billion, the latest in a series of deals in the pipeline industry aimed at simplifying corporate structures.Master Limited Partnerships (MLPs) are also being bought out to eliminate incentivized distribution rights, which over time can divert large chunks of cash returns to general partners and starve the company of capital.Distribution payouts are becoming a burden for energy companies at a time when they are struggling to cope with a steep fall in global crude prices.MLP experts say most mature entities eventually need to be unwound.Crestwood Equity Partners said last week it would buy its MLP, Crestwood Midstream Partners, to cut out incentive distribution rights. Earlier this year, Energy Transfer Partners said it would buy affiliate Regency Energy Partners LP for about $11 billion. Industry leader Kinder Morgan Inc brought all its units into a traditional C-Corporation last year.Williams Cos, however, is not completely abandoning the MLP structure. The company still has control of Access Midstream Partners LP, which it agreed to buy last year.Williams Cos is offering 1.115 of its own shares for each Williams Partners' share. The offer works out to $55.86 per share, an 18 percent premium to Williams Partners' Tuesday close. William Cos' shares rose as much as 8.6 percent, while William Partners rose as much as 25.3 percent to $59.41.William Partners' shares have vastly underperformed the stock of its parent over the past year. Up to Tuesday's close, William Cos' shares had risen nearly 14 percent, while William Partners had fallen nearly 15 percent in the last 12 months. The combined company expects third-quarter dividend of 64 cents per share. Williams Cos had previously expected to pay dividend of 60 cents per share, while Williams Partners was expecting to pay out 85 cents.The companies said the deal would reduce cost of capital, freeing up funds for acquisitions. Lower capital cost would also drive a 10-15 percent dividend growth rate through 2020.Barclays and Gibson Dunn were financial and legal advisers, to Williams. Evercore was financial adviser to Williams Partners, while Baker Botts was the legal adviser. (Editing by Saumyadeb Chakrabarty)",2015-05-13,WMB,"Wed May 13, 2015 | 1:30pm EDT",Pipeline giant Williams Cos scraps MLP unit in $13.8 billion deal,http://www.reuters.com//article/us-williams-lp-m-a-williams-idUSKBN0NY1FC20150513?type=companyNews
24,"  Energy company Williams Companies Inc (WMB.N) said on Sunday it is exploring strategic options after it received an unsolicited takeover proposal. The Williams board said it determined the unsolicited offer - which is contingent on termination of Williams' pending acquisition of Williams Partners LP (WPZ.N) - ""significantly undervalues"" Williams.Williams said in May that it signed an agreement under which Williams will acquire all of the public outstanding shares of Williams Partners, which gathers, processes and transports natural gas. ""Our board and management team remain committed to acting in the best interests of shareholders, and in light of the unsolicited proposal, our board believes it is in the best interest of shareholders to conduct a thorough evaluation of strategic alternatives,""  Alan Armstrong, president and chief executive of Williams, said in a statement.   (Reporting by Jennifer Saba in New York)",2015-06-21,WMB,"Sun Jun 21, 2015 | 7:40pm EDT",Williams Co exploring strategic options after unsolicited offer,http://www.reuters.com//article/us-williams-de-m-a-idUSKBN0P110P20150621?type=companyNews
25,"  June 21 Energy company Williams Companies Inc  said on Sunday it is exploring strategic options after it received an unsolicited takeover proposal.The Williams board said it determined the unsolicited offer - which is contingent on termination of Williams' pending acquisition of Williams Partners LP - ""significantly undervalues"" Williams. Williams said in May that it signed an agreement under which Williams will acquire all of the public outstanding shares of Williams Partners, which gathers, processes and transports natural gas.  ""Our board and management team remain committed to acting in the best interests of shareholders, and in light of the unsolicited proposal, our board believes it is in the best interest of shareholders to conduct a thorough evaluation of strategic alternatives,""  Alan Armstrong, president and chief executive of Williams, said in a statement.   (Reporting by Jennifer Saba in New York)",2015-06-21,WMB,"Sun Jun 21, 2015 | 7:36pm EDT",Williams Co exploring strategic options after unsolicited offer,http://www.reuters.com//article/williams-de-ma-idUSASB09SWD20150621?type=companyNews
26,     ,2015-06-21,WMB,"Sun Jun 21, 2015 | 7:36pm EDT",Williams Co exploring strategic options after unsolicited offer,http://www.reuters.com//article/williams-de-ma-idUSL1N0Z70IV20150621?type=companyNews
27,"   By Anna Driver | HOUSTON, June 22  HOUSTON, June 22 Energy Transfer Equity's  unsolicited $48 billion offer for Williams Companies Inc  through a corporate structure with tax advantages may be the U.S. pipeline company's best option as potential bids from rivals are complicated by possible antitrust issues and the deal's rich price, investors and analysts said on Monday.Energy's proposed all-equity offer of $64 per share for Williams was rejected by Williams' board who said in a statement on Sunday that it significantly undervalued the company which controls a master limited partnership, or MLP.Deals in the energy sector, especially oil and gas pipeline and processing companies, are turning to a more traditional corporate structure as MLP advantages wane over time. Energy Transfer would be the latest MLP to propose using a c-corporation as a way to maximize tax advantages, increase cash flows and broaden institutional interest.The sector embraces the MLP structure because the tax burden is passed through to investors who receive fat yields. Because the partnership pays no taxes, it has a lower cost of capital.Kinder Morgan Inc last year put all of its publicly traded partnerships into one corporate parent to quell concerns that it had grown too large and complicated.As a partnership grows larger over time, it is frequently required to pay more income to its parent company, a situation that saps its ability to expand and raises the cost of capital. Energy Transfer will still hold a number of MLPs as part of its proposed deal.Kinder Morgan Inc and Enterprise Products Partners, two other pipeline and processing companies, are large enough to make a bid for Williams, analysts said. ""There's not really that many companies in this universe, in midstream, that have the facility to (bid for Williams), said Brandon Blossman, an analyst at energy-focused investment bank Tudor, Pickering, Holt & Co. ""Kinder Morgan has very similar sort of assets in the mid-Atlantic and North East. Enterprise Partners has historically not shown much interest in large deals, like this.""It would not make sense for Kinder to pay a premium for assets that it would have to turn around and sell, said Quinn Kiley, a managing director at large MLP investor Advisory Research Inc.Additionally, Energy Transfer's bid for Williams could rise to around $70 per share, a price that would likely knock out potential bids from Kinder Morgan or Enterprise, analysts at Credit Suisse said in a note to clients.A spokesman for Kinder Morgan declined to comment. A spokesman for Enterprise Products Partners declined to comment. Williams already has its own plan to acquire its Williams Partners MLP in a $14 billion deal that is expected to close in the fall..The proposed Energy Transfer deal requires that Williams' own deal would be scuttled, the Dallas company said in release late on Sunday. Williams said it is committed to moving its plan forward as its board looks at all strategic options.The offer drove shares of Williams up 24 percent on Monday to $60. Williams is a major pipeline operator in the Marcellus and Utica shale plays in the Northeastern U.S. and has operations in other shale fields in Texas and Louisiana. DEAL STRUCTURE ETE Corp, the newly created entity that aims to acquire Williams in a tax-free deal, offers Williams shareholders the possibility of higher dividends and cash flow diversification, according to Energy Transfer.Stakeholders in Energy Transfer Equity will benefit with an immediate boost to the cash flows paid out to investors, the Dallas-based company said.""Not only does the structure of the deal maximize the tax advantage of the acquisition for Energy Transfer Equity, but also we believe that both cost and commercial synergies could be substantial,"" analysts at Raymond James said in a note to clients on Monday.Williams' proposal to go it alone might not offer the best value to its investors, said Kiley.""The proposed transaction (with Energy Transfer) is going to provide them with some synergies and provide them with some cost reductions,"" said Kiley. ""Whether or not they can deliver the same value over the near term like this offer does is up for debate,"" he said.   (Additional reporting by Kristen Hays in Houston and Kanika Sikka and Sneha Banerjee in Bengaluru; Editing by Bernard Orr)",2015-06-22,WMB,"Mon Jun 22, 2015 | 4:27pm EDT",Energy Transfer offer may be Williams' best option -analysts,http://www.reuters.com//article/williams-energytransfer-structure-idUSL1N0Z812P20150622?type=companyNews
28,"  (Adds Sequential Brands, Mediclinic International, Bouygues, Anthem Inc, Etisalat, Paladin Energy, Seplat, Telenor; updates Lone Star)June 22 The following bids, mergers, acquisitions and disposals were reported by 2000 GMT on Monday:** Energy Transfer Equity LP confirmed it had made a $48 billion unsolicited bid for natural gas pipeline company Williams Cos Inc, hours after Williams rejected the offer as significantly too low.** U.S. health insurer Anthem Inc said it is committed to buying Cigna Corp, adding that it had found $2 billion in cost synergies within two years, after the smaller rival publicly rejected the deal.Anthem's CEO Joseph Swedish said the company has looked closely at how antitrust authorities would view an acquisition of Cigna and does not see any ""substantive"" issues.** Private equity firm Lone Star Funds will buy real estate investment trust Home Properties Inc for about $7.6 billion, including debt.** European telecoms group Altice has made an offer to buy France's Bouygues Telecom through its subsidiary Numericable-SFR, the companies said.Bouygues will hold a board meeting at 1600 GMT on Tuesday to discuss Altice's offer, a source said.** South African hospitals group Mediclinic International  is buying almost a third of Britain's Spire Healthcare , entering a market it said was ripe for growth as private players account for a small fraction of the healthcare sector.** Canada has made a rare exception to its policy of requiring uranium mines be majority-owned by Canadian companies, saying on Monday it has approved an application by Australia's Paladin Energy Ltd.** Canadian investment firm Borealis Infrastructure is considering a 5 billion pound ($8 billion) bid for Severn Trent , the Sunday Times reported, two years after the British water utility rejected its previous approach.** Ireland-based aircraft lessor Fly Leasing Ltd  said it would sell 33 aircraft for $985 million this year as part of its ongoing fleet rejuvenation plan.** Homemaking maven Martha Stewart's media and merchandising firm Martha Stewart Living Omnimedia Inc is selling itself in a $353 million cash-and-stock deal to Sequential Brands Group Inc. ** Cypress Semiconductor Corp raised its offer to buy Integrated Silicon Solution Inc to $22.25 per share, its latest salvo in a prolonged bidding war for the chipmaker with Chinese consortium Uphill Investment Co.** EU antitrust regulators will this week warn Norwegian telecoms company Telenor and Sweden's TeliaSonera  about the adverse impact of their plan to combine forces in Denmark, two people familiar with the matter said.** Russia's Uralkali, the world's biggest potash producer, may delist its shares and merge with Russian shareholder Uralchem, Vedomosti daily newspaper reported, quoting five sources.** Japan's Softbank Corp, together with Bharti Enterprises and Taiwan's Foxconn, will invest about $20 billion in solar projects in India, in one of the biggest investment pledges to date in the country's renewable energy sector.** GlaxoSmithKline has agreed to sell two meningitis vaccines to Pfizer Inc to satisfy antitrust concerns after its recent acquisition of the vaccines business of Novartis. ** European private equity fund CVC and Singaporean sovereign wealth fund Temasek are to buy a controlling stake in the pharmaceutical firm Alvogen, its chairman and chief executive said.** Brazil's JBS SA, the world's largest meat packer, has agreed to pay about $1.5 billion for Moy Park Ltd, the British unit of rival Marfrig Global Foods SA, JBS and Marfrig announced on Sunday.** Chipmaker Advanced Micro Devices Inc is at the initial stage of reviewing whether to split itself in two or spin off a business, seeking to reverse its fortunes and take on rival Intel Corp, according to three people familiar with the matter.** Ferrero, the maker of Nutella spread, has offered to buy British chocolate company Thorntons Plc for 112 million pounds ($177.6 million), a rare acquisition by the Italian group.** South African investment house Remgro Ltd has offered 431.7 million pounds ($686 million) for almost a third of Britain's Spire Healthcare, it said.** Israel's Delek Group said on Sunday it had agreed to sell its 52.31 percent stake in insurer Phoenix Holdings to China's Fosun International for 1.8 billion shekels ($469.7 million). ** Global miner Rio Tinto  has agreed to combine its heavy mineral sands prospects in Mozambique with those of small developer Savannah Resources.** Venezuelan state oil company PDVSA said on Sunday it had signed a raft of investment agreements with top Russian oil producer Rosneft, including a plan to create a joint venture to produce natural gas in the South American country.** Zijin Mining Group  launched a bid for Australian gold explorer Phoenix Gold, the Chinese company's third planned acquisition of a foreign mining asset in less than a month.** Telus Corp  and Rogers Communications Inc   are looking to acquire wireless telecommunications provider Mobilicity, and the Canadian government is expected to approve a deal with one of the suitors, the Globe and Mail reported, citing copies of two opinion letters obtained from Industry Canada.** Agility said a unit of the Kuwaiti logistics firm had agreed with a real estate subsidiary of National Real Estate Company to invest $225 million in a shopping mall in Abu Dhabi.** Air New Zealand has agreed to sell its SAFE Air maintenance business to an Australian unit of Airbus Group  for an undisclosed sum, the national carrier said.** Nigeria's new government should sell its stakes in joint ventures in the country's energy industry, the chairman of Seplat Petroleum said, adding his company would be interested in buying, especially in the gas sector.** Kuoni said it is selling its tour operators, specialists and travel agencies in Britain, Switzerland, Scandinavia, Finland and Benelux to German retailer Rewe  for an undisclosed price.** Mexico's personal care product maker Genomma Lab said it had reached a deal to sell a controlling stake in distributor unit Grupo Marzam to a private fund for 1.35 billion Mexican pesos ($88.31 million).** Etisalat, the United Arab Emirates' former telecoms monopoly, said restrictions on who could own its shares would be partly lifted, opening the Gulf state's largest stock to foreign and institutional ownership for the first time.    ($1 = 0.63 pounds) ($1 = 3.83 shekels) ($1 = 15.2868 Mexican pesos)   (Compiled by Anannya Pramanick and Yashaswini Swamynathan in Bengaluru)",2015-06-22,WMB,"Mon Jun 22, 2015 | 4:01pm EDT",Deals of the day- Mergers and acquisitions,http://www.reuters.com//article/deals-day-idUSL3N0Z830020150622?type=companyNews
29,"   By Ismail Shakil  Energy Transfer Equity LP confirmed it had made a $48 billion unsolicited bid for natural gas pipeline company Williams Companies Inc, hours after Williams rejected the offer as significantly too low.Energy Transfer Equity (ETE), an energy assets portfolio company, said its all-stock offer of 0.9358 shares per Williams' share represented a 32 percent premium to the stock's closing price of $48.34 on June 19.Williams said in a statement on Sunday that the unsolicited proposal had prompted it to launch a review of strategic alternatives, with the assistance of Barclays and Lazard, but the current offer ""significantly undervalues"" the company.ETE said its offer is contingent on the termination of Williams' pending purchase of Williams Partners, which gathers, processes and transports natural gas.  ETE made multiple attempts over almost six months to talk to senior management at Williams about a merger and made an initial offer on May 19, six days after the pipeline company said it would buy Williams Partners for $13.8 billion.The deal is valued at $53.1 billion, including debt and other liabilities, and would be tax-free to Williams' stockholders, ETE said in a statement. The deal value of $48 billion is based on the number of Williams' shares outstanding as of April 27.Williams could not be reached for comment outside regular U.S. business hours. A person familiar with the matter confirmed to Reuters on Sunday that ETE was behind the offer for Williams Co.Shares of ETE closed at $68.39 on the New York Stock Exchange on Friday, having risen 19.2 percent this year.Williams shares were up about 7 percent this year, as of Friday's close.",2015-06-22,WMB,"Mon Jun 22, 2015 | 2:00pm EDT",ETE confirms $48 billion bid for reluctant Williams Co,http://www.reuters.com//article/us-williams-de-m-a-idUSKBN0P110P20150622?type=companyNews
