,Article,Date,Symbol,Time,Title,Url
55,"   By Michael Erman and Mike Stone  Williams Companies Inc (WMB.N) sued Energy Transfer Equity LP (ETE.N) and its Chief Executive Kelcy Warren on Wednesday, claiming they violated the U.S. pipeline companies' merger agreement by making a private preferred share offering to ETE's top investors.Williams argued that the offering in March, which prompted a public rift between the companies, was designed to siphon money to Warren and away from Williams and ETE shareholders.""Warren devised the special offering as a means to shield his own personal financial interests in ETE - namely, the distributions he stands to receive from ETE on his ETE common units - from the economic uncertainty that has been facing ETE in recent months,"" Williams said in a lawsuit filed in a Texas district court.Another Williams lawsuit filed against ETE on Wednesday, in the Delaware Court of Chancery, remains under seal.Williams, based in Tulsa, Oklahoma, said in a statement it was committed to the nearly $14 billion deal and hoped to hold a stockholder vote to close it as soon as possible.The offering at the center of the lawsuit effectively protects Warren and other top shareholders from a cut in distributions by ETE, a master limited partnership.The offering to top investors, which ETE said would help it pay down debt from the merger, would provide convertible units in exchange for a temporary cut in distributions. These investors would eventually receive equity in exchange for the convertible units even if other ETE shareholders had their distributions reduced. Energy Transfer said in a filing with the Securities and Exchange Commission that it would vigorously defend itself against the lawsuits. It said it believes that it has complied, and intends to comply, with its obligations under the merger agreement.Dallas billionaire Warren is ETE's largest shareholder and controls the company through its general partner. He received more than $200 million in distributions from the company over the last year.He set his sights on Williams last year in order to transform his empire into one of the biggest pipeline networks in the world but the timing was poor. A prolonged drop in oil and gas prices has made the deal more difficult to finance and to justify to shareholders. ETE would need to take on a heavy debt load to fund the $6 billion cash portion of the deal. Williams said in the Texas lawsuit that ETE has looked into how it might be able to walk away from the merger even though the terms do not allow that.ETE has also fired its chief financial officer and slashed projections for cost savings from the Williams tie-up, making investors highly skeptical about whether the deal would close.""The news stream around this deal over the last several months has not been constructive,"" Quinn Kiley, managing director at Advisory Research Inc, which owned around 9 million ETE shares and 3.7 million Williams shares as of the end of 2015. ""It's hurt holders on either side, and created a negative spin cycle.""Williams shareholders, who will receive mostly ETE stock for their shares if the deal is completed, have yet to vote on the deal. ETE said in March it had originally intended to offer the preferred units to all of its shareholders, but Williams did not consent to a public offering. ETE said it did not ask Williams for its consent on the private offering.Shareholders including Warren, who hold around 31.5 percent of Energy Transfer's units, participated in the offering and agreed to take smaller distributions for up to nine quarters.Other shareholders participating in the offering include Energy Transfer's President Jon McReynolds and Chief Commercial Officer Marshall ""Mackie"" McCrea, according to SEC filings.Shares of Williams rose 68 cents, or 4.6 percent, at $15.49, while ETE shares rose 49 cents, or 7.6 percent, to $6.94. (Additional reporting by Tom Hals in Delaware and Amrutha Gayathri in Bengaluru; Editing by Meredith Mazzilli and Richard Chang)",2016-04-06,WMB,"Wed Apr 6, 2016 | 5:21pm EDT",Williams sues ETE and CEO Warren over share offering,http://www.reuters.com//article/us-williams-de-m-a-energy-us-idUSKCN0X31NR?type=companyNews
56,"   By Michael Erman and Mike Stone  Williams Companies Inc (WMB.N) sued Energy Transfer Equity LP (ETE.N) and its Chief Executive Kelcy Warren on Wednesday, claiming they violated the U.S. pipeline companies' merger agreement by making a private preferred share offering to ETE's top investors.Williams argued that the offering in March, which prompted a public rift between the companies, was designed to siphon money to Warren and away from Williams and ETE shareholders.""Warren devised the special offering as a means to shield his own personal financial interests in ETE - namely, the distributions he stands to receive from ETE on his ETE common units - from the economic uncertainty that has been facing ETE in recent months,"" Williams said in a lawsuit filed in a Texas district court.Another Williams lawsuit filed against ETE on Wednesday, in the Delaware Court of Chancery, remains under seal.Williams, based in Tulsa, Oklahoma, said in a statement it was committed to the nearly $14 billion deal and hoped to hold a stockholder vote to close it as soon as possible.The offering at the center of the lawsuit effectively protects Warren and other top shareholders from a cut in distributions by ETE, a master limited partnership.The offering to top investors, which ETE said would help it pay down debt from the merger, would provide convertible units in exchange for a temporary cut in distributions. These investors would eventually receive equity in exchange for the convertible units even if other ETE shareholders had their distributions reduced. Energy Transfer said in a filing with the Securities and Exchange Commission that it would vigorously defend itself against the lawsuits. It said it believes that it has complied, and intends to comply, with its obligations under the merger agreement.Dallas billionaire Warren is ETE's largest shareholder and controls the company through its general partner. He received more than $200 million in distributions from the company over the last year.He set his sights on Williams last year in order to transform his empire into one of the biggest pipeline networks in the world but the timing was poor. A prolonged drop in oil and gas prices has made the deal more difficult to finance and to justify to shareholders. ETE would need to take on a heavy debt load to fund the $6 billion cash portion of the deal. Williams said in the Texas lawsuit that ETE has looked into how it might be able to walk away from the merger even though the terms do not allow that.ETE has also fired its chief financial officer and slashed projections for cost savings from the Williams tie-up, making investors highly skeptical about whether the deal would close.""The news stream around this deal over the last several months has not been constructive,"" Quinn Kiley, managing director at Advisory Research Inc, which owned around 9 million ETE shares and 3.7 million Williams shares as of the end of 2015. ""It's hurt holders on either side, and created a negative spin cycle.""Williams shareholders, who will receive mostly ETE stock for their shares if the deal is completed, have yet to vote on the deal. ETE said in March it had originally intended to offer the preferred units to all of its shareholders, but Williams did not consent to a public offering. ETE said it did not ask Williams for its consent on the private offering.Shareholders including Warren, who hold around 31.5 percent of Energy Transfer's units, participated in the offering and agreed to take smaller distributions for up to nine quarters.Other shareholders participating in the offering include Energy Transfer's President Jon McReynolds and Chief Commercial Officer Marshall ""Mackie"" McCrea, according to SEC filings.Shares of Williams rose 68 cents, or 4.6 percent, at $15.49, while ETE shares rose 49 cents, or 7.6 percent, to $6.94. (Additional reporting by Tom Hals in Delaware and Amrutha Gayathri in Bengaluru; Editing by Meredith Mazzilli and Richard Chang)",2016-04-06,WMB,"Wed Apr 6, 2016 | 5:21pm EDT",UPDATE 3-Williams sues ETE and CEO Warren over share offering,http://www.reuters.com//article/williams-de-ma-energy-us-idUSL3N1793PH?type=companyNews
57,"  April 6 Williams Companies Inc has sued Energy Transfer Equity LP to block a private preferred share offering disclosed last month, saying it was a breach of their merger agreement.The offering provides certain Energy Transfer investors preferential treatment on its distributions, Williams said in a statement.  Williams also said it was suing Kelcy Warren, chairman of the general partner of Energy Transfer.   (Reporting by Amrutha Gayathri in Bengaluru; Editing by Anupama Dwivedi) ",2016-04-06,WMB,"Wed Apr 6, 2016 | 9:35am EDT",Williams sues Energy Transfer over preferred share offering,http://www.reuters.com//article/williams-de-ma-energy-us-idUSL3N1793MS?type=companyNews
58,"  Energy Transfer Equity LP (ETE.N) and Williams Companies Inc (WMB.N) agreed on Tuesday to change an administrative requirement for their $20 billion-deal to give U.S. regulators additional time to complete their review of the tie-up.The new timeline may give Energy Transfer time to renegotiate terms of the deal ahead of June 28 - the deadline for the deal to close, people familiar with the matter told Reuters on Monday.The companies said in a regulatory filing on Tuesday that the Securities and Exchange Commission had requested additional information about the deal to be included in the proxy statement, which the companies may not mail to shareholders before the SEC completes its review.Williams shareholders need to vote on the transaction, and the SEC must sign off on the proxy statement before it is sent out to shareholders and a date is set for the vote. The companies agreed to shorten the period between when the proxy and form of election are sent and when the deal can close. The form of election allows Williams shareholders to choose whether they want cash or stock for their shares.Energy Transfer chief executive Kelcy Warren, a Dallas billionaire, set his sights on Williams last year to transform his empire into one of the biggest pipeline networks in the world. However, a prolonged drop in oil and gas prices has made the deal less economically attractive. Williams is suing ETE in Delaware to stop a controversial offering of preferred shares to its top shareholders. It has also sued Energy Transfer's Warren in Texas over the same offering. Williams has alleged that ETE is looking into ways to walk away from the tie-up even though the terms of the deal would not allow that.  The latest obstacle to the deal arose last month, when Energy Transfer said its lawyers may not be able to deliver a tax opinion needed to close the deal. Williams disagrees with the position Energy Transfer's lawyers have taken on the tax issue. (Reporting by Michael Erman in New York and Swetha Gopinath in Bengaluru; Editing by Sayantani Ghosh and Chizu Nomiyama)",2016-05-03,WMB,"Tue May 3, 2016 | 8:46am EDT","ETE, Williams give SEC more time to review their deal",http://www.reuters.com//article/us-williams-m-a-energytransfer-idUSKCN0XU13M?type=companyNews
59,"  May 3 Energy Transfer Equity LP* Co and Williams agreed to eliminate standalone requirement for energy transfer to mail form of election* On may 1, 2016, Williams Companies Inc and ETE entities entered into amendment no. 1 to merger agreement * Election form to be mailed to Williams stockholders on date of proxy statement related to stockholder meeting * Amendment changes deadline for receipt of form of election to earlier of 20 business days after mailing of form of election * Energy transfer, Williams continuing to jointly develop appropriate revisions to proxy statement to address SEC requests  Source text for Eikon:  Further company coverage:    (Bengaluru Newsroom: +1-646-223-8780)",2016-05-03,WMB,"Tue May 3, 2016 | 6:32am EDT","BRIEF-Energy Transfer Equity, Williams Companies enter amendment no. 1 to merger agreement",http://www.reuters.com//article/idUSFWN1800FF?type=companyNews
60,"   By Mike Stone  Energy Transfer Equity LP (ETE.N) is taking steps that may enable it to renegotiate its $20 billion cash-and-stock acquisition of Williams Companies Inc (WMB.N), according to people familiar with the matter.Dallas billionaire Kelcy Warren, the chief executive of Energy Transfer, set his sights on Williams last year to transform his empire into one of the biggest pipeline networks in the world. However, a prolonged drop in oil and gas prices has made the deal less economically attractive.Energy Transfer and Williams are in talks to reduce the number of days specified for completing some of the deal's administrative requirements, the people said.This would give them time to engage in renegotiation of terms ahead of a June 28 deadline for the deal to close, the people added.There is no certainty that such renegotiation talks will occur, let alone be successful, the people cautioned.  The sources asked not to be identified because the deliberations are confidential. Energy Transfer and Williams declined to comment.Another marquee deal that suffered as result of lower energy prices, U.S. oilfield services provider Halliburton Inc's (HAL.N) $28 billion acquisition of peer Baker Hughes Inc (BHI.N), was pulled on Sunday after it faced objections from antitrust watchdogs.  The latest development comes after Energy Transfer said in April its lawyers may not be able to deliver an important tax opinion for its takeover of Williams, throwing the agreed acquisition into doubt. Since the takeover was announced in September 2015, Energy Transfer launched a controversial offering of preferred shares to its top shareholders, for which it is currently being sued by Williams. Energy Transfer has also fired its chief financial officer and slashed projections for cost savings from the Williams deal. Energy Transfer said last March it expected the base case for earnings before interest, taxes, depreciation and amortization from commercial synergies from the deal to be about $170 million a year by 2020, compared with previous forecasts of more than $2 billion when the deal was unveiled. The size of the deal has also shrunk to about $20 billion from an original $37.7 billion. In another sign of the deal's troubles, Williams has yet to schedule a vote for its shareholders to approve the transaction with Energy Transfer. Another administrative hurdle is managing how Williams shareholders will be paid for their shares once they elect to receive cash or stock. Energy Transfer would need to take on a heavy debt load to fund the $6 billion cash portion of the deal under the existing terms. Williams said in its lawsuit last month that Energy Transfer has looked into how it might be able to walk away from the merger even though the terms do not allow that. (Reporting by Mike Stone in New York; Editing by Cynthia Osterman, Diane Craft and Andrew Hay)",2016-05-03,WMB,"Mon May 2, 2016 | 9:34pm EDT",Exclusive: Energy Transfer in effort to renegotiate deal with Williams - sources,http://www.reuters.com//article/us-williams-m-a-energytransfer-exclusive-idUSKCN0XT232?type=companyNews
61,"  May 4 Williams Companies Inc* Williams Companies reports first quarter 2016 financial results* Q1 adjusted earnings per share $0.03 * Q1 loss per share $0.09 * Q1 earnings per share view $0.22 -- Thomson Reuters I/B/E/S * Is committed to mailing proxy statement, holding stockholder vote and closing ete transaction ""as soon as possible""  Source text for Eikon:  Further company coverage:",2016-05-04,WMB,"Wed May 4, 2016 | 4:38pm EDT",BRIEF-Williams Companies Inc Q1 adjusted EPS $0.03,http://www.reuters.com//article/idUSASC08MWL?type=companyNews
62,"  Williams Companies Inc (WMB.N) said it has filed a lawsuit against Energy Transfer Equity LP (ETE.N) to prevent it from terminating its once-coveted deal for Williams.Under the lawsuit filed in the Delaware Court of Chancery, Williams seeks to stop ETE from relying on any failure to close the deal by the June 28 deadline.The latest development comes after Energy Transfer said in April its lawyers may not be able to deliver an important tax opinion for its takeover of Williams, throwing the agreed acquisition into doubt.The lawsuit seeks to also prevent the pipeline company from avoiding its obligations in the event it fails to obtain the tax opinion. Energy Transfer chief executive Kelcy Warren, a Dallas billionaire, set his sights on Williams last year to transform his empire into one of the biggest pipeline networks in the world. However, a prolonged drop in oil and gas prices has made the deal less economically attractive.Williams' board continues to recommend the merger announced in September last year, the company said on Friday. Tulsa, Oklahoma-based Williams had also filed a suit earlier against ETE in Delaware to stop a controversial offering of preferred shares to its top shareholders. It has also sued Energy Transfer's Warren in Texas over the same offering.Williams has alleged that ETE is looking into ways to walk away from the tie-up even though the terms of the deal would not allow that. Energy Transfer Equity was not immediately available for comment outside regular U.S. business hours. (Reporting by Aurindom Mukherjee in Bengaluru; Editing by Richard Borsuk)",2016-05-14,WMB,"Fri May 13, 2016 | 10:54pm EDT",Williams files suit to prevent Energy Transfer from terminating deal,http://www.reuters.com//article/us-williams-m-a-energy-us-idUSKCN0Y502J?type=companyNews
63,"  Williams Companies Inc (WMB.N) said it has filed a lawsuit against Energy Transfer Equity LP (ETE.N) to prevent it from terminating its once-coveted deal for Williams.Under the lawsuit filed in the Delaware Court of Chancery, Williams seeks to stop ETE from relying on any failure to close the deal by the June 28 deadline.The latest development comes after Energy Transfer said in April its lawyers may not be able to deliver an important tax opinion for its takeover of Williams, throwing the agreed acquisition into doubt.The lawsuit seeks to also prevent the pipeline company from avoiding its obligations in the event it fails to obtain the tax opinion. Energy Transfer chief executive Kelcy Warren, a Dallas billionaire, set his sights on Williams last year to transform his empire into one of the biggest pipeline networks in the world. However, a prolonged drop in oil and gas prices has made the deal less economically attractive.Williams' board continues to recommend the merger announced in September last year, the company said on Friday. Tulsa, Oklahoma-based Williams had also filed a suit earlier against ETE in Delaware to stop a controversial offering of preferred shares to its top shareholders. It has also sued Energy Transfer's Warren in Texas over the same offering.Williams has alleged that ETE is looking into ways to walk away from the tie-up even though the terms of the deal would not allow that. Energy Transfer Equity was not immediately available for comment outside regular U.S. business hours. (Reporting by Aurindom Mukherjee in Bengaluru; Editing by Richard Borsuk)",2016-05-14,WMB,"Fri May 13, 2016 | 10:54pm EDT",Williams files suit to prevent Energy Transfer from terminating deal,http://www.reuters.com//article/williams-ma-energy-us-idUSL3N18B024?type=companyNews
64,"  May 13 Williams Companies Inc* Williams files lawsuit seeking to prevent ETE from avoiding its obligations under merger agreement* Says board has not changed its recommendation ""for"" merger agreement executed on september 28, 2015* Lawsuit asks court to prohibit ETE from relying on any failure to close deal by current ""outside date"" of june 28, 2016 * Co alleges ETE has breached merger agreement through pattern of delay,obstruction designed to allow ete to avoid its contractual commitments * Board unanimously committed to enforcing COs' rights under agreement entered on September 28, to delivering benefits of agreement to COs' stockholders* Litigation against ETE in Delaware court of chancery seeks to unwind private offering of series a convertible preferred units * Says Delaware court of chancery has granted Williams' motion to expedite litigation* Says committed to mailing proxy statement, holding stockholder vote and closing transaction as soon as possible  Source text for Eikon:  Further company coverage:    (Bengaluru Newsroom: +1 646 223 8780)",2016-05-14,WMB,"Fri May 13, 2016 | 9:38pm EDT",BRIEF-Williams files lawsuit seeking to prevent ETE from avoiding its obligations under merger agreement,http://www.reuters.com//article/idUSASC08POL?type=companyNews
65,"  Energy Transfer Equity LP (ETE.N) said on Sunday that a lawsuit filed by Williams Companies Inc (WMB.N) to prevent ETE from terminating its once-coveted deal for Williams will lead to a delay in the buyout.ETE said that before the suit was filed, it was making progress toward clearing all comments by the U.S. Securities and Exchange Commission and finalizing a prospectus for Williams' shareholders.ETE also said that Williams has prevented it from reaching out to its board and did not respond to its requests before filing the lawsuit .The pipeline company said that it is asking the Williams board to reconsider whether it still approves of the deal given material changes since Sept. 28 last year. Dallas, Texas-based ETE said last month that its lawyers may not be able to deliver an important tax opinion for its takeover of Williams, throwing the agreed $14 billion acquisition into doubt.Williams filed a lawsuit in a Delaware court on Saturday against Energy Transfer Equity LP to prevent the company from terminating its deal for Williams. Tulsa, Oklahoma-based Williams had also filed a suit earlier against ETE in Delaware to stop a controversial offering of preferred shares to its top shareholders. It has also sued Energy Transfer's Warren in Texas over the same offering.Williams has alleged that ETE is looking into ways to walk away from the tie-up even though the terms of the deal would not allow that. Williams Companies was not available for comment outside regular U.S. business hours. (Reporting by Parikshit Mishra in Bengaluru; Editing by Alan Crosby)",2016-05-15,WMB,"Sun May 15, 2016 | 8:12pm EDT",ETE says Williams latest lawsuit will cause delay in completing deal,http://www.reuters.com//article/williams-ma-energy-idUSL2N18C0GP?type=companyNews
66,"  (Adds background)May 15 Energy Transfer Equity LP on Sunday accused its buyout target Williams Companies Inc  of filing a third lawsuit against it in an attempt to gain leverage in any future deal talks between the two pipeline companies.Williams filed its latest lawsuit in a Delaware court on Friday to prevent ETE, which has said the economics of its takeover of Williams have been altered by the fall in oil prices, from terminating that deal..""...We believe Williams' latest lawsuit is an attempt to gain undue leverage in and undermine future discussions regarding the pending merger and will only result in further delay,"" ETE Chief Executive Kelcy Warren said in a statement on Sunday.Williams on Sunday declined to comment. The company has alleged that ETE is looking into ways to walk away from the tie-up even though the terms of the deal would not allow that before June 28. Dallas-based ETE said it is asking the Williams board to reconsider whether it still recommends its shareholders approve the deal given material changes since they reached agreement on Sept. 28 for ETE to acquire Williams in a transaction originally valued at nearly $33 billion.ETE said last month that its lawyers may not be able to deliver an important tax opinion for its takeover of Williams, throwing the agreed acquisition into doubt. The company said that before the suit was filed, it was making progress towards clearing all comments by the U.S. Securities and Exchange Commission and finalizing a prospectus for Williams' shareholders.ETE also said that Williams has prevented it from reaching out to its board and did not respond to its requests before filing the lawsuit. ETE slashed its expectations from the Williams deal in March saying that cost savings could be all but wiped out by low oil prices and higher capital costs.ETE had said, in a SEC filing, that it expects the base case for earnings before interest, taxes, depreciation and amortization from commercial synergies from the deal to be about $170 million a year by 2020, compared with previous forecasts of more than $2 billion.Tulsa, Oklahoma-based Williams had also filed a suit earlier against ETE in Delaware to stop a controversial offering of preferred shares to its top shareholders. It has also sued  Warren in Texas over the same offering.    (Reporting by Parikshit Mishra in Bengaluru; Editing by Cynthia Osterman)",2016-05-16,WMB,"Sun May 15, 2016 | 9:04pm EDT",UPDATE 1-ETE says Williams filed lawsuit to gain leverage in deal talks,http://www.reuters.com//article/williams-ma-energy-idUSL2N18C0HZ?type=companyNews
