,Article,Date,Symbol,Time,Title,Url
36,"   By Jonathan Stempel and Anya George Tharakan  Elaine Wynn, former wife of Wynn Resorts Ltd (WYNN.O) founder Steve Wynn, sued him on Monday to get control over her nearly 10 percent stake, worth close to $900 million, in the casino company.Escalating a battle that followed a bitter divorce, Elaine Wynn said Steve Wynn breached a 2010 stockholder agreement by engineering her ouster from the company's board last April after she faulted its internal controls, his alleged withholding of information from the board, and the ""tone at the top.""In papers filed with a state court in Clark County, Nevada, Elaine Wynn is seeking to void the agreement so she can take control of her Wynn Resorts stake, plan her estate to benefit her daughters, and stop Steve Wynn from misusing the agreement to exert ""full and perpetual control"" over her life and legacy.Elaine Wynn controls 9.4 percent of Wynn Resorts' stock, while Steve Wynn controls 11.8 percent, Reuters data show.Steve Wynn, through a spokesman, called Elaine Wynn ""a disappointed ex-wife who is seeking to tarnish the reputation of Wynn Resorts and Steve Wynn and their daughters,"" and said her lawsuit was ""filled with lies and distortions.""In a separate statement, Wynn Resorts accused Elaine Wynn of making ""falsehoods and distortions,"" and said her allegations that the company misused assets were without merit. Wynn Resorts controls properties including the Wynn Las Vegas resort, Encore at Wynn Las Vegas and Wynn Macau.Steve Wynn, 74, also helped develop other Las Vegas hotels including the Bellagio, the Mirage and Treasure Island.He is worth $2.7 billion, while Elaine Wynn, 73, is worth $1.5 billion, according to Forbes magazine. The Wynns married in 1963, divorced in 1986, remarried in 1991, and divorced again in 2010, court papers show.Elaine Wynn's lawsuit also names as defendants Wynn Resorts and General Counsel Kimmarie Sinatra.It seeks compensatory and punitive damages, including for Steve Wynn's alleged failure to support Elaine Wynn's reelection to the board. The lawsuit was filed as a counterclaim to a 2012 lawsuit by Wynn Resorts against defendants including Kazuo Okada, a Japanese billionaire.Okada owned 20 percent of Wynn Resorts before the company forcibly redeemed his stake in 2012. He and Wynn Resorts have traded allegations of illegal conduct in later U.S. litigation.Wynn Resorts shares closed down 64 cents at $92.83 in Monday trading on the Nasdaq.The case is Wynn Resorts Ltd v Okada et al, Nevada District Court, Clark County, No. A-12-656710-B. (Reporting by Jonathan Stempel and Anya George Tharakan in Bengaluru; Editing by Kirti Pandey and David Gregorio)",2016-03-28,WYNN,"Mon Mar 28, 2016 | 5:27pm EDT",Elaine Wynn sues for control of her Wynn Resorts stock,http://www.reuters.com//article/us-wynn-lawsuit-idUSKCN0WU1MU?type=companyNews
37,"   By Jonathan Stempel and Anya George Tharakan  Elaine Wynn, former wife of Wynn Resorts Ltd (WYNN.O) founder Steve Wynn, sued him on Monday to get control over her nearly 10 percent stake, worth close to $900 million, in the casino company.Escalating a battle that followed a bitter divorce, Elaine Wynn said Steve Wynn breached a 2010 stockholder agreement by engineering her ouster from the company's board last April after she faulted its internal controls, his alleged withholding of information from the board, and the ""tone at the top.""In papers filed with a state court in Clark County, Nevada, Elaine Wynn is seeking to void the agreement so she can take control of her Wynn Resorts stake, plan her estate to benefit her daughters, and stop Steve Wynn from misusing the agreement to exert ""full and perpetual control"" over her life and legacy.Elaine Wynn controls 9.4 percent of Wynn Resorts' stock, while Steve Wynn controls 11.8 percent, Reuters data show.Steve Wynn, through a spokesman, called Elaine Wynn ""a disappointed ex-wife who is seeking to tarnish the reputation of Wynn Resorts and Steve Wynn and their daughters,"" and said her lawsuit was ""filled with lies and distortions.""In a separate statement, Wynn Resorts accused Elaine Wynn of making ""falsehoods and distortions,"" and said her allegations that the company misused assets were without merit. Wynn Resorts controls properties including the Wynn Las Vegas resort, Encore at Wynn Las Vegas and Wynn Macau.Steve Wynn, 74, also helped develop other Las Vegas hotels including the Bellagio, the Mirage and Treasure Island.He is worth $2.7 billion, while Elaine Wynn, 73, is worth $1.5 billion, according to Forbes magazine. The Wynns married in 1963, divorced in 1986, remarried in 1991, and divorced again in 2010, court papers show.Elaine Wynn's lawsuit also names as defendants Wynn Resorts and General Counsel Kimmarie Sinatra.It seeks compensatory and punitive damages, including for Steve Wynn's alleged failure to support Elaine Wynn's reelection to the board. The lawsuit was filed as a counterclaim to a 2012 lawsuit by Wynn Resorts against defendants including Kazuo Okada, a Japanese billionaire.Okada owned 20 percent of Wynn Resorts before the company forcibly redeemed his stake in 2012. He and Wynn Resorts have traded allegations of illegal conduct in later U.S. litigation.Wynn Resorts shares closed down 64 cents at $92.83 in Monday trading on the Nasdaq.The case is Wynn Resorts Ltd v Okada et al, Nevada District Court, Clark County, No. A-12-656710-B. (Reporting by Jonathan Stempel and Anya George Tharakan in Bengaluru; Editing by Kirti Pandey and David Gregorio)",2016-03-28,WYNN,"Mon Mar 28, 2016 | 5:27pm EDT",UPDATE 1-Elaine Wynn sues for control of her Wynn Resorts stock,http://www.reuters.com//article/wynn-lawsuit-idUSL3N1703JM?type=companyNews
38,"  March 28 Wynn Resorts Ltd Chief Executive Steve Wynn's ex-wife Elaine Wynn has sued the billionaire casino mogul, accusing him of preventing her from exercising her rights as the company's stockholder and orchestrating her ouster from its board.Elaine, who owned 9.4 percent of Wynn Resorts' shares as of Feb. 18, has also named the company's general counsel, Kimmarie Sinatra, as a defendant in her complaint filed in the Nevada State Court.Elaine was ousted from Wynn Resorts' board in retaliation for ""asking questions about the 'tone at the top,' the absence of appropriate internal controls, the withholding of information from the board and the reckless activity of the CEO and others in the company,"" she said in a statement on Monday. Wynn Resorts shares were down slightly at $93.02 in late afternoon trading. ""This lawsuit is filled with lies and distortions and is an embarrassment to Ms. Wynn and her counsel,"" Steve Wynn said in a statement. Elaine said she would seek damages from Steve Wynn for breaching obligations under her shareholder agreement, including his failure to support her re-nomination and re-election to the board.   (Reporting by Anya George Tharakan in Bengaluru; Editing by Kirti Pandey)",2016-03-28,WYNN,"Mon Mar 28, 2016 | 3:47pm EDT",Wynn Resorts CEO's ex-wife sues for control of her shares in company,http://www.reuters.com//article/wynn-lawsuit-idUSL3N1703HB?type=companyNews
39,  March 28 Wynn Resorts Ltd* Statement from Wynn Resorts in response to Elaine Wynn's recent filing  * Says allegations made by Elaine Wynn that company would hide any relevant activities from regulators are patently false  Source text for Eikon:  Further company coverage: ,2016-03-28,WYNN,"Mon Mar 28, 2016 | 3:14pm EDT",BRIEF-Wynn Resorts statement in response to Elaine Wynn's recent filing,http://www.reuters.com//article/idUSFWN1700A6?type=companyNews
40,  March 28 Steve Wynn: * Wynn Resorts CEO Steve Wynn refutes Elaine Wynn's recent filing of complaint to gain control of wynn stock  Source text for Eikon:  Further company coverage:    (Bengaluru Newsroom: +1-646-223-8780)  ,2016-03-28,WYNN,"Mon Mar 28, 2016 | 2:43pm EDT",BRIEF-Steve Wynn refutes Elaine Wynn's recent filing,http://www.reuters.com//article/idUSFWN1700A3?type=companyNews
41,  April 5 Wynn Resorts Ltd * Steve Wynn issues statement  Source text for Eikon:  Further company coverage:    (Bengaluru Newsroom: +1-646-223-8780)  ,2016-04-05,WYNN,"Tue Apr 5, 2016 | 5:47pm EDT",BRIEF-Steve Wynn issues statement,http://www.reuters.com//article/idUSFWN1780QQ?type=companyNews
42,  April 20 Elaine Wynn: * Filed in Nevada Clark County court motion to compel further deposition of former Nevada governor and Wynn Resorts director Robert Miller  Source text for Eikon:  Further company coverage:  ,2016-04-20,WYNN,"Wed Apr 20, 2016 | 10:32am EDT",BRIEF-Elaine Wynn files motion for further deposition of Robert Miller,http://www.reuters.com//article/idUSFWN17N0LP?type=companyNews
