,Article,Date,Symbol,Time,Title,Url
6,"   By Alexia Shurmur | LAS VEGAS  LAS VEGAS A Nevada state judge ruled on Friday that a civil lawsuit between Wynn Resorts (WYNN.O) and Japanese billionaire Kazuo Okada could proceed, rejecting the U.S. government's request to keep it on hold for another six months to protect the identity of witnesses in a criminal probe into Okada's business in the Philippines.In requesting a third, six-month ""stay of discovery,"" Department of Justice attorney Laura Perkins told a hearing that allowing the civil case to proceed risked causing ""irreparable harm if the witnesses' identities are revealed.""Clark County District Judge Elizabeth Gonzales, who had already granted two previous motions suspending the civil proceedings for a total of 12 months, said the U.S. government had already been given enough time.""I'm tired of waiting. It's been a year,"" Gonzales said, adding that she hoped her ruling would prompt the government to accelerate its criminal investigation.She did, however, grant the government's request to have the names of anyone cooperating with the investigation redacted in court files. The existing stay of discovery - the process by which parties in a lawsuit exchange information and evidence - is due to expire on May 5.A spokesman for Wynn declined to comment.No representative for Universal Entertainment Corp (6425.T), the Japanese gaming machine maker founded by Okada and the company at the heart of government's criminal investigation, could be reached for comment. For more than two years, Okada has been locked in a legal battle with Wynn Chief Executive Steve Wynn, during which the former business partners have exchanged allegations of illegal conduct.Wynn forcibly redeemed Okada's 20 percent stake in the U.S. casino operator in 2012 at a discount, alleging Okada had made improper payments to Philippine government officials to advance his planned $2 billion casino project there. Wynn's civil lawsuit against Okada centers on allegations that Okada breached his fiduciary duties as a director in making those payments. Okada has denied any wrongdoing and filed a counterclaim to nullify the share redemption.The U.S. criminal investigation is focused on $40 million in payments made by Universal affiliates to a consultant in the Philippines in 2010.The payments, which were made around the same time Universal lobbied for concessions for its casino on Manila Bay, are also being investigated by the Philippine government and the Nevada gaming regulator, according to people familiar with the matter.Universal has filed a defamation suit against Reuters in Tokyo for its reporting on the $40 million payments. A Reuters spokesman said the news agency stands by its reporting.(Writing by Nathan Layne in Tokyo; Editing by Raju Gopalakrishnan)",2014-05-03,WYNN,"Fri May 2, 2014 | 11:31pm EDT","Nevada court rejects U.S. request on Okada probe, says Wynn suit can proceed",http://www.reuters.com//article/us-universalentmtwynnresorts-lawsuit-idUSBREA4201I20140503?type=companyNews
7,"   By Alexia Shurmur | LAS VEGAS  LAS VEGAS A Nevada state judge ruled on Friday that a civil lawsuit between Wynn Resorts and Japanese billionaire Kazuo Okada could proceed, rejecting the U.S. government's request to keep it on hold for another six months to protect the identity of witnesses in a criminal probe into Okada's business in the Philippines.In requesting a third, six-month ""stay of discovery,"" Department of Justice attorney Laura Perkins told a hearing that allowing the civil case to proceed risked causing ""irreparable harm if the witnesses' identities are revealed.""Clark County District Judge Elizabeth Gonzales, who had already granted two previous motions suspending the civil proceedings for a total of 12 months, said the U.S. government had already been given enough time.""I'm tired of waiting. It's been a year,"" Gonzales said, adding that she hoped her ruling would prompt the government to accelerate its criminal investigation.She did, however, grant the government's request to have the names of anyone cooperating with the investigation redacted in court files. The existing stay of discovery - the process by which parties in a lawsuit exchange information and evidence - is due to expire on May 5.A spokesman for Wynn declined to comment.No representative for Universal Entertainment Corp, the Japanese gaming machine maker founded by Okada and the company at the heart of government's criminal investigation, could be reached for comment. For more than two years, Okada has been locked in a legal battle with Wynn Chief Executive Steve Wynn, during which the former business partners have exchanged allegations of illegal conduct.Wynn forcibly redeemed Okada's 20 percent stake in the U.S. casino operator in 2012 at a discount, alleging Okada had made improper payments to Philippine government officials to advance his planned $2 billion casino project there. Wynn's civil lawsuit against Okada centers on allegations that Okada breached his fiduciary duties as a director in making those payments. Okada has denied any wrongdoing and filed a counterclaim to nullify the share redemption.The U.S. criminal investigation is focused on $40 million in payments made by Universal affiliates to a consultant in the Philippines in 2010.The payments, which were made around the same time Universal lobbied for concessions for its casino on Manila Bay, are also being investigated by the Philippine government and the Nevada gaming regulator, according to people familiar with the matter.Universal has filed a defamation suit against Reuters in Tokyo for its reporting on the $40 million payments. A Reuters spokesman said the news agency stands by its reporting.(Writing by Nathan Layne in Tokyo; Editing by Raju Gopalakrishnan)",2014-05-03,WYNN,"Fri May 2, 2014 | 11:22pm EDT","Nevada court rejects U.S. request on Okada probe, says Wynn suit can proceed",http://www.reuters.com//article/us-universalentmtwynnresorts-lawsuit-idUSBREA4201F20140503?type=companyNews
8,"   By Alexia Shurmur | LAS VEGAS  LAS VEGAS May 2 A Nevada state judge ruled on Friday that a civil lawsuit between Wynn Resorts and Japanese billionaire Kazuo Okada could proceed, rejecting the U.S. government's request to keep it on hold for another six months to protect the identity of witnesses in a criminal probe into Okada's business in the Philippines.In requesting a third, six-month ""stay of discovery,"" Department of Justice attorney Laura Perkins told a hearing that allowing the civil case to proceed risked causing ""irreparable harm if the witnesses' identities are revealed.""Clark County District Judge Elizabeth Gonzales, who had already granted two previous motions suspending the civil proceedings for a total of 12 months, said the U.S. government had already been given enough time.""I'm tired of waiting. It's been a year,"" Gonzales said, adding that she hoped her ruling would prompt the government to accelerate its criminal investigation.She did, however, grant the government's request to have the names of anyone cooperating with the investigation redacted in court files. The existing stay of discovery - the process by which parties in a lawsuit exchange information and evidence - is due to expire on May 5.A spokesman for Wynn declined to comment. No representative for Universal Entertainment Corp, the Japanese gaming machine maker founded by Okada and the company at the heart of government's criminal investigation, could be reached for comment.For more than two years, Okada has been locked in a legal battle with Wynn Chief Executive Steve Wynn, during which the former business partners have exchanged allegations of illegal conduct.Wynn forcibly redeemed Okada's 20 percent stake in the U.S. casino operator in 2012 at a discount, alleging Okada had made improper payments to Philippine government officials to advance his planned $2 billion casino project there. Wynn's civil lawsuit against Okada centres on allegations that Okada breached his fiduciary duties as a director in making those payments. Okada has denied any wrongdoing and filed a counterclaim to nullify the share redemption.The U.S. criminal investigation is focused on $40 million in payments made by Universal affiliates to a consultant in the Philippines in 2010.The payments, which were made around the same time Universal lobbied for concessions for its casino on Manila Bay, are also being investigated by the Philippine government and the Nevada gaming regulator, according to people familiar with the matter.Universal has filed a defamation suit against Reuters in Tokyo for its reporting on the $40 million payments. A Reuters spokesman said the news agency stands by its reporting.   (Writing by Nathan Layne in Tokyo; Editing by Raju Gopalakrishnan)",2014-05-03,WYNN,"Fri May 2, 2014 | 11:21pm EDT","Nevada court rejects U.S. request on Okada probe, says Wynn suit can proceed",http://www.reuters.com//article/universalentmtwynnresorts-lawsuit-idUSL3N0NP02520140503?type=companyNews
9,"  (Recasts with request for delay denied)By Elizabeth BarberBOSTON, July 2 Massachusetts gaming regulators unanimously denied a request from Boston's mayor on Wednesday to delay awarding a casino license near the city until November, saying that voters have the right to know where the casino will be built before heading to the polls.Mayor Marty Walsh had proposed putting the Boston-area casino licensing process on hold after the state's highest court ruled last week to allow a vote on whether to repeal the 2011 law that permitted three casinos to be licensed in the state. Eugene O'Flaherty, a lawyer for the city, said at the hearing on Wednesday that Boston could end up having ""needlessly expended significant amounts of money, time and effort"" trying to negotiate compensation agreements with casino giants Mohegan Sun and Wynn Resorts Ltd if voters go on to repeal the law allowing casinos.But officials on the Massachusetts Gaming Commission said state residents are entitled to know where the Boston-area casino will be built before voting in the fall. ""The voters will make their judgment with better information,"" commissioner Enrique Zuniga said.Commissioner James McHugh accused Boston of making repeated unilateral decisions in the casino licensing process, saying the city might seek to block the casino proposals regardless of the outcome of the referendum. Boston officials contend they are entitled to hold a citywide vote on casino projects in neighboring cities, which are closely linked to Boston.Voters in East Boston last year rejected a proposed casino backed by Caesars Entertainment Corp. Two casinos projects for cities abutting Boston - a Mohegan Sun development in Revere and Wynn's proposal in Everett - have since gone forward in the competition for the sole license available in eastern Massachusetts. The commission had been set to approve one of the two projects by September.Only one of the three casino licenses has been awarded, to Las Vegas developer MGM Resorts International, with formal licensing on hold pending the referendum.   (Editing by Scott Malone and Leslie Adler)",2014-07-02,WYNN,"Wed Jul 2, 2014 | 2:03pm EDT",UPDATE 1-Massachusetts denies Boston request to delay casino license,http://www.reuters.com//article/usa-gambling-massachusetts-idUSL2N0PD1KO20140702?type=companyNews
10,"   By Elizabeth Barber | BOSTON, July 2  BOSTON, July 2 Boston's mayor is due to ask Massachusetts gaming regulators on Wednesday to put off awarding a casino license near the city until November, after a statewide ballot initiative on repealing the law allowing casinos in the state.Mayor Marty Walsh proposed putting the casino licensing process on hold following a ruling last week by the state's highest court allowing a vote on whether to repeal the 2011 law that permitted three casinos to be licensed in the state. The Massachusetts Gaming Commission will hear his case and possibly vote on it at a Wednesday meeting. Walsh has said it would be a poor use of time to try to negotiate compensation agreements with casino giants Mohegan Sun and Wynn Resorts Ltd, who are each vying to build a casino in neighboring cities, if state voters go on to repeal the law allowing casinos.""Given the uncertainty of expanded gaming in Massachusetts, the city emphasized that a stay was necessary to save the City from incurring considerable expenditure of time, money, and effort in connection with the ongoing proceedings,"" the city said in a legal brief submitted to the commission. Voters in East Boston last year rejected a proposed casino backed by Caesars Entertainment Corp. Two casino projects for cities abutting Boston - a Mohegan Sun development in Revere and Wynn's proposal in Everett - have since gone forward in the competition for the sole license available in eastern Massachusetts. The commission had been set to approve one of the two projects by September.Only one of the three casino licenses has been awarded, to Las Vegas developer MGM Resorts International, with formal licensing on hold pending the referendum.   (Editing by Scott Malone and Jim Loney)",2014-07-02,WYNN,"Wed Jul 2, 2014 | 7:00am EDT",Boston mayor to ask Massachusetts to hold off on casino license,http://www.reuters.com//article/usa-gambling-massachusetts-idUSL2N0PC1UV20140702?type=companyNews
11,"  HONG KONG Macau's corruption agency said on Friday it is examining a land deal relating to Las Vegas mogul Steve Wynn's upcoming $4 billion casino in the world's biggest gambling hub.The anti-graft body is investigating after the U.S.-based International Union of Operating Engineers asked the Macau government to provide more details on how a little-known company secured rights to land before it was granted to Wynn.The land is now part of Macau's multi-billion-dollar gambling precinct known as the Cotai Strip, where Wynn's Wynn Macau Ltd is set to open its second casino resort in 2016.""The case is now under investigation,"" the anti-graft agency said in an email to Reuters, adding it was not able to comment further on the issue.Wynn, one of six licensed casino operators in the southern Chinese territory, is on track to open its opulent Wynn Palace project in the first half of 2016, featuring facilities such as a massive lake and air-conditioned gondolas. Wynn Resorts said it had not been contacted by any government agencies on the issue. ""If we were we would fully cooperate,"" the company wrote in an email to Reuters. The union, which counts hundreds of Las Vegas-based engineers among its members, has been pushing for greater transparency around Wynn's land purchases in Macau. In particular, it has expressed concern about a $50 million payment Wynn was asked to make to an entity with possible links to politically connected officials in order to establish itself on the Cotai Strip. Macau's Land, Public Works and Transport Bureau said on Wednesday the land grant followed legal procedures, according to Macau media.Wynn has said in company filings it agreed in 2008 to pay $50 million to Macau-registered Tien Chiao Entertainment and Investment Co Ltd in exchange for the company relinquishing its rights to what is now Wynn's Cotai site. Tien Chiao's identity is not clear to multiple Macau lawyers and analysts who Reuters has interviewed on the matter. The company was incorporated in October 2005, according to registry filings. The two registered company representatives are Ho Hoi, a Chinese national with a Hong Kong ID number, and Chinese national Zhang Luchuan who lives in Beijing. It has not been possible to locate either of them. (Reporting by Farah Master; Editing by Stephen Coates)",2014-07-11,WYNN,"Fri Jul 11, 2014 | 5:32am EDT",Macau graft agency probes Wynn land deal,http://www.reuters.com//article/us-wynn-macau-investigation-idUSKBN0FG0P120140711?type=companyNews
12,"  * Investigation related to $50 mln payment to little-known company* Wynn says not notified by authorities   (Includes comment from Macau corruption commission)HONG KONG, July 11 Macau's corruption agency said on Friday it is examining a land deal relating to Las Vegas mogul Steve Wynn's upcoming $4 billion casino in the world's biggest gambling hub.The anti-graft body is investigating after the U.S.-based International Union of Operating Engineers asked the Macau government to provide more details on how a little-known company secured rights to land before it was granted to Wynn.The land is now part of Macau's multi-billion-dollar gambling precinct known as the Cotai Strip, where Wynn's Wynn Macau Ltd is set to open its second casino resort in 2016. ""The case is now under investigation,"" the anti-graft agency said in an email to Reuters, adding it was not able to comment further on the issue.Wynn, one of six licensed casino operators in the southern Chinese territory, is on track to open its opulent Wynn Palace project in the first half of 2016, featuring facilities such as a massive lake and air-conditioned gondolas. Wynn Resorts said it had not been contacted by any government agencies on the issue. ""If we were we would fully cooperate,"" the company wrote in an email to Reuters.The union, which counts hundreds of Las Vegas-based engineers among its members, has been pushing for greater transparency around Wynn's land purchases in Macau. In particular, it has expressed concern about a $50 million payment Wynn was asked to make to an entity with possible links to politically connected officials in order to establish itself on the Cotai Strip. Macau's Land, Public Works and Transport Bureau said on Wednesday the land grant followed legal procedures, according to Macau media.Wynn has said in company filings it agreed in 2008 to pay $50 million to Macau-registered Tien Chiao Entertainment and Investment Co Ltd in exchange for the company relinquishing its rights to what is now Wynn's Cotai site.Tien Chiao's identity is not clear to multiple Macau lawyers and analysts who Reuters has interviewed on the matter. The company was incorporated in October 2005, according to registry filings.The two registered company representatives are Ho Hoi, a Chinese national with a Hong Kong ID number, and Chinese national Zhang Luchuan who lives in Beijing. It has not been possible to locate either of them.   (Reporting by Farah Master; Editing by Stephen Coates)",2014-07-11,WYNN,"Fri Jul 11, 2014 | 5:27am EDT",UPDATE 2-Macau graft agency probes Wynn land deal,http://www.reuters.com//article/wynn-macau-investigation-idUSL4N0PM24920140711?type=companyNews
13,"  HONG KONG, July 11 Macau's corruption agency is examining a land deal relating to Las Vegas mogul Steve Wynn's upcoming $4 billion casino in the world's biggest gambling hub, media reported on Friday.The anti-graft body is investigating after the U.S.-based International Union of Operating Engineers asked the Macau government to provide more details on how a little-known company secured rights to land before it was granted to Wynn.The land is now part of Macau's multi-billion-dollar gambling precinct known as the Cotai Strip, where Wynn's Wynn Macau Ltd is set to open its second casino resort in 2016.""We have started analysing some details (about the deal) and we are giving it full attention,"" anti-graft agency chief Vasco Fong Man Chong told reporters, according to industry publication GGRAsia.Wynn, one of six licensed casino operators in the southern Chinese territory, is on track to open its opulent Wynn Palace project in the first half of 2016, featuring facilities such as a massive lake and air-conditioned gondolas. ""We have not been contacted by any authorities but if we were we would fully cooperate,"" Wynn Macau spokeswoman Bonnie Kwok said in an email to Reuters.The union, which counts hundreds of Las Vegas-based engineers among its members, has been pushing for greater transparency around Wynn's land purchases in Macau. In particular, it has expressed concern about a $50 million payment Wynn was asked to make to an entity with possible links to politically connected officials in order to establish itself on the Cotai Strip. Macau's Land, Public Works and Transport Bureau said on Wednesday the land grant followed legal procedures, according to Macau media.Wynn has said in company filings it agreed in 2008 to pay $50 million to Macau-registered Tien Chiao Entertainment and Investment Co Ltd in exchange for the company relinquishing its rights to what is now Wynn's Cotai site. Tien Chiao's identity is not clear to multiple Macau lawyers and analysts who Reuters has interviewed on the matter. The company was incorporated in October 2005, according to registry filings.The two registered company representatives are Ho Hoi, a Chinese national with a Hong Kong ID number, and Chinese national Zhang Luchuan who lives in Beijing. It has not been possible to locate either of them.(Reporting by Farah Master; Editing by Stephen Coates)",2014-07-11,WYNN,"Fri Jul 11, 2014 | 3:39am EDT",Macau graft agency probes Wynn land deal - media,http://www.reuters.com//article/wynn-macau-investigation-idUSL4N0PM10W20140711?type=companyNews
14,"   By Scott Malone | BOSTON  BOSTON The Massachusetts Gaming Commission on Tuesday awarded a license to build a $1.6 billion casino just outside Boston to Las Vegas developer Wynn Resorts Ltd.Wynn, which aims to build a 27-story casino on the Mystic River in Everett, won a three to one commission vote over rival Mohegan Sun. It won the second of three resort-casino licenses allowed under a 2011 law legalizing casino gambling in the state.""This has been a really, really difficult decision,"" James McHugh, one of the four commissioners, told reporters. ""The two were very close together. The Wynn applicant had the edge in the economic benefits that it would provide to the community and the region.""Wynn has said that its 100,000-square foot (10,000-square meter) casino floor and 550-room hotel will employ about 4,000 people permanently. Officials said it could take three to four years to build the Everett casino, which will be located on the former site of a chemical factory.  The deal spells the end of the road for Boston's Suffolk Downs horse racing track, which was to adjoin Mohegan Sun's proposed casino and was counting on new visitors to boost its sagging fortunes.""We will be meeting with employees and horsemen over the next several days to talk about how we wind down racing operations as a 79-year legacy of thoroughbred racing in Massachusetts will be coming to an end,"" said Chip Tuttle, the track's chief operating officer. Mohegan Sun, owned by Connecticut's Mohegan tribe, operates a resort casino complex in that state that is one of the largest in the United States.The commission previously granted the right to develop a casino in Springfield, along the state's Connecticut border, to MGM Resorts International, though the formal award has been put on hold until after voters decide in November on a ballot initiative that could repeal the casino law. The commission has yet to rule on a third license, to operate a casino around the Cape Cod beach resort area.The spread of casino gambling through the northeastern United States, where New York, Pennsylvania and Maine also feature casinos, has taken a heavy toll on New Jersey's Atlantic City, which has seen four casinos close his year, most recently the Trump Plaza, which closed its doors early Tuesday morning. (Reporting by Scott Malone; Editing by Mohammad Zargham and Grant McCool)",2014-09-16,WYNN,"Tue Sep 16, 2014 | 4:17pm EDT",Wynn Resorts wins license to build casino near Boston,http://www.reuters.com//article/us-usa-gambling-massachusetts-idUSKBN0HB29120140916?type=companyNews
