,Article,Date,Symbol,Time,Title,Url
8,"  * Lowers full-year adj profit forecast to $1.07-$1.13/share* Net income falls 5 pct to $281 mln in the first quarter* Revenue falls about 2 pct to $5.12 bln   (Adds Xerox forecast, details on Lexmark, share movement)April 22 Xerox Corp cut its full-year earnings forecast as growth stalled in its services business and margins contracted due to higher investment on U.S. health insurance exchange platforms, sending its shares down about 5 percent in premarket trading.The company, which has been diversifying away from its printers and copiers, lowered its full-year adjusted profit forecast to $1.07-$1.13 per share from $1.10-$1.16.Gross margin fell to 30.2 percent in the first quarter from 30.5 percent a year earlier, hurt by a 0.7 percentage point drop in services margin. Services, which includes businesses ranging from toll systems to healthcare programs, accounts for more than half of the company's revenue.Xerox forayed into the services business with its $5.5 billion purchase of Affiliated Computer Services Inc in 2009 to counter dropping sales in its printers and copiers business.The company reported a 5 percent fall in first-quarter profit, hurt by dwindling revenue from its printing business. Net income attributable to Xerox fell to $281 million for the three months ended March 31, from $296 million a year earlier. On a per share basis, net income was flat at 23 cents.Revenue fell about 2 percent to $5.12 billion. Smaller rival Lexmark International Inc reported first-quarter adjusted earnings above analysts' average estimate, helped by higher revenue from its managed print services and software businesses.The company, however, said it expected revenue in the second quarter to decline 2-4 percent from a year earlier as the negative impact from the inkjet exit continues.Lexmark also forecast second-quarter adjusted earnings of about 85-95 cents per share, compared with $1.04 a year earlier.Xerox's shares were down at $10.47 in premarket trading while Lexmark's shares were down about 4 percent at $45.12.   (Reporting by Abhirup Roy in Bangalore; Editing by Saumyadeb Chakrabarty and Don Sebastian)",2014-04-22,XRX,"Tue Apr 22, 2014 | 8:45am EDT",UPDATE 1-Xerox cuts 2014 adj profit forecast as spending rises,http://www.reuters.com//article/xerox-results-idUSL3N0NE2YE20140422?type=companyNews
9,"  April 22 Xerox Corp reported a 5 percent fall in first-quarter profit, hurt by dwindling revenue from its printing business and slowing growth in the services unit.The net income attributable to Xerox fell to $281 million  for the three months ended March 31, from $296 million a year earlier. On a per share basis, net income was flat at 23 cents.  Total revenue fell about 2 percent to $5.12 billion.   (Reporting by Abhirup Roy in Bangalore; Editing by Saumyadeb Chakrabarty) ",2014-04-22,XRX,"Tue Apr 22, 2014 | 7:12am EDT",Xerox first-quarter profit falls 5 pct,http://www.reuters.com//article/xerox-results-idUSL3N0ND2X120140422?type=companyNews
10,"  Nevada's health insurance exchange board on Tuesday voted to transfer control over its online program from its vendor, Xerox, to the federal government's enrollment system.""The Boards unanimous decision ultimately reflects the Exchanges foremost concern: ensuring that Nevadans receive unfettered access to health insurance coverage,"" Steve Fisher, interim executive director for the Silver State Health Insurance Exchange, said in a statement announcing the move.Fisher added that ending the Xerox contract was the most fiscally sound option ""with the highest probability of success for the 2015 plan year.""According to the statement, the board's vote will not turn Nevadas state-based health insurance program over to the federally administered program, known as a Federally-Facilitated Marketplace (FFM).  Nevada Health Link will serve as a Supported State Based Marketplace, which will continue to conduct plan certification, rate review, Medicaid eligibility and Medicaid enrollment, along with marketing and outreach, it said.Nevada will also continue to oversee the Navigator program,  which aids state residents in obtaining insurance coverage. Xeroxs call center and website operations will remain in force for members now enrolled in coverage for 2014, the statement said. The system will stay available until Nov. 15 for those who qualify.The federal government will pay all costs associated with the transition from Xerox to its web site, healthcare.gov, the statement said. Nevada will incur 10 percent of the cost of the move for its Medicaid patients. In late April Oregon, whose health insurance network was  dogged by technical glitches that prevented even a single subscriber from enrolling online, opted to move its state health exchange to the federal system, although officials did not rule out the possibility of returning to a state-based exchange. (Reporting by Chris Michaud; Editing by Clarence Fernandez)",2014-05-21,XRX,"Wed May 21, 2014 | 1:31am EDT",Nevada to move online healthcare enrollment to federal site,http://www.reuters.com//article/us-usa-nevada-healthexchange-idUSKBN0E10AV20140521?type=companyNews
11,"  Nevada's health insurance exchange board on Tuesday voted to transfer control over its online program from its vendor, Xerox, to the federal government's enrollment system.""The Board's unanimous decision ultimately reflects the Exchange's foremost concern: ensuring that Nevadans receive unfettered access to health insurance coverage,"" Steve Fisher, interim executive director for the Silver State Health Insurance Exchange, said in a statement announcing the move.Fisher added that ending the Xerox contract was the most fiscally sound option ""with the highest probability of success for the 2015 plan year.""According to the statement, the board's vote will not turn Nevada's state-based health insurance program over to the federally administered program, known as a Federally-Facilitated Marketplace (FFM). Nevada Health Link will serve as a Supported State Based Marketplace, which will continue to conduct plan certification, rate review, Medicaid eligibility and Medicaid enrollment, along with marketing and outreach, it said.Nevada will also continue to oversee the Navigator program, which aids state residents in obtaining insurance coverage. Xerox's call center and website operations will remain in force for members now enrolled in coverage for 2014, the statement said. The system will stay available until November 15 for those who qualify. The federal government will pay all costs associated with the transition from Xerox to its web site, healthcare.gov, the statement said. Nevada will incur 10 percent of the cost of the move for its Medicaid patients.In late April Oregon, whose health insurance network was dogged by technical glitches that prevented even a single subscriber from enrolling online, opted to move its state health exchange to the federal system, although officials did not rule out the possibility of returning to a state-based exchange.(Reporting by Chris Michaud; Editing by Clarence Fernandez)",2014-05-21,XRX,"Wed May 21, 2014 | 1:30am EDT",Nevada to move online healthcare enrollment to federal site,http://www.reuters.com//article/us-usa-nevada-healthexchange-idUSBREA4K04320140521?type=companyNews
12,"  Xerox Corp reported a 2 percent fall in second-quarter revenue, hurt by lower demand in its printing business.Net income attributable to Xerox fell to $266 million, or 22 cents per share, for the quarter ended June 30, from $271 million, or 21 cents per share, a year earlier.  Revenue fell to $5.29 billion from $5.39 billion a year earlier. Revenue from its printing business, which accounts for 40 percent of total revenue, fell 6 percent.   (Reporting by Soham Chatterjee in Bangalore; Editing by Savio D'Souza)",2014-07-25,XRX,"Fri Jul 25, 2014 | 9:17am EDT",Lower printer sales hurt Xerox's revenue,http://www.reuters.com//article/us-xerox-results-idUSKBN0FU14I20140725?type=companyNews
13,"  July 25 Xerox Corp reported a 2 percent fall in second-quarter revenue, hurt by lower demand in its printing business.Net income attributable to Xerox fell to $266 million, or 22 cents per share, for the quarter ended June 30, from $271 million, or 21 cents per share, a year earlier.  Revenue fell to $5.29 billion from $5.39 billion a year earlier. Revenue from its printing business, which accounts for 40 percent of total revenue, fell 6 percent.   (Reporting by Soham Chatterjee in Bangalore; Editing by Savio D'Souza) ",2014-07-25,XRX,"Fri Jul 25, 2014 | 7:18am EDT",Lower printer sales hurt Xerox's revenue,http://www.reuters.com//article/idUSL4N0Q03MN20140725?type=companyNews
14,"  Aug 28 Xerox Corp :  * SEC says charges two information technology executives, Lynn Blodgett andkevin kyser, with mischaracterizing resale transactions to increase revenue  * SEC says blodgett and kyser, respectively the former CEO and former CFO of affiliated computer services, agree to pay nearly $675,000 to settle  * SEC says affiliated computer services has since been acquired by Xerox Corp * SEC says the defendants did not admit or deny wrongdoing in agreeing to settle",2014-08-28,XRX,"Thu Aug 28, 2014 | 1:11pm EDT","BRIEF-Former CEO, CFO of Affiliated Computer Services settle SEC charges over inflated revenue",http://www.reuters.com//article/xerox-brief-idUSWEN00DXH20140828?type=companyNews
15,"  Sept 18 Thin Film Electronics ASA* Says PARC, a Xerox company, increases its shareholding in Thinfilm  * Says PARC will receive 334,702 new shares equal to 1,549,000 Norwegian crowns through a private placement  Source text for Eikon:  Further company coverage:    (gdynia.newsroom@thomsonreuters.com; +48 58 698 3920) ",2014-09-18,XRX,"Thu Sep 18, 2014 | 2:42am EDT",BRIEF-Xerox company's PARC increases stake in Thin Film Electronics,http://www.reuters.com//article/thin-film-brief-idUSFWN0RJ00B20140918?type=companyNews
16,"   By Lehar Maan  Xerox Corp (XRX.N) reported a 2 percent fall in third-quarter revenue due to tepid growth in its services business and slowing demand in the printing business.The company's shares were down 3 percent at $12.79 in afternoon trading on the New York Stock Exchange.Xerox, best known as a maker of printers and copiers, has been focusing on services to offset a drop in printing by companies and as personal computing moves to tablets and smartphones.Barclays Capital analyst Ben Reitzes said services margins were 8.9 percent in the quarter ended Sept. 30, well below the brokerage's estimate of 9.5 percent and the company's guidance of above 9.2 percent.The lower-than-expected margins were likely due to ""persistent headwinds in government healthcare program as turnaround plans here are taking time"", Reitzes wrote in a note. Revenue from the services business, which bring in about 57 percent of total revenue, rose less than 1 percent to $2.95 billion in the third quarter.For a little more than a year Xerox has been spending heavily to set up Medicaid management platforms and healthcare exchanges in the United States to strengthen its services business.""(Medicaid investments) have been a big headwind for us,"" Chief Executive Ursula Burns said on a conference call on Wednesday. The company expects the investments to start reaping rewards from 2015.Xerox bought Affiliated Computer Services Inc in 2009 to get into the services business, which includes business process outsourcing, IT services, cloud computing and data management. The company's total revenue fell to $5.12 billion from $5.24 billion in the third quarter, from a year earlier.Revenue from its printing business fell 6 percent. Net income attributable to Xerox fell to $266 million from $286 million. (Additional reporting by Sai Sachin R and Supantha Mukherjee in Bangalore; Editing by Maju Samuel)",2014-10-22,XRX,"Wed Oct 22, 2014 | 3:08pm EDT",Weak services growth weighs on Xerox revenue,http://www.reuters.com//article/us-xerox-results-idUSKCN0IB15W20141022?type=companyNews
17,"  (Adds details, background, analyst comment, CEO quote)By Lehar MaanOct 22 Xerox Corp reported a 2 percent fall in third-quarter revenue due to tepid growth in its services business and slowing demand in the printing business.The company's shares were down 3 percent at $12.79 in afternoon trading on the New York Stock Exchange.Xerox, best known as a maker of printers and copiers, has been focusing on services to offset a drop in printing by companies and as personal computing moves to tablets and smartphones.Barclays Capital analyst Ben Reitzes said services margins were 8.9 percent in the quarter ended Sept. 30, well below the brokerage's estimate of 9.5 percent and the company's guidance of above 9.2 percent. The lower-than-expected margins were likely due to ""persistent headwinds in government healthcare program as turnaround plans here are taking time"", Reitzes wrote in a note.Revenue from the services business, which bring in about 57 percent of total revenue, rose less than 1 percent to $2.95 billion in the third quarter. For a little more than a year Xerox has been spending heavily to set up Medicaid management platforms and healthcare exchanges in the United States to strengthen its services business.""(Medicaid investments) have been a big headwind for us,"" Chief Executive Ursula Burns said on a conference call on Wednesday.The company expects the investments to start reaping rewards from 2015. Xerox bought Affiliated Computer Services Inc in 2009 to get into the services business, which includes business process outsourcing, IT services, cloud computing and data management.The company's total revenue fell to $5.12 billion from $5.24 billion in the third quarter, from a year earlier.Revenue from its printing business fell 6 percent.Net income attributable to Xerox fell to $266 million from $286 million.    (Additional reporting by Sai Sachin R and Supantha Mukherjee in Bangalore; Editing by Maju Samuel)",2014-10-22,XRX,"Wed Oct 22, 2014 | 2:38pm EDT",UPDATE 2-Weak services growth weighs on Xerox revenue,http://www.reuters.com//article/xerox-results-idUSL3N0SH5RT20141022?type=companyNews
18,"  (Corrects company name in 1st paragraph to Xerox Corp from Xerox Inc. Previous version of the story was corrected to say company reported adjusted earnings of 27 cents per share, not 22 cents, and compare with analysts' estimate in paragraph 4)Oct 22 Xerox Corp reported a 2 percent fall in quarterly revenue, hurt by slowing demand in its printing business.Revenue from the printing business fell 6 percent to $2.02 billion in the third quarter ended Sept. 30, from a year earlier.Net income attributable to Xerox fell to $266 million from $286 million. On a per-share basis, earnings was 27 cents per share, above the average analyst estimate of 26 cents.Revenue fell to $5.12 billion from $5.24 billion. Analysts on average had expected revenue of $5.19 billion, according to Thomson Reuters I/B/E/S. Xerox, which has been diversifying away from its printers and copiers, also forecast adjusted earnings of 30-32 cents per share for the current quarter ending Dec. 31.Analysts on average were expecting a profit of 31 cents per share.The company's shares were down about 1 percent at $13.06 in premarket trading.   (Reporting By Sai Sachin R and Supantha Mukherjee in Bangalore; Editing by Maju Samuel)",2014-10-22,XRX,"Wed Oct 22, 2014 | 1:49pm EDT",REFILE-UPDATE 1-Xerox revenue falls on lower printer sales,http://www.reuters.com//article/xerox-results-idUSL3N0SH5QN20141022?type=companyNews
19,"  (Corrects company name in 1st paragraph to Xerox Corp from Xerox Inc)Oct 22 Xerox Corp reported a 2 percent fall in quarterly revenue, hurt by slowing demand in its printing business. Net income attributable to Xerox fell to $266 million, or 22 cents per share, from $286 million, or 22 cents per share, a year earlier.  Revenue fell to $5.12 billion from $5.24 billion a year earlier.   (Reporting By Sai Sachin R and Supantha Mukherjee in Bangalore)",2014-10-22,XRX,"Wed Oct 22, 2014 | 1:39pm EDT",REFILE-Xerox revenue falls on lower printer sales,http://www.reuters.com//article/xerox-results-idUSL3N0SH47920141022?type=companyNews
20,"  (Corrects paragraph 4 to show adjusted earnings of 27 cents per share, not 22 cents, compares with analysts' estimate)Oct 22 Xerox Inc reported a 2 percent fall in quarterly revenue, hurt by slowing demand in its printing business.Revenue from the printing business fell 6 percent to $2.02 billion in the third quarter ended Sept. 30, from a year earlier.Net income attributable to Xerox fell to $266 million from $286 million. On a per-share basis, earnings was 27 cents per share, above the average analyst estimate of 26 cents.Revenue fell to $5.12 billion from $5.24 billion. Analysts on average had expected revenue of $5.19 billion, according to Thomson Reuters I/B/E/S. Xerox, which has been diversifying away from its printers and copiers, also forecast adjusted earnings of 30-32 cents per share for the current quarter ending Dec. 31.Analysts on average were expecting a profit of 31 cents per share.The company's shares were down about 1 percent at $13.06 in premarket trading.   (Reporting By Sai Sachin R and Supantha Mukherjee in Bangalore; Editing by Maju Samuel)",2014-10-22,XRX,"Wed Oct 22, 2014 | 12:16pm EDT",CORRECTED-UPDATE 1-Xerox revenue falls on lower printer sales,http://www.reuters.com//article/xerox-results-idUSL3N0SH4HP20141022?type=companyNews
21,"  (The following statement was released by the rating agency) CHICAGO, December 03 (Fitch) Fitch Ratings has affirmed the ratings for Xerox  Corp. (Xerox) and its wholly-owned subsidiary, Affiliated Computer Services,  Inc. (ACS), including the long-term Issuer Default Rating (IDR) at 'BBB'. The Rating Outlook is Stable. Fitch's actions affect $9.8 billion of debt,  including Xerox's undrawn $2 billion revolving credit facility (RCF).  KEY RATING DRIVERS Xerox's ratings and Stable Outlook reflect: --Fitch's expectations for improving operating results in Services to offset  revenue declines in Document Technology (DT), primarily black-and-white (B&W)  high-end production printing.  --Substantial recurring revenue from long-term services contracts, rentals and  financing, and supplies (86% of total revenue for the quarter ended Sept. 30,  2014). --Solid liquidity supported by $1 billion of cash at Sept. 30. 2014, an undrawn  $2 billion RCF due 2019, staggered debt maturities and consistent annual free  cash flow (FCF). Fitch believes FCF (post-dividends) will exceed $1.3 billion  annually over the intermediate term. --Fitch expectations for an increasingly diversified revenue mix from faster  growth in the Services segment and with declining exposure to the slower-growing  print industry. Services accounts for 57% of Xerox's total revenue.  --Xerox's conservative financial policies. Fitch believes management remains  committed to an investment-grade rating and has a track record of reducing debt  to offset declining financing assets, resulting in flat core leverage.  Fitch expects Xerox's core leverage, which excludes debt and operating EBITDA  related to financing activities, to remain below 1.5x through the intermediate  term. For the LTM ended Sept. 30, 2014, Fitch estimates core leverage was 1.3x.  For the same time period, core leverage, including off-balance-sheet debt, and  gross leverage was 1.5x and 2.5x, respectively.  Fitch's credit concerns center on: --Fitch expectations for ongoing revenue pressures in DT, which includes  equipment and supplies bundled with Document Outsourcing (DO) contracts. Fitch  forecasts mid-single-digit revenue declines for DT through the  intermediate-term. Revenues fell 5.5% year-over-year in the latest 12 months  (LTM) ending Sept. 30, 2014, due to weakness in B&W. Benefits from restructuring  resulting in higher DT operating margin will partially mitigate revenue  declines. Operating profit margin will exceed 12.5% through the intermediate  term, up from 10.8% in 2013.  --The aggregate $1.1 billion underfunding of worldwide defined benefit (DB)  pension plans as of year-end 2013, down from $1.8 billion in the prior year. The  higher funded status primarily reflects lower benefit obligations due to a 110-  and 20-basis point increase in the U.S. and non-U.S. discount rates,  respectively. Total contributions are expected to be $250 million in 2014 up  from $230 million in 2013.  --Pressured operating margin in the Services business. Fitch expects operating  margin to remain in the mid-9% range through at least 2015 but reach 10% in the  longer term, driven by greater contract bidding discipline. Fitch expects  Xerox's Services segment operating margin to decrease for the fourth consecutive  year in 2014 to just below 9% from 9.8% in 2013.  Cost overruns related to government healthcare contracts and the continued  run-off of certain higher margin business process outsourcing contracts,  consisting of student loan processing and customer care (CC) volume with a  telecom client post- acquisition, drove operating profit margin compression. RATING SENSITIVITIES Negative: --Fitch's expectations for Services operating profit margin sustained below 9%;  --Sustained declines in DT more than offsetting growth in Services, resulting in  a material decline in financial performance and credit metrics. Positive rating actions are unlikely in the absence of: --A significant reduction in the funding shortfall for Xerox's worldwide defined  benefit pension plan;  --DT revenues levels which stabilize with expectations for sustained operating  profit margin near current levels;   --Revenue growth and margin expansion in Services that results in expectations  for FCF margin approaching 10%. Xerox's liquidity is solid, supported by $1 billion of cash at Sept. 30, 2014  and an undrawn $2 billion RCF that matures in March 2019. Fitch's expectation  for more than $1.5 billion of annual FCF also supports liquidity.  Total debt with equity credit was $7.8 billion on Sept. 30, 2014, consisting of  approximately $7.5 billion of senior unsecured debt and $349 million of  convertible preferred stock, which Fitch assigns 50% equity credit. As of Sept.  30, 2014, $4.2 billion, or 54%, of total debt, supported Xerox's financing  business based on a debt-to-equity ratio of 7:1 for the financing assets.  Xerox's net financing assets, consisting of receivables and equipment on  operating leases, totaled $4.8 billion compared with $5.2 billion in the prior  year.  Xerox's nearest debt maturities include $1 billion of senior notes due Feb. 15,  2015 and $250 million of senior notes due June 1, 2015.  Fitch has affirmed the following ratings: Xerox --Long-term Issuer Default Rating (IDR) at 'BBB'; --Short-term IDR at 'F2'; --Revolving credit facility (RCF) at 'BBB'; --Senior unsecured debt at 'BBB'; --Commercial paper at 'F2'. ACS --IDR at 'BBB'; --Senior notes at 'BBB'. Contact: Primary Analyst Jason Pompeii Senior Director +1-312-368-3210 Fitch Ratings, Inc. 70 West Madison Street Chicago, IL 60602 Secondary Analyst David Peterson Senior Director +1-312-368-3177 Committee Chairperson Michael Paladino Senior Director +1-212-908-9113 Media Relations: Brian Bertsch, New York, Tel: +1 212-908-0549, Email:  brian.bertsch@fitchratings.com. Additional information is available at 'www.fitchratings.com'. Applicable Criteria and Related Research:  --'Corporate Rating Methodology' (May 28, 2014). Applicable Criteria and Related Research:  Corporate Rating Methodology - Including Short-Term Ratings and Parent and  Subsidiary Linkage here Additional Disclosure  Solicitation Status  here ALL FITCH CREDIT RATINGS ARE SUBJECT TO CERTAIN LIMITATIONS AND DISCLAIMERS.  PLEASE READ THESE LIMITATIONS AND DISCLAIMERS BY FOLLOWING THIS LINK:  here. IN ADDITION, RATING  DEFINITIONS AND THE TERMS OF USE OF SUCH RATINGS ARE AVAILABLE ON THE AGENCY'S  PUBLIC WEBSITE 'WWW.FITCHRATINGS.COM'. PUBLISHED RATINGS, CRITERIA AND  METHODOLOGIES ARE AVAILABLE FROM THIS SITE AT ALL TIMES. FITCH'S CODE OF  CONDUCT, CONFIDENTIALITY, CONFLICTS OF INTEREST, AFFILIATE FIREWALL, COMPLIANCE  AND OTHER RELEVANT POLICIES AND PROCEDURES ARE ALSO AVAILABLE FROM THE 'CODE OF  CONDUCT' SECTION OF THIS SITE. FITCH MAY HAVE PROVIDED ANOTHER PERMISSIBLE  SERVICE TO THE RATED ENTITY OR ITS RELATED THIRD PARTIES. DETAILS OF THIS  SERVICE FOR RATINGS FOR WHICH THE LEAD ANALYST IS BASED IN AN EU-REGISTERED  ENTITY CAN BE FOUND ON THE ENTITY SUMMARY PAGE FOR THIS ISSUER ON THE FITCH  WEBSITE.   ",2014-12-03,XRX,"Wed Dec 3, 2014 | 5:53pm EST",Fitch Affirms Xerox's IDR at 'BBB'; Outlook Stable,http://www.reuters.com//article/fitch-affirms-xeroxs-idr-at-bbb-outlook-idUSFit85150020141203?type=companyNews
22,"  Xerox Corp (XRX.N) said it agreed to sell its IT outsourcing (ITO) arm to French IT services firm Atos SE (ATOS.PA) for $1.05 billion.The IT outsourcing segment, the company's second largest segment, generated $376 million in the quarter September 30.""Xeroxs ITO business includes about 9,800 employees in 45 countries,"" the company said in a statement. ""The Xerox ITO leadership team will join Atos."" Under the terms of this transaction, Atos will provide IT services to Xerox.  Xerox also said it now expects full-year 2014 earnings per share of $1.04 - $1.06, below analysts' average estimates of $1.12 according to Thomson Reuters I/B/E/S.    (Reporting By Subrat Patnaik in Bengaluru)",2014-12-18,XRX,"Thu Dec 18, 2014 | 6:59pm EST",Xerox to sell IT outsourcing arm to France's Atos for $1.05 billion,http://www.reuters.com//article/us-xerox-atos-deals-idUSKBN0JW2U920141218?type=companyNews
