,Article,Date,Symbol,Time,Title,Url
47,"  (Adds forecast, analyst comments, details)July 24 Xerox Corp barely managed to eke out a profit in the second quarter after the printer and copier maker took a charge related to a revamp of its business that provides administrative and care-management services to government healthcare programs.Xerox, whose shares were down 0.7 percent in premarket trading, said last week it would record a charge of about $145 million as it restructures the business.Norwalk, Connecticut-based Xerox does not disclose profit figures for its healthcare business, but analysts have said it is still unprofitable.Cross Research analyst Shannon Cross said the restructuring was aimed at making the business profitable over the longer term by reducing start-up costs.The business currently contributes ""$2 billion plus"" to total revenue, a company spokeswoman said last week. Xerox, like rival printer/copier makers Lexmark International Inc and Hewlett-Packard Co, is shifting its focus to high-value software and service businesses as corporate customers reduce printing to cut costs and consumers shift to mobile devices.""Xerox for me is a work in progress because they are fixing their services business while continuing to garner significant amount of cash out of the printing business,"" Cross said.Xerox has also been expanding geographically through  acquisitions and has been streamlining its operations by disposing of non-core assets. The company bought cloud platform provider Healthy Communities Institute during the quarter to boost its healthcare business.The company said on Friday it would increase share repurchases by $300 million to $1.3 billion and reduce spending on acquisitions.Including the charges, Xerox's net income attributable to the company fell to $12 million, or 1 cent per share, in the three-months ended June 30 from $266 million, or 22 cents per share, a year earlier. Xerox said it expected earnings of 17-19 cents per share and an adjusted profit of 22-24 cents per share in the current quarter. Analysts on average expect a profit of 25 cents per share, according to Thomson Reuters I/B/E/S.Overall net restructuring and asset impairment charges totaled $157 million in the latest quarter.Excluding items, net income from continuing operations attributable to Xerox was 22 cents per share, in line with the average analyst estimate.Xerox said it expected to incur additional restructuring charges of about 1 cent per share in the current quarter.The strong dollar had a 4 percentage point negative impact on total revenue, which fell 7 percent to $4.59 billion, Xerox said. Analysts had expected revenue of $4.64 billion.   (Reporting by Devika Krishna Kumar in Bengaluru; Editing by Saumyadeb Chakrabarty and Ted Kerr)",2015-07-24,XRX,"Fri Jul 24, 2015 | 9:14am EDT",UPDATE 2-Restructuring charges mostly wipe out Xerox's 2nd-qtr profit,http://www.reuters.com//article/xerox-results-idUSL3N1044DR20150724?type=companyNews
48,"  July 24 Xerox Corp's second-quarter profit was nearly wiped out by a restructuring charge related to a revamp of its government healthcare business.Xerox reported net income attributable to the company of $12 million, or 1 cent per share, for the quarter ended June 30, down from $266 million, or 22 cents per share, a year earlier. The company recorded net restructuring and asset impairment charges of $157 million.  Total revenue fell 7 percent to $4.59 billion.   (Reporting by Devika Krishna Kumar in Bengaluru; Editing by Saumyadeb Chakrabarty)",2015-07-24,XRX,"Fri Jul 24, 2015 | 7:19am EDT",Restructuring charge hits Xerox second-quarter profit,http://www.reuters.com//article/xerox-results-idUSL3N1035EN20150724?type=companyNews
49,"  LONDON Oct 5 Diageo has hired Kathryn Mikells from Xerox as its new chief financial officer, it said on Monday, as the world's largest spirits company navigates its way through a downturn.The maker of Johnnie Walker whisky and Smirnoff vodka said the appointment of Mikells will be effective on Nov. 9 and she will be based in London. Mikells joins from U.S. printer company Xerox, where she has been CFO since May 2013. She will replace Deirdre Mahlan, who is moving to the United States to oversee Diageo's business in North America, where increased competition in vodka has crimped sales of its biggest brand. Diageo is also under scrutiny in the United States by regulators seeking information regarding its sales practices.     (Reporting by Martinne Geller in London; Editing by Susan Fenton)",2015-10-05,XRX,"Mon Oct 5, 2015 | 10:03am EDT",Xerox CFO Mikells moves to Diageo,http://www.reuters.com//article/diageo-cfo-idUSL8N1252XZ20151005?type=companyNews
50,"  Oct 5 Diageo Plc :* Appointment of Kathryn Mikells as CFO * Appointment effective Nov. 9, 2015  * Mikells joins from Xerox Corporation, where she is currently CFO, a position she has held since May 2013  Source text for Eikon:  Further company coverage:    (Bengaluru Newsroom + 91 80 6749 1136)",2015-10-05,XRX,"Mon Oct 5, 2015 | 9:04am EDT",BRIEF-Diageo names Xerox's Kathryn Mikells as CFO,http://www.reuters.com//article/idUSASN000ALF20151005?type=companyNews
51,"   By Abhirup Roy  Xerox Corp (XRX.N), best known for its printers and copiers, said it would review its businesses and capital allocation options, but was not currently considering a sale of the company.Xerox also reported its first net loss since the first quarter of 2010, but profit excluding restructuring costs inched past market expectations.The company's shares fell as much as 3 percent to $10.04 on Monday.""One of the things that we are not currently considering is the sale of the company, but all other options will be looked at as we progress through this review,"" Chief Executive Ursula Burns said on a conference call.The company would also continue to look for tuck-in acquisitions, she said.   Xerox, like its rivals Lexmark International Inc LXK.N and Hewlett-Packard Co (HPQ.N), has been shifting focus to software and services as corporate customers cut printing costs and consumers shift to mobile devices.Lexmark also said last week it was exploring strategic options. ""I expect them to sharply curtail their share repurchases until the company is in better shape financially,"" said Argus Research analyst Jim Kelleher.Kelleher said if Xerox was reviewing its technology  business, the company might have to sell the unit because another partnership wasn't an option.Xerox already has a joint venture with Japan's Fujifilm Holdings (4901.T). Xerox has already gone through a bit of restructuring over the past several quarters but the stock is yet to respond to efforts to turn around the 109-year old brand. The stock has lost more than a quarter of its value this year.The company is revamping its government healthcare IT business and said in July it would discontinue sales of a product that can support operations in call centers and document imaging. Xerox has also cut 1780 jobs so far this year.Kathryn Mikells, the company's chief financial officer of two-and-a-half years, is also quitting to join Johnnie Walker whisky maker Diageo Plc (DGE.L).Xerox named Leslie Varon, vice president of investor relations, as the interim CFO and said it would immediately start and external search process. ""They are not transitioning fast enough,"" Tigress Financial Partners analyst Ivan Feinseth said. ""They have to evolve into a new type of company. Otherwise they will go the way of Eastman Kodak.""Feinseth said Xerox needs to either spend on research and development or buy new technology.Xerox reported a $34 million quarterly net loss attributable to shareholders, or 4 cents per share, in the third quarter ended Sept. 30. Excluding items, the company earned 24 cents per share versus analysts' estimate of 23 cents per share, according to Thomson Reuters I/B/E/S. (Reporting by Abhirup Roy in Bengaluru; Additional reporting by Arathy S. Nair and Anya George Tharakan; Editing by Maju Samuel and Sayantani Ghosh)",2015-10-26,XRX,"Mon Oct 26, 2015 | 12:40pm EDT","Xerox to review operations, not considering sale of company",http://www.reuters.com//article/us-xerox-results-idUSKCN0SK17T20151026?type=companyNews
52,"  * Posts first net loss in more than 5 years* Looking for tuck in acquisitions* Shares fall 3 pct   (Adds analyst comment, details; updates shares)By Abhirup RoyOct 26 Xerox Corp, best known for its printers and copiers, said it would review its businesses and capital allocation options, but was not currently considering a sale of the company.Xerox also reported its first net loss since the first quarter of 2010, but profit excluding restructuring costs inched past market expectations.The company's shares fell as much as 3 percent to $10.04 on Monday.""One of the things that we are not currently considering is the sale of the company, but all other options will be looked at as we progress through this review,"" Chief Executive Ursula Burns said on a conference call. The company would also continue to look for tuck-in acquisitions, she said.Xerox, like its rivals Lexmark International Inc and Hewlett-Packard Co, has been shifting focus to software and services as corporate customers cut printing costs and consumers shift to mobile devices.Lexmark also said last week it was exploring strategic options.""I expect them to sharply curtail their share repurchases until the company is in better shape financially,"" said Argus Research analyst Jim Kelleher. Kelleher said if Xerox was reviewing its technology  business, the company might have to sell the unit because another partnership wasn't an option.Xerox already has a joint venture with Japan's Fujifilm Holdings.Xerox has already gone through a bit of restructuring over the past several quarters but the stock is yet to respond to efforts to turn around the 109-year old brand. The stock has lost more than a quarter of its value this year. The company is revamping its government healthcare IT business and said in July it would discontinue sales of a product that can support operations in call centers and document imaging. Xerox has also cut 1780 jobs so far this year.Kathryn Mikells, the company's chief financial officer of two-and-a-half years, is also quitting to join Johnnie Walker whisky maker Diageo Plc.Xerox named Leslie Varon, vice president of investor relations, as the interim CFO and said it would immediately start and external search process.""They are not transitioning fast enough,"" Tigress Financial Partners analyst Ivan Feinseth said. ""They have to evolve into a new type of company. Otherwise they will go the way of Eastman Kodak.""Feinseth said Xerox needs to either spend on research and development or buy new technology.Xerox reported a $34 million quarterly net loss attributable to shareholders, or 4 cents per share, in the third quarter ended Sept. 30. Excluding items, the company earned 24 cents per share versus analysts' estimate of 23 cents per share, according to Thomson Reuters I/B/E/S.(Reporting by Abhirup Roy in Bengaluru; Additional reporting by Arathy S. Nair and Anya George Tharakan; Editing by Maju Samuel and Sayantani Ghosh)",2015-10-26,XRX,"Mon Oct 26, 2015 | 12:39pm EDT","UPDATE 3-Xerox to review operations, not considering sale of company",http://www.reuters.com//article/xerox-results-idUSL3N12Q3UD20151026?type=companyNews
53,"  (Corrects dateline to Oct 26 from Oct 23)Oct 26 Xerox Corp reported a 9.6 percent fall in quarterly revenue, hurt by lower printer sales and a strong dollar, and said it would review its operations. The company reported net loss attributable to shareholders of $34 million, or 4 cents per share, in the third quarter ended Sept. 30, compared with a profit of $266 million, or 22 cents per share, a year earlier. Revenue fell to $4.33 billion from $4.80 billion. Xerox also said on Monday its board had authorized a review of its business portfolio and capital allocation options.    (Reporting by Abhirup Roy in Bengaluru; Editing by Sriraj Kalluvila)",2015-10-26,XRX,"Mon Oct 26, 2015 | 7:04am EDT",REFILE-Xerox revenue falls 9.6 pct; says to review operations,http://www.reuters.com//article/xerox-results-idUSL3N12N53W20151026?type=companyNews
54,"  Activist investor Carl Icahn disclosed a stake in Xerox Corp (XRX.N), and called the printer and copier maker's shares ""undervalued"", sending its shares up 7.6 percent in extended trade.    The billionaire revealed a 7.13 percent stake in Xerox in a securities filing on Monday, making him the second-largest shareholder of the 109-year old company. Vanguard Group Inc, with an 8.37 percent stake, is the company's top shareholder, according to Thomson Reuters data.Icahn, who recently took stakes in American International Group (AIG.N) and Freeport-McMoran Inc (FCX.N), said he would look at getting representation on Xerox's board, as well as pursuing strategic alternatives.  ""We are aware that Carl Icahn has made an investment in the company,"" Sean Collins, a Xerox spokesman said.""Xerox welcomes open communications with shareholders and values constructive dialogue,"" Collins said. The company, whose shares have fallen more than 22 percent this year, is trying to turnaround itself, shifting focus to software and services as corporate customers cut printing costs and consumers shift to mobile devices.It reported its first net loss in five years in October, which prompted it to review its businesses and capital allocation options. The company, however, said it is not looking for a sale. Xerox shares were trading at $11.56 in after market trading on Monday. (Reporting by Anya George Tharakan and Arathy S Nair in Bengaluru; Editing by Anil D'Silva and Siddharth Cavale)",2015-11-23,XRX,"Mon Nov 23, 2015 | 6:40pm EST","Icahn takes stake in Xerox, calls shares 'undervalued'",http://www.reuters.com//article/us-xerox-icahn-idUSKBN0TC2GW20151123?type=companyNews
55,"  (Adds Xerox statement, details)Nov 23 Activist investor Carl Icahn disclosed a stake in Xerox Corp, and called the printer and copier maker's shares ""undervalued"", sending its shares up 7.6 percent in extended trade.The billionaire revealed a 7.13 percent stake in Xerox in a securities filing on Monday, making him the second-largest shareholder of the 109-year old company.Vanguard Group Inc, with an 8.37 percent stake, is the company's top shareholder, according to Thomson Reuters data. Icahn, who recently took stakes in American International Group and Freeport-McMoran Inc, said he would look at getting representation on Xerox's board, as well as pursuing strategic alternatives. (1.usa.gov/1Xacd5o)""We are aware that Carl Icahn has made an investment in the company,"" Sean Collins, a Xerox spokesman said. ""Xerox welcomes open communications with shareholders and values constructive dialogue,"" Collins said. The company, whose shares have fallen more than 22 percent this year, is trying to turnaround itself, shifting focus to software and services as corporate customers cut printing costs and consumers shift to mobile devices.It reported its first net loss in five years in October, which prompted it to review its businesses and capital allocation options. The company, however, said it is not looking for a sale.Xerox shares were trading at $11.56 in after market trading on Monday.   (Reporting by Anya George Tharakan and Arathy S Nair in Bengaluru; Editing by Anil D'Silva and Siddharth Cavale)",2015-11-23,XRX,"Mon Nov 23, 2015 | 6:37pm EST","UPDATE 2-Icahn takes stake in Xerox, calls shares ""undervalued""",http://www.reuters.com//article/xerox-icahn-idUSL3N13I4DD20151123?type=companyNews
56,"  (Changes source from Xerox to Carl Icahn in paragraph 1)Nov 23 Activist investor Carl Icahn said he had taken a a 7.13 percent stake in Xerox Corp, best known for its printers and copiers.  Icahn said he intends to discuss improving operational performance, pursuing strategic alternatives and the possibility of board representation. (1.usa.gov/1Xacd5o)   (Reporting by Anya George Tharakan in Bengaluru; Editing by Anil D'Silva) ",2015-11-23,XRX,"Mon Nov 23, 2015 | 5:15pm EST",CORRECTED-Icahn takes 7.13 pct stake in Xerox,http://www.reuters.com//article/xerox-icahn-idUSL3N13I4BU20151123?type=companyNews
57,"   By Arathy S Nair and Anya George Tharakan  Activist investor Carl Icahn disclosed a stake in Xerox Corp (XRX.N) and called the printer and copier maker's shares ""undervalued,"" sending the stock up 7.6 percent in extended trade.    The billionaire revealed a 7.13 percent stake in Xerox in a securities filing on Monday, making him the second-largest shareholder of the 109-year-old company.Icahn, who recently took stakes in American International Group (AIG.N) and Freeport-McMoran Inc (FCX.N), said he would look at getting representation on Xerox's board, as well as pursuing strategic alternatives. ""We are aware that Carl Icahn has made an investment in the company,"" Sean Collins, a Xerox spokesman said. ""Xerox welcomes open communications with shareholders and values constructive dialogue.""Ivan Feinseth, a Tigress Financial Partners LLC analyst, offered a cautious view. ""I like Icahn. He has done well but I just don't know what he can do here,"" Feinseth said.On the other hand, Susquehanna Financial Group LLLP analyst James Friedman said there are multiple things that Icahn can push for in the company, including selling the equity stake in its joint venture Fuji Xerox and separating the Documents business and the IT services business. Xerox's IT services business offers business process outsourcing while the document outsourcing business primarily includes sales of printers and copiers. Friedman thinks Icahn can position himself for a board seat in the upcoming May elections. ""Getting on the board is the easy part, actually fixing the business is harder,"" Friedman said. Susquehanna Financial has a valuation on Xerox of $13 per share based on a sum of the parts model, with $9 weighted on the documents business, $3 on the services business and the remaining on the Fuji Xerox business.Xerox, whose shares have fallen more than 22 percent this year, is trying to turn itself around, shifting focus to software and services as corporate customers cut printing costs and consumers shift to mobile devices.It reported its first quarterly net loss in five years in October, which prompted it to review its businesses and capital allocation options. The company, however, said it was not considering a sale. Icahn has considerable success with spinoffs including the split of ebay Inc (EBAY.O) and Paypal Holdings Inc (PYPL.O), and Manitowoc Company Inc's (MTW.N) separation of its crane manufacturing business from its food service business.More recently, Icahn has been urging a breakup of American International Group (AIG.N). Vanguard Group Inc, with an 8.37 percent stake, is Xerox's top shareholder, according to Thomson Reuters data. (Reporting by Anya George Tharakan and Arathy S Nair in Bengaluru; Editing by Anil D'Silva, Siddharth Cavale and Leslie Adler)",2015-11-24,XRX,"Mon Nov 23, 2015 | 8:23pm EST","Icahn takes stake in Xerox, calls shares 'undervalued'",http://www.reuters.com//article/us-xerox-icahn-idUSKBN0TC2GW20151124?type=companyNews
58,"  (Adds analysts' comments, background)By Arathy S Nair and Anya George TharakanNov 23 Activist investor Carl Icahn disclosed a stake in Xerox Corp and called the printer and copier maker's shares ""undervalued,"" sending the stock up 7.6 percent in extended trade.The billionaire revealed a 7.13 percent stake in Xerox in a securities filing on Monday, making him the second-largest shareholder of the 109-year-old company.Icahn, who recently took stakes in American International Group and Freeport-McMoran Inc, said he would look at getting representation on Xerox's board, as well as pursuing strategic alternatives. (1.usa.gov/1Xacd5o)""We are aware that Carl Icahn has made an investment in the company,"" Sean Collins, a Xerox spokesman said. ""Xerox welcomes open communications with shareholders and values constructive dialogue."" Ivan Feinseth, a Tigress Financial Partners LLC analyst, offered a cautious view. ""I like Icahn. He has done well but I just don't know what he can do here,"" Feinseth said.On the other hand, Susquehanna Financial Group LLLP analyst James Friedman said there are multiple things that Icahn can push for in the company, including selling the equity stake in its joint venture Fuji Xerox and separating the Documents business and the IT services business.Xerox's IT services business offers business process outsourcing while the document outsourcing business primarily includes sales of printers and copiers. Friedman thinks Icahn can position himself for a board seat in the upcoming May elections.""Getting on the board is the easy part, actually fixing the business is harder,"" Friedman said.Susquehanna Financial has a valuation on Xerox of $13 per share based on a sum of the parts model, with $9 weighted on the documents business, $3 on the services business and the remaining on the Fuji Xerox business. Xerox, whose shares have fallen more than 22 percent this year, is trying to turn itself around, shifting focus to software and services as corporate customers cut printing costs and consumers shift to mobile devices.It reported its first quarterly net loss in five years in October, which prompted it to review its businesses and capital allocation options. The company, however, said it was not considering a sale.Icahn has considerable success with spinoffs including the split of ebay Inc and Paypal Holdings Inc, and Manitowoc Company Inc's separation of its crane manufacturing business from its food service business.More recently, Icahn has been urging a breakup of American International Group.Vanguard Group Inc, with an 8.37 percent stake, is Xerox's top shareholder, according to Thomson Reuters data.   (Reporting by Anya George Tharakan and Arathy S Nair in Bengaluru; Editing by Anil D'Silva, Siddharth Cavale and Leslie Adler)",2015-11-24,XRX,"Mon Nov 23, 2015 | 8:22pm EST","UPDATE 3-Icahn takes stake in Xerox, calls shares 'undervalued'",http://www.reuters.com//article/xerox-icahn-idUSL3N13I4DD20151124?type=companyNews
59,"  Xerox Corp will split into two companies and give activist investor Carl Icahn three seats on the board of one of the companies, the Wall Street Journal reported.One of the companies will house Xerox's hardware operations and the other its services business, the Journal reported on Thursday, citing people familiar with the matter. Icahn will be given the seats on the board of the company holding Xerox's services business, the Journal reported.  Xerox declined to comment on the report.Icahn disclosed a 7.1 percent stake in the printer and copier maker in November and called its shares ""undervalued"". Xerox is expected to announce the split on Friday when it reports quarterly results, the Journal said.  (Reporting by Anet Josline Pinto in Bengaluru; Editing by Savio D'Souza and Kirti Pandey)",2016-01-28,XRX,"Fri Jan 29, 2016 | 4:26am EST",UPDATE 1-Xerox to split in two; give Icahn 3 board seats - WSJ,http://www.reuters.com//article/xerox-icahn-idUSL3N15C6DM?type=companyNews
60,"  Jan 28 Xerox Corp will split into two companies and give billionaire activist investor Carl Icahn three board seats on one of the companies, the Wall Street journal reported.Xerox will split into one company containing its hardware operations and another housing its services business, the Journal reported, citing sources. (on.wsj.com/1Tqk0bj) The WSJ said Icahn would get the board seats on the company housing the services business.  Icahn in November had disclosed a 7.1 percent stake in the printer and copier maker and called it's shares ""undervalued"".     (Reporting by Anet Josline Pinto in Bengaluru; Editing by Savio D'Souza)",2016-01-28,XRX,"Thu Jan 28, 2016 | 4:22pm EST",Xerox Corp to split in two; give Icahn 3 board seats - WSJ,http://www.reuters.com//article/xerox-icahn-idUSL3N15C6AD?type=companyNews
