,Article,Date,Symbol,Time,Title,Url
69,"   By Greg Roumeliotis  Paul, Weiss, Rifkind, Wharton & Garrison LLP said on Sunday it had hired Scott Barshay, one of rival U.S. law firm Cravath, Swaine & Moore LLP's most prolific dealmakers, as its global head of mergers and acquisitions.The move underscores Paul Weiss's efforts to boost its M&A market share. It ranked 19th last year among other law firms in the Thomson Reuters M&A global league table, having advised on $309 billion of announced deals. Cravath ranked second, having advised on $927 billion of announced deals.Barshay, who joined Cravath in 1991 after graduating from Columbia Law School, had been a major contributor to that law firm's success. Last year alone, he worked on transactions with a total value of more than $250 billion.His work in the last 12 months has included advising 3G Capital and H.J. Heinz on their $60 billion merger with Kraft, Anheuser-Busch InBev SA on its $107 billion acquisition of SABMiller Plc, and Starwood Hotels & Resorts Worldwide Inc on its pending $13.6 billion sale to Marriott International Inc. Barshay has also served as an adviser to many companies defending themselves against activist investors, including Avon Products Inc on its settlement agreement with Barington Capital, Qualcomm Inc against JANA Partners, and Xerox Corp against Carl Icahn.It was at Xerox in the last few months that Barshay got to work more closely with some of Paul Weiss's senior partners. He was advising Xerox, while Paul Weiss's Brad Karp and Robert Schumer were advising its board. This laid the ground for Barshay's move.""Paul Weiss's wide range of highest quality practices and extraordinary lawyers will be invaluable in serving the needs of our clients,"" Barshay said in a statement on Sunday. Paul Weiss's recent deals include advising Time Warner Cable Inc on its pending approximately $79 billion proposed merger with Charter Communications Inc, Exor SpA  on its $7 billion acquisition of PartnerRe Ltd, and Apollo Global Management on its $6.9 billion acquisition of ADT Corp. Paul Weiss is also known for its top corporate litigation and regulatory practices.Cravath is among the law firms that reward their partners based on seniority, rather than business generated, in a compensation system known in the legal industry as ""lockstep,"" designed to avoid disputes over who brought in which client. Barshay declined to comment on his compensation. Karp, who serves as Paul Weiss's chairman, also declined to comment on Barshay's compensation, but noted that his firm applied a modified lockstep structure that offers some flexibility in rewarding outstanding performers in any particular year.While Cravath refrains from advising activist investors, Paul Weiss has occasionally represented some hedge funds on activism matters in the past. However, Paul Weiss recently decided to no longer represent investors on activist campaigns, according to people familiar with the firm who asked not to be identified discussing internal strategy.For Barshay, this meant that there was no perceived conflict with his practice, a big part of which includes defending companies against activist investors.(Corrects misspelling of Cravath in second paragraph)",2016-04-04,XRX,"Mon Apr 4, 2016 | 9:48am EDT",Law firm Paul Weiss hires Cravath M&A rainmaker Barshay,http://www.reuters.com//article/paulweiss-moves-barshay-idUSL2N1770CM?type=companyNews
70,"  (Corrects misspelling of Cravath in second paragraph)By Greg RoumeliotisApril 3 Paul, Weiss, Rifkind, Wharton & Garrison LLP said on Sunday it had hired Scott Barshay, one of rival U.S. law firm Cravath, Swaine & Moore LLP's most prolific dealmakers, as its global head of mergers and acquisitions.The move underscores Paul Weiss's efforts to boost its M&A market share. It ranked 19th last year among other law firms in the Thomson Reuters M&A global league table, having advised on $309 billion of announced deals. Cravath ranked second, having advised on $927 billion of announced deals.Barshay, who joined Cravath in 1991 after graduating from Columbia Law School, had been a major contributor to that law firm's success. Last year alone, he worked on transactions with a total value of more than $250 billion. His work in the last 12 months has included advising 3G Capital and H.J. Heinz on their $60 billion merger with Kraft, Anheuser-Busch InBev SA on its $107 billion acquisition of SABMiller Plc, and Starwood Hotels & Resorts Worldwide Inc on its pending $13.6 billion sale to Marriott International Inc.Barshay has also served as an adviser to many companies defending themselves against activist investors, including Avon Products Inc on its settlement agreement with Barington Capital, Qualcomm Inc against JANA Partners, and Xerox Corp against Carl Icahn.It was at Xerox in the last few months that Barshay got to work more closely with some of Paul Weiss's senior partners. He was advising Xerox, while Paul Weiss's Brad Karp and Robert Schumer were advising its board. This laid the ground for Barshay's move. ""Paul Weiss's wide range of highest quality practices and extraordinary lawyers will be invaluable in serving the needs of our clients,"" Barshay said in a statement on Sunday.Paul Weiss's recent deals include advising Time Warner Cable Inc on its pending approximately $79 billion proposed merger with Charter Communications Inc, Exor SpA  on its $7 billion acquisition of PartnerRe Ltd, and Apollo Global Management on its $6.9 billion acquisition of ADT Corp. Paul Weiss is also known for its top corporate litigation and regulatory practices. Cravath is among the law firms that reward their partners based on seniority, rather than business generated, in a compensation system known in the legal industry as ""lockstep,"" designed to avoid disputes over who brought in which client.Barshay declined to comment on his compensation. Karp, who serves as Paul Weiss's chairman, also declined to comment on Barshay's compensation, but noted that his firm applied a modified lockstep structure that offers some flexibility in rewarding outstanding performers in any particular year.While Cravath refrains from advising activist investors, Paul Weiss has occasionally represented some hedge funds on activism matters in the past. However, Paul Weiss recently decided to no longer represent investors on activist campaigns, according to people familiar with the firm who asked not to be identified discussing internal strategy.For Barshay, this meant that there was no perceived conflict with his practice, a big part of which includes defending companies against activist investors.   (Reporting by Greg Roumeliotis in New York; Editing by Jonathan Oatis)",2016-04-04,XRX,"Mon Apr 4, 2016 | 9:25am EDT",CORRECTED-MOVES-Law firm Paul Weiss hires Cravath M&A rainmaker Barshay,http://www.reuters.com//article/paulweiss-moves-barshay-idUSL5N1760JQ?type=companyNews
71,"   By Rishika S  Xerox Corp (XRX.N) reported a 4.2 percent fall in quarterly revenue, hurt by lower sales of printers and copiers, and said it expects to incur about $100 million in restructuring costs in the second quarter.The company's shares closed down about 13 percent at $9.68, their worst day since November 2009.Xerox said in February it would split into two companies, one holding its legacy printer operations, and the other its business process outsourcing unit, which offers business process outsourcing and document outsourcing.The company said it expected to incur restructuring costs of about $100 million in the second quarter and about $300 million for the full year, due to the split.""We are targeting to fill the top roles by midyear,"" Chief Executive Ursula Burns said on Monday on a conference call, referring to the new divisions following the restructuring. The company said it does not plan to repurchase any shares this year as it aims to complete the separation process by the end of 2016.Rival printer maker Lexmark International Inc LXK.N said last week it agreed to be taken private by a group of investors led by China-based Apex Technology Co Ltd (002180.SZ) and PAG Asia Capital in a deal valued at $3.6 billion net of cash.Xerox said revenue from its document technology business, which includes sales of printers and copiers, fell 10 percent to $1.6 billion in the quarter. Sales of printers and copiers, its mainstay for over half a century, have fallen for more than four years.The company said on Monday it expected an adjusted profit of 24 cents to 26 cents per share for the second quarter. Net income attributable to the company fell to $34 million, or 3 cents per share, in the first quarter ended March 31, from $225 million, or 19 cents per share, a year earlier.Revenue fell to $4.28 billion from $4.47 billion, compared to analysts' estimate of $4.24 billion, according to Thomson Reuters I/B/E/S.    Shares of the company had fallen about 15 percent in the past 12 months through Friday. (Reporting by Rishika Sadam in Bengaluru; Editing by Shounak Dasgupta)",2016-04-25,XRX,"Mon Apr 25, 2016 | 4:32pm EDT",Xerox's revenue falls on lower printer sales,http://www.reuters.com//article/us-xerox-results-idUSKCN0XM13K?type=companyNews
72,"   By Rishika S  Xerox Corp (XRX.N) reported a 4.2 percent fall in quarterly revenue, hurt by lower sales of printers and copiers, and said it expects to incur about $100 million in restructuring costs in the second quarter.The company's shares closed down about 13 percent at $9.68, their worst day since November 2009.Xerox said in February it would split into two companies, one holding its legacy printer operations, and the other its business process outsourcing unit, which offers business process outsourcing and document outsourcing.The company said it expected to incur restructuring costs of about $100 million in the second quarter and about $300 million for the full year, due to the split.""We are targeting to fill the top roles by midyear,"" Chief Executive Ursula Burns said on Monday on a conference call, referring to the new divisions following the restructuring. The company said it does not plan to repurchase any shares this year as it aims to complete the separation process by the end of 2016.Rival printer maker Lexmark International Inc LXK.N said last week it agreed to be taken private by a group of investors led by China-based Apex Technology Co Ltd (002180.SZ) and PAG Asia Capital in a deal valued at $3.6 billion net of cash.Xerox said revenue from its document technology business, which includes sales of printers and copiers, fell 10 percent to $1.6 billion in the quarter. Sales of printers and copiers, its mainstay for over half a century, have fallen for more than four years.The company said on Monday it expected an adjusted profit of 24 cents to 26 cents per share for the second quarter. Net income attributable to the company fell to $34 million, or 3 cents per share, in the first quarter ended March 31, from $225 million, or 19 cents per share, a year earlier.Revenue fell to $4.28 billion from $4.47 billion, compared to analysts' estimate of $4.24 billion, according to Thomson Reuters I/B/E/S.    Shares of the company had fallen about 15 percent in the past 12 months through Friday. (Reporting by Rishika Sadam in Bengaluru; Editing by Shounak Dasgupta)",2016-04-25,XRX,"Mon Apr 25, 2016 | 4:32pm EDT",UPDATE 5-Xerox's revenue falls on lower printer sales,http://www.reuters.com//article/xerox-results-idUSL3N17S353?type=companyNews
73,"  April 25 Xerox Corp* CEO On Separation - ""targeting to fill the top roles by midyear  ""  - conf call* ""Look forward to ramping up sales later this year""  - conf call * ""At march 31 rates, expect very modest transaction currency impact in quarter two and for the balance of the year""  - conf call * ""Did not repurchase any shares in the quarter""  - conf call * ""This year given the separation we don't plan to repurchase any shares""  - conf call   Further company coverage:    )",2016-04-25,XRX,"Mon Apr 25, 2016 | 11:23am EDT",BRIEF-Xerox Corp CEO says targeting to fill the top roles by midyear - CONF CALL,http://www.reuters.com//article/idUSFWN17S0G1?type=companyNews
74,"  (Clarifies source as Xerox Corp, adds press release link)April 25 Xerox Corp :* Xerox reports first-quarter 2016 earnings and provides update on strategic transformation and separation* Sees Q2 2016 GAAP earnings per share $0.06 to $0.08* Sees FY 2016 GAAP earnings per share $0.45 to $0.55* Q1 revenue $4.3 billion versus i/b/e/s view $4.24 billion* Q1 GAAP earnings per share $0.03* Sees Q2 2016 adjusted earnings per share $0.24 to $0.26 * Reaffirms FY 2016 adjusted earnings per share view $1.10 to $1.20* Q1 adjusted earnings per share $0.22* Q1 GAAP earnings per share $0.03 from continuing operations* Q1 earnings per share view $0.23 -- Thomson Reuters I/B/E/S * Separation on track to complete by end of 2016* For second-quarter 2016, Xerox expects GAAP EPS of 6 to 8 cents and adjusted EPS of 24 to 26 cents* Have accelerated cost reduction efforts across company and expect to begin realizing benefits in Q2* Q1 services business, delivered $2.5 billion in revenue, representing an increase of 1 percent * In conjunction with separation, Xerox is implementing a three-year strategic transformation program* Expects to incur one-time separation costs of approximately $200 to $250 million in 2016* Expects to realize approximately $700 million in annualized savings in 2016 from ongoing and incremental initiatives* Q2 earnings per share view $0.26, revenue view $4.39 billion -- Thomson Reuters I/B/E/S* Anticipates total restructuring and related costs of $300 million for full year* FY 2016 earnings per share view $1.11 -- Thomson Reuters I/B/E/S* Company recorded $126 million of restructuring and related costs in Q1 related to the strategic transformation program  Source text for Eikon:  Further company coverage:",2016-04-25,XRX,"Mon Apr 25, 2016 | 7:25am EDT",REFILE-BRIEF-Xerox reports Q1 adjusted EPS $0.22,http://www.reuters.com//article/idUSASD08EYV?type=companyNews
75,"  April 25 Printer and copier maker Xerox Corp  reported a 4.2 percent fall in its quarterly revenue, hurt by a strong dollar.Net income attributable to the company fell to $34 million, or 3 cents per share, in the first quarter ended March 31, from $225 million, or 19 cents per share, a year earlier. On an adjusted basis, the company earned 22 cents per share.  Revenue fell to $4.28 billion from $4.47 billion.     (Reporting by Rishika Sadam in Bengaluru; Editing by Shounak Dasgupta)",2016-04-25,XRX,"Mon Apr 25, 2016 | 6:55am EDT",Printer maker Xerox's revenue falls 4.2 pct,http://www.reuters.com//article/xerox-results-idUSL3N17S34F?type=companyNews
76,  April 26 S&P * Xerox Corp'BBB-/A-3' ratings remain on creditwatch negative pending business separation  Source text (bit.ly/1Qz6gVT) Further company coverage:  ,2016-04-26,XRX,"Tue Apr 26, 2016 | 5:08pm EDT",BRIEF-S&P says Xerox corp'BBB-/A-3' ratings remain on creditwatch negative pending business separation,http://www.reuters.com//article/idUSFWN17T0RD?type=companyNews
77,  May 20 Xerox Corp* Company declares quarterly cash dividend of 7.75 cents per share* Increasing its annual dividend by 11 percent for 2016 * Shareholders did not approve a proposal concerning executive compensation metrics * Company declares quarterly cash dividend of 7.75 cents per share * Xerox corp says  board also declared a quarterly cash dividend of $20 per share on xerox series a convertible perpetual preferred stock  Source text for Eikon:  Further company coverage:    (Bengaluru Newsroom; +1 646 223 8780),2016-05-20,XRX,"Fri May 20, 2016 | 3:48pm EDT",BRIEF-Xerox corp declares quarterly cash dividend of 7.75 cents per share,http://www.reuters.com//article/idUSFWN18H0AV?type=companyNews
78,  May 20 Xerox :* Names Ursula Burns chairman of post -separation of Document Technology Company * Separation is on track to be completed by end of 2016  * Says Burns will continue in her current role as chairman and chief executive officer of Xerox until separation  Source text for Eikon:  Further company coverage:    (Bengaluru Newsroom: +1-646-223-8780),2016-05-20,XRX,"Fri May 20, 2016 | 9:12am EDT",BRIEF-Xerox's Ursula Burns to be chairman of Document Technology's board post-separation,http://www.reuters.com//article/idUSASC08QOG?type=companyNews
79,"  Xerox Corp (XRX.N) said on Tuesday Ashok Vemuri will become the chief executive of its business process outsourcing unit after the company splits into two publicly traded entities.Vemuri, who previously headed IT services provider IGATE Corp from September 2013 to October 2015, will join Xerox effective July 1.While at IGATE, Vemuri led the company's sale to French rival Cap Gemini SA (CAPP.PA) for $4 billion. He has previously worked at Infosys Ltd (INFY.NS) in various roles for 14 years. In January, Xerox announced plans to split its legacy printer operations and its business process outsourcing units into two companies. Xerox has not said who will head its printer business but current Chief Executive Ursula Burns will become chairman of that company once the transaction closes, expected by the end of 2016.   (Reporting by Anya George Tharakan in Bengaluru; Editing by Sriraj Kalluvila)",2016-06-14,XRX,"Tue Jun 14, 2016 | 9:04am EDT",Xerox names Ashok Vemuri as CEO of post-split BPO business,http://www.reuters.com//article/uk-xerox-ceo-bpo-idUSKCN0Z01K0?type=companyNews
80,"  Xerox Corp (XRX.N) said on Tuesday Ashok Vemuri will become the chief executive of its business process outsourcing unit after the company splits into two publicly traded entities.Vemuri, who previously headed IT services provider IGATE Corp from September 2013 to October 2015, will join Xerox effective July 1.While at IGATE, Vemuri led the company's sale to French rival Cap Gemini SA (CAPP.PA) for $4 billion. He has previously worked at Infosys Ltd (INFY.NS) in various roles for 14 years. In January, Xerox announced plans to split its legacy printer operations and its business process outsourcing units into two companies. Xerox has not said who will head its printer business but current Chief Executive Ursula Burns will become chairman of that company once the transaction closes, expected by the end of 2016.   (Reporting by Anya George Tharakan in Bengaluru; Editing by Sriraj Kalluvila)",2016-06-14,XRX,"Tue Jun 14, 2016 | 9:04am EDT",Xerox names Ashok Vemuri as CEO of post-split BPO business,http://www.reuters.com//article/xerox-ceo-bpo-idUSL4N1963PX?type=companyNews
81,"  June 14 Xerox Corp :* Xerox names Ashok Vemuri as CEO of post-separation business process outsourcing company* Vemuri will join Xerox effective July 1, 2016 and serve as chief executive officer of Xerox business services LLC * Vemuri will serve as executive vice president of Xerox corporation until separation is complete * Vemuri served as president and chief executive officer of Igate Corporation from September 2013 to October 2015 * Separation transaction is on track to be completed by end of 2016  Source text for Eikon:  Further company coverage:    (Bengaluru Newsroom: +1-646-223-8780)",2016-06-14,XRX,"Tue Jun 14, 2016 | 8:22am EDT",BRIEF-Xerox names Ashok Vemuri CEO of BPO company post split,http://www.reuters.com//article/idUSASC08TYZ?type=companyNews
82,"  June 16 Xerox Corp* Announced names of new companies that will be created following completion of its separation into two publicly traded companies  * Business process outsourcing company will be named ""Conduent, Inc."", document technology company will continue to be called Xerox Corp  Source text for Eikon:  Further company coverage: ",2016-06-16,XRX,"Thu Jun 16, 2016 | 9:30am EDT",BRIEF-Xerox Corp announces names of new companies following split,http://www.reuters.com//article/idUSFWN1980B9?type=companyNews
83,"  Xerox Corp (XRX.N) said Jeff Jacobson, the president of its technology unit, would take over as chief executive after the company splits its business process outsourcing unit into a separate, publicly listed entity. Jacobson, 56, joined Xerox in 2012 and he was appointed the president of the technology business, which includes the company's hardware and software offerings, in July 2014. Xerox will house the company's legacy printer business. Its business process outsourcing operations will be held under ""Conduent Inc"", which will be led by Ashok Vemuri.  Xerox, which announced the split in January, said its current CEO Ursula Burns would become the chairman of the printer company after the separation is completed at the end of 2016.   (Reporting by Anya George Tharakan in Bengaluru; Editing by Kirti Pandey)",2016-06-23,XRX,"Thu Jun 23, 2016 | 4:57pm EDT",Jeff Jacobson to take over as Xerox Corp CEO after split,http://www.reuters.com//article/us-xerox-ceo-printer-idUSKCN0Z92F4?type=companyNews
84,"  Xerox Corp (XRX.N) said Jeff Jacobson, the president of its technology unit, would take over as chief executive after the company splits its business process outsourcing unit into a separate, publicly listed entity. Jacobson, 56, joined Xerox in 2012 and he was appointed the president of the technology business, which includes the company's hardware and software offerings, in July 2014. Xerox will house the company's legacy printer business. Its business process outsourcing operations will be held under ""Conduent Inc"", which will be led by Ashok Vemuri.  Xerox, which announced the split in January, said its current CEO Ursula Burns would become the chairman of the printer company after the separation is completed at the end of 2016.   (Reporting by Anya George Tharakan in Bengaluru; Editing by Kirti Pandey)",2016-06-23,XRX,"Thu Jun 23, 2016 | 4:57pm EDT",Jeff Jacobson to take over as Xerox Corp CEO after split,http://www.reuters.com//article/xerox-ceo-printer-idUSL4N19F4FW?type=companyNews
85,  June 23 Xerox Corp :* Jeff Jacobson to become CEO of Xerox Corporation following completion of separation * Jacobson currently serves as president of Xerox Technology and will continue in his current role until separation is complete * Company is on track to complete separation by end of 2016 * Jeff Jacobson to become CEO of Xerox Corporation following completion of separation  Source text for Eikon:  Further company coverage:    (Bengaluru Newsroom: +1 646 223 8780),2016-06-23,XRX,"Thu Jun 23, 2016 | 4:33pm EDT",BRIEF-Jeff Jacobson to become CEO of Xerox Corp following completion of separation,http://www.reuters.com//article/idUSASC08V7U?type=companyNews
86,"  June 23 (Reuters) -* Xerox to name Jeff Jacobson CEO after split - CNBC, citing DJ  * Jeff Jacobson to succeed Xerox CEO Ursula Burns - CNBC, citing DJ   Further company coverage:    (Bengaluru Newsroom) ",2016-06-23,XRX,"Thu Jun 23, 2016 | 4:22pm EDT","BRIEF-Xerox to name Jeff Jacobson CEO after split - CNBC, citing DJ",http://www.reuters.com//article/idUSFWN19F0DC?type=companyNews
87,  June 27 Xerox Corp * Carl Icahn posts 9.78 pct stake in Xerox Corp as of June 27 vs 9.18 pct stake as of Jan 28  - SEC Filing  Source text for Eikon: (1.usa.gov/2933Oge) Further company coverage:    (Bengaluru Newsroom: +1-646-223-8780)  ,2016-06-27,XRX,"Mon Jun 27, 2016 | 5:35pm EDT",BRIEF-Carl Icahn posts 9.78 pct stake in Xerox Corp as of June 27 - SEC Filing,http://www.reuters.com//article/idUSFWN19J0SU?type=companyNews
88,"  June 27 Xerox Corp :* Jonathan Christodoro has been appointed to Xerox board of directors* Christodoro will also join board's corporate governance committee and finance committee * With new addition, Xerox board is now comprised of nine directors * Company is on track to complete separation by end of 2016 * Jonathan Christodoro is managing director of Icahn Capital LP, a subsidiary of Icahn Enterprises L.P., Xerox's largest shareholder* Xerox adds new director to its board  Source text for Eikon:  Further company coverage:    (Bengaluru Newsroom: +1-646-223-8780)",2016-06-27,XRX,"Mon Jun 27, 2016 | 4:48pm EDT",BRIEF-Xerox names managing director of Icahn Capital LP to board,http://www.reuters.com//article/idUSASC08VEU?type=companyNews
89,  June 30 Xerox Corp * Xerox files Form 10 registration statement in connection with its planned separation of Conduent Inc  Source text for Eikon:  Further company coverage:    (Bengaluru Newsroom: +1-646-223-8780)  ,2016-06-30,XRX,"Thu Jun 30, 2016 | 5:06pm EDT",BRIEF-Xerox files Form 10 registration statement in connection with planned separation of Conduent Inc,http://www.reuters.com//article/idUSFWN19M0Y9?type=companyNews
90,  July 11 (Reuters) -* Xerox is said in talks to merge copy business with RR Donnelly - CNBC citing a report  Further company coverage:    ) ,2016-07-11,XRX,"Mon Jul 11, 2016 | 4:44pm EDT",BRIEF-Xerox is said in talks to merge copy business with RR Donnelly- CNBC citing a report,http://www.reuters.com//article/idUSFWN19X0UO?type=companyNews
91,  July 11 Xerox Corp : * PARC says received funding from Defense Advanced Research Projects Agency under its Icarus program  Source text for Eikon:  Further company coverage:    (Bengaluru Newsroom: +1-646-223-8780)  ,2016-07-11,XRX,"Mon Jul 11, 2016 | 7:58am EDT",BRIEF-Xerox's PARC receives funding from DARPA under its Icarus program,http://www.reuters.com//article/idUSFWN19X0HT?type=companyNews
