,Article,Date,Symbol,Time,Title,Url
17,"   By Michael Erman and Brian Grow | NEW YORK/ATLANTA  NEW YORK/ATLANTA It is one of the most potent antibiotics used by U.S. cattle and dairy farmers, the key component in the top-selling drug line of Zoetis, the world’s largest animal health company.But the strength of the antibiotic ceftiofur – and the frequency with which it’s being misused on farms across America – has created a threat to human health that may overshadow the drug’s effectiveness, a Reuters examination shows. The U.S. Food and Drug Administration cautioned in 2012 that ceftiofur could pose a “high public health risk,” in part because the drug belongs to a class of antibiotics considered critically important in human medicine. The warning is the FDA’s strongest kind. The concern is that ceftiofur in animals could spawn antibiotic-resistant bacteria, superbugs that can infect people and defeat conventional medical treatment, even when the drug is used as directed.A Reuters analysis of government data indicates that the risks to human health may be more significant than previously known. Since last year, records kept by the U.S. Department of Agriculture show that traces of ceftiofur were found at illegal levels in slaughtered animals more frequently than with any other drug. In 2013, ceftiofur alone accounted for one-fourth of all residue violations logged by the USDA, the data show.The ceftiofur residues are not themselves considered dangerous to people if ingested, because the government sets its standards well below hazardous levels.But the traces serve as a warning sign that the drug was used shortly before the animal was killed, thus increasing the chances that the meat contains superbugs, said Guy Loneragan, a veterinary epidemiologist at Texas Tech University. Studies show that ceftiofur, more than most other drugs, can sharply increase the amount of antibiotic-resistant bacteria in an animal.“It kills off weaker bugs and allows stronger ones to survive and multiply,” Loneragan said. The effect is especially pronounced soon after the drug has been used, studies show.Zoetis says ceftiofur is safe to use as directed.  “The use of ceftiofur continues to be appropriate when used according to the label directions in those animals that are in at-risk situations,” said Scott Brown, vice president of global therapeutics research at Zoetis.The stakes are especially high because the drug is part of a crucial class of antibiotics called cephalosporins. The class includes ceftriaxone, a drug that’s vital to treating pneumonia, meningitis and salmonella infections in children, according to the FDA. The use of one type of cephalosporin can compromise the effectiveness of others in the same class.“There is a very clear link between ceftiofur use and ceftriaxone resistance,” said Paul Fey, a professor of microbiology at University of Nebraska Medical Center. “We know that ceftiofur-resistant salmonella are clearly ceftriaxone-resistant.”ECONOMIC INCENTIVES Despite the perils, there are economic incentives to misuse ceftiofur. The potent drug can keep a sick cow alive long enough for a dairy farmer to sell the animal to a slaughterhouse. A course of treatment can cost from $20 to more than $100, relatively high for veterinary antibiotics. But that is far less than what the farmer stands to make if the animal survives until it can be sold for meat. Dairy cows for slaughter are now fetching $1,500 or more, according to farmers and USDA data.Hugh Byron ran a dairy farm in Hillsboro, Kentucky, until 2011 and kept cattle until this year. He says he frequently used ceftiofur to treat common infections in his cows. In July 2010, a dairy cow sent to slaughter from Byron’s farm tested positive for 5.61 milligrams of ceftiofur residue per kilogram of tissue sample. That was 14 times higher than the 0.4 milligram per kilogram tolerance level set by the FDA.Byron admits that he has administered ceftiofur at the end of his animals’ lives hoping they’d hang on, so that a slaughterhouse would accept the cows and pay him.“We’re talking about our livelihood, our money. We’re trying to save the cow and if we can’t save the cow, we’re trying to salvage it,” said Byron. “In other words, send her to the stockyard and get something out of it. So there’s a temptation to fudge on it.”Zoetis features the drug’s economic advantages in its marketing to farmers and veterinarians. One of ceftiofur’s features is a short withdrawal period - the FDA-mandated time between when an animal stops taking an antibiotic and when its milk or meat is certain to be sufficiently free of residue to pass inspection.The drug’s time advantage is significant. In the case of milk, if a cow takes penicillin, the farmer must discard all the milk produced for at least two days and as many as 15 days after the drug is last given. There’s often no withdrawal period for certain ceftiofur products, so a cow can keep producing milk while taking it.“No wasted milk ensures a better return on investment,” Zoetis says on its website about its ceftiofur-brand drug Excenel. THE WITHDRAWAL PERIOD The residue-testing program is supposed to help the government ensure that farmers are not misusing the drugs.  The regulations contain a gap, however. The USDA tests animals for traces of antibiotics, to prevent excess levels of drugs such as ceftiofur from entering the food supply. But the residue program doesn't test for the presence of resistant bacteria. In the case of ceftiofur, those bugs can survive in an animal past the end of the drug's required withdrawal period, studies show.Loneragan of Texas Tech said his research suggests the FDA should analyze whether high levels of resistant bacteria remain beyond the withdrawal period. A longer period may be warranted, he said, to ensure that the resistant bacteria population is reduced before the animal is slaughtered.The reason for the rise in ceftiofur violations isn’t clear. The USDA implemented a new test in 2012 that it says is better at identifying traces of all drugs. But the USDA residue data don’t show as large an increase in violations for penicillin and other antibiotics as they do for ceftiofur.FDA spokeswoman Juli Putnam said the agency “is aware of the increase in ceftiofur residue violations” and is gathering more information to “better understand the matter.” She said the agency is aware of Loneragan’s research findings as well, “and we continue to consider the evolving science related to the impact of antimicrobial use on bacterial populations.”Zoetis said the FDA has evaluated ceftiofur’s impact on antibiotic resistance in bacteria and has approved drugs containing the compound as recently as last year.Those caught misusing veterinary antibiotics face light consequences. Penalties include condemnation of the animal. FDA inspectors review a violator’s practices, which can result in warning letters ordering farmers to change how they administer the medicines. Further action is extremely rare, an examination of regulatory and court records shows.The residue testing program has been harshly criticized by federal auditors. A 2010 report by the Government Accountability Office found that the program ""is not accomplishing its mission of monitoring the food supply for harmful residues."" One result of the audit was the implementation two years later of the new residue testing methodology now used by the USDA and FDA.SUCCESSFUL DRUG                                   The widespread application of antibiotics in veterinary medicine poses enormous challenges for health authorities. Today, 80 percent of all antibiotics used in the United States are given to livestock, not to people. In September, Reuters documented how some of America’s largest poultry companies routinely mix low levels of antibiotics into the feed given to chickens, a practice that scientists believe is especially conducive to the growth of superbugs. About 2 million people in the United States are sickened each year by bacterial infections that resist conventional antibiotics, and at least 23,000 people die, according to the U.S. Centers for Disease Control and Prevention. The World Health Organization called antibiotic resistance “a problem so serious it threatens the achievements of modern medicine.”Despite such concerns, sales of antibiotics for use in food animal production rose 16 percent by volume from 2009 to 2012, government data show. Sales of cephalosporins increased at more than twice that rate.The government has made some effort to curb ceftiofur use because of concerns about antibiotic resistance. The FDA requires farmers to obtain a prescription from a veterinarian. In 2012, the agency issued an order prohibiting most off-label uses of the drug, pointing to residues as one contributing factor.The rise in ceftiofur use is a boon to its largest maker, Florham, NJ-based Zoetis, the former animal drug unit of pharmaceutical giant Pfizer Inc. Ceftiofur-based brands are the company’s top-selling line, generating about $300 million in revenue per year since 2011, according to company financial reports.Zoetis markets its ceftiofur brands to veterinarians, who must prescribe the drug, and to farmers in YouTube videos and in veterinary and dairy publications. The drug has become one of the most popular antibiotics on American cattle farms. Veterinarians and farmers praise its potency, efficiency and ability to treat multiple ailments, from foot rot to bovine respiratory disease. ""SUCH A HUGE EFFECT"" “We had to use so little of it for such a huge effect,” said H. Morgan Scott, a veterinary epidemiologist at Texas A&M University’s College of Veterinary Medicine.Another selling point is the drug’s short withdrawal times. FDA withdrawal guidelines are based on the presence of antibiotic residue in meat. Compared with other antibiotics, ceftiofur is metabolized rapidly by cows – and so regulators require a shorter waiting period. The drug’s withdrawal periods are zero to three days for milk and four to 13 days for meat. With other drugs, the ranges can be four weeks or more for meat. Those short windows leave a potential safety gap. Even when ceftiofur is used as approved, one 2007 study shows, antibiotic-resistant bacteria remained present in the guts of cattle long after the drug was given. The FDA cited the study, whose authors include Loneragan and Scott, in the 2012 order reining in use of the drug. The study, published in the American Journal of Veterinary Research, found that one properly administered dose of a ceftiofur-based medication made by Zoetis resulted in 40 percent of the surviving E. coli in cattle having resistance to ceftiofur six days after the dose. The resistant bacteria population remained above 20 percent of the total for two weeks. Resistant bacteria did not return to levels typical in untreated cattle for 28 days, well after ceftiofur’s withdrawal period, the study found.As part of the USDA’s National Residue Program, food safety regulators test meat for drugs and chemicals that could prove dangerous to consumers. In 2012, the USDA tested for drug residues in about 185,000 cattle – far less than 1 percent of the more than 33 million cattle slaughtered in the United States that year. The percentage of pigs, poultry and other animals tested is lower. If high drug residues are found, the results are turned over to the FDA for investigation and enforcement.In 2013, no single drug residue was found more frequently in slaughtered animals than ceftiofur, the Reuters analysis shows.Violations involving high levels of ceftiofur in meat rose by 323 percent between 2008 and 2013 – from 98 violations to 415. Last year alone, more than a quarter of all 1,634 residue violations were for ceftiofur – more than four times its share of violations in 2008, the analysis shows. Violations involving ceftiofur have continued at a similar rate during the first half of 2014.Dairy cows are one of America's major sources of ground beef, which in turn is the beef product most prone to bacterial infections. Dairy cows are also the leading source of ceftiofur residues, representing 76 percent of the 415 violations in 2013. Last year, 45 percent of the 1,634 residue violations for all drugs were found in dairy cows.Zoetis said it was aware of the residue violations but that they were small in number, and most – perhaps all – of the animals were pulled from the food supply when residues were found.“These are animals that probably should not have gone to slaughter, or there were mistakes and animals go to slaughter that didn’t follow withdrawal periods,” said John Hallberg, director of U.S. regulatory affairs at Zoetis.“YOUR BOTTOM LINE” Ceftiofur can save farmers money by keeping a cow milking longer and by preserving her value at the slaughter stage. In its marketing materials, Zoetis zeroes in on some of the savings.In one pitch, it says that using its Excede brand instead of penicillin to treat dairy cows with bovine respiratory disease could save a farmer more than $30 per animal, after factoring in the value of milk production not lost to withdrawal.The company makes a similar case for Excenel. “Protect your cows and your bottom line with EXCENEL,” its website says.There are also gains to be had at life’s end. Because of the short withdrawal times, farmers can get paid more quickly after treating the animal.“Shorter meat withdrawals. You’d have to wait 29 days longer” when using a rival drug, says an advertisement for Excede.Time is money for a farmer with a gravely ill cow on his hands. Interviews with farmers, veterinarians and field researchers, and a review of FDA warning letters, show ceftiofur has been administered to animals by farmers eager to keep a sick animal alive long enough to sell it.Byron, the 66-year-old retired dairyman in Kentucky, says ceftiofur is a wonder drug. It’s one of the more effective antibiotics, he found, and treated animals and their milk don’t have to be kept off market for long.“Our attitude, most of us, was if (ceftiofur) worked, if it’ll save a cow, we’ll spend the money,” Byron said. “You’re talking about a thousand-dollar animal or more.” After the USDA found high traces of ceftiofur in the cow he’d sold for slaughter, Byron received a letter from the FDA warning him to improve his processes. The agency evaluated his operation later that year, found it to be in order and closed the case. The agencies took no other action. (Additional reporting by Mimi Dwyer in New York; edited by Blake Morrison and Michael Williams)",2014-12-06,ZTS,"Fri Dec 5, 2014 | 8:27pm EST",Special Report: Powerful antibiotic for cows often misused by farmers,http://www.reuters.com//article/us-farmaceuticals-ceftiofur-specialrepor-idUSKCN0JJ03T20141206?type=companyNews
18,"  (Corrects second paragraph to say ""scholarships funded by Merck, Zoetis, Cargill and others this year."")By Duff Wilson and Mimi DwyerDec 23 The pharmaceutical industry has strong ties to veterinary education across the United States, providing financial support to professors, researchers and students.Zoetis, the world's leading animal drug maker, has given $3.6 million in scholarships over the past five years to more than 1,100 U.S. veterinary students. The American Association of Bovine Practitioners, a beef veterinary group, provided $300,000 in grants and scholarships funded by Merck, Zoetis, Cargill and others this year.A four-year veterinary education costs well over $200,000, and students often leave school with significant debt. But five pharmaceutical companies have donated hundreds of thousands of dollars to help veterinary students pay back loans. One condition: that the students practice food-animal medicine for four years. Some students also are paid to serve as representatives of pharmaceutical companies on their campuses. ""I don't think they're pushing anything that's going to affect how we practice as veterinarians, but it certainly could be viewed that way,"" said Alexander Thomson, the Zoetis student representative at Cornell veterinary college. He declined to say how much he is paid.Leading veterinary professors are also accepting money from the pharmaceutical industry for everything from research to company-scripted promotional speaking. Such speaking arrangements are banned by many university medical faculties, according to Eric Campbell, a Harvard University professor who studies conflicts of interest between medical doctors and drug companies. ""The fact that they're being supported by the companies they're supposed to be overseeing raises issues about the impact of those payments,"" he said.Pamela Ruegg, a professor of dairy science at the University of Wisconsin, was paid to speak by Zoetis, among others. Then, she said, Zoetis stopped inviting her to forums when she voiced concerns that antibiotics were being overused on farms. ""They wouldn't sponsor me as a speaker because they're mad at me,"" Ruegg said. ""My message is we have to reduce the amount of antimicrobial use and use it properly."" Last week, however, Ruegg said a Zoetis representative called her to ask if the company could distribute a YouTube video she made and a paper she wrote advocating more ""watchful waiting"" and less antibiotic usage on dairy farms. ""It's a favorable development,"" she said. Zoetis declined to comment.Mark Papich, a professor of clinical pharmacology at North Carolina State's veterinary college, has received speaking and consulting fees, honoraria, research grants or gifts from nearly every pharmaceutical company, a fact he talks about openly.""It's a matter of survival for us to try and get support from the pharmaceutical companies,"" he said.   (Reporting By Duff Wilson and Mimi Dwyer)",2014-12-23,ZTS,"Tue Dec 23, 2014 | 11:16am EST",CORRECTED-Connections between drug makers and educators abound,http://www.reuters.com//article/farmaceutical-vets-education-idUSL1N0U60YH20141223?type=companyNews
19,"  (Adds Aareal Bank, EDP-Energias de Portugal, Occidental Petroleum, Travelex, RBS, Netia, Macquarie Group, Lagardère, Hershey, Zoetis, Sky; updates BOC Hong Kong)Jan 29 The following bids, mergers, acquisitions and disposals were reported by 1115 GMT on Thursday:** Mexican supermarket chain Comercial Mexicana  has agreed to sell the business and operation of 160 stores to rival Soriana for 39.19 billion pesos ($2.66 billion).** Sysco Corp, the biggest U.S. food distributor, may have to wait longer for its $8.2 billion deal to buy US Foods Inc to be approved by regulators, the New York Post reported.** Lender BOC Hong Kong Holdings Ltd is considering a sale of subsidiary Nanyang Commercial Bank that could fetch about $6 billion, in a bid to stop cannibalising the China business of its parent, Reuters exclusively reported, citing people familiar with the matter.** Britain's dominant pay-TV group Sky plans to launch a mobile service from 2016 through a deal with O2 owner Telefonica, ramping up pressure in the country's already crowded communications market.** Hedge fund Pershing Square Capital Management is pressing for seats on animal health company Zoetis Inc's board of directors, with an eye to pushing through cost cuts and a possible merger, Reuters exclusively reported, citing sources familiar with the negotiations.** Hershey Co agreed to buy jerky maker Krave Pure Foods Inc for its first foray into meat snacks, a fast-growing market that is tempting health-conscious consumers away from chocolate. ** Toshiba Corp said it would stop making and selling TVs in North America and was considering similar exits from other countries, the latest Japanese electronics maker to give up competing in the global TV market amid a fierce price war.** France's Lagardère has joined the race to acquire a majority of Italy's airport retailer World Duty Free , which belongs to the Benetton family, sources said. The French media group is in talks with several private equity firms to help it fund a deal worth over $1.2 billion, said a third source.** Macquarie Group Ltd is in talks to buy Jefferies Group LLC's commodities and financial derivatives brokerage, three sources said, as the Australian bank continues to expand its commodities business while rivals retreat. ** Poland's second largest telecoms operator Netia  is to announce a partnership with the country's No.4 mobile operator Play, which could be a first step towards an eventual merger, a source with knowledge of the matter said.**  Foreign currency exchange firm Travelex will be merged with money transfer company UAE Exchange and listed in Abu Dhabi by early on in 2017, new owner Bavaguthu Raghuram Shetty said.** Royal Bank of Scotland plans to sell or close its corporate debt and debt capital markets business in the Middle East and Africa, the latest pullback by the state-controlled lender from emerging markets to focus on its domestic business. ** Germany's ThyssenKrupp is in advanced talks to sell its stainless steel business VDM, Germany's Sueddeutsche Zeitung newspaper reported, adding that Luxembourg-based steelmaker Aperam was the frontrunner to buy it.** Occidental Petroleum Corp said it will close its Philbro proprietary trading arm by April.** U.S. hedge fund Elliott has built a stake of at least 3 percent in German machine tool maker DMG Mori Seiki AG , for which Japanese partner DMG Mori Seiki Co Ltd  made a takeover offer last week.** British private equity firm 3i Group said strong market valuations had cleared the way for further disposals after it raised 245 million pounds ($371 million) from sale of investments in the final quarter of last year.** Jose de Mello Energia, part of a conglomerate owned by Portugal's de Mello family, will sell all of its 2 percent stake, or nearly 73.25 million shares, in the country's largest utility EDP-Energias de Portugal.** Aareal Bank's major shareholder Aareal Holding Verwaltungsgesellschaft asked Deutsche Bank and Bankhaus Lampe to place up to 17.3 million shares, a transaction that would allow it to sell its entire 28.9 percent stake in the property lender, Deutsche Bank said.($1 = 14.72 Mexican pesos)  ($1 = 0.89 euro)   (Compiled by Yashaswini Swamynathan and Natalie Grover in Bengaluru)",2015-01-29,ZTS,"Thu Jan 29, 2015 | 6:06pm EST",Deals of the day- Mergers and acquisitions,http://www.reuters.com//article/deals-day-idUSL4N0V85BU20150129?type=companyNews
