,Article,Date,Symbol,Time,Title,Url
31,"  (Corrects headline and first paragraph to say company is reducing operations in Venezuela, not exiting)May 5 Animal health products maker Zoetis Inc  said it would reduce operations in Venezuela and consider selling or exiting 10 manufacturing sites over the long term. Zoetis said it expected to take a charge of $400 million to $500 million related to the restructuring, which would also include trimming ""management layers.""  The company also reported a 6 percent rise in first-quarter net income to $165 million. Revenue was flat at $1.10 billion, compared with the year-earlier quarter.   (Reporting by Vidya L Nathan in Bengaluru; Editing by Saumyadeb Chakrabarty)",2015-05-05,ZTS,"Tue May 5, 2015 | 7:37am EDT","CORRECTED-Zoetis to reduce operations in Venezuela, considers selling plants",http://www.reuters.com//article/zoetis-restructuring-idUSL4N0XW33O20150505?type=companyNews
32,"  Canada-based drugmaker Valeant Pharmaceuticals International Inc (VRX.TO) (VRX.N) has approached to buy Zoetis Inc (ZTS.N), an animal-health company, the Wall Street Journal reported.Shares of Zoetis, whose pipeline includes medicines and vaccines for pets and livestock, were up 2 percent at $56.65 in extended trading. The company, spun off from Pfizer Inc (PFE.N) in 2013, was valued at $24.85 billion as of Thursday's close, according to Thomson Reuters data.Both Valeant and Zoetis spokesperson declined to comment. It was not clear what Zoetis's reaction to the preliminary approach was, if any, or whether it was open to a sale, the Journal reported, citing people familiar with the matter. (on.wsj.com/1fGK2qC)Zoetis, the world's largest animal-health company, has been cutting costs and said last month it planned to cut up to a quarter of its workforce and exit nearly 40 percent of its manufacturing plants. The decision came a month after Bill Ackman's Pershing Square, Zoetis's biggest shareholder, and Sachem Head Group seated their second nominee on the company's 11-member board in exchange for not soliciting takeover offers.Valeant, which lost a bid to buy Botox maker Allergan Inc (AGN.N) in November, is often criticized for a growth plan that is driven by acquisitions and cost-cutting. Shares of Laval, Quebec-based Valeant closed at C$287.79 on the Toronto Stock Exchange, after rising 73 percent this year; while Zoetis shares closed at $55.38 on the NYSE on Thursday. (Reporting by Rosmi Shaji in Bengaluru; Editing by Joyjeet Das)",2015-06-25,ZTS,"Thu Jun 25, 2015 | 5:27pm EDT",Canada's Valeant approaches to buy Zoetis: WSJ,http://www.reuters.com//article/us-zoetis-m-a-valeant-pharms-idUSKBN0P52O620150625?type=companyNews
33,"  (Adds details, shares)June 25 Canada-based drugmaker Valeant Pharmaceuticals International Inc  has approached to buy Zoetis Inc, an animal-health company, the Wall Street Journal reported.Shares of Zoetis, whose pipeline includes medicines and vaccines for pets and livestock, were up 2 percent at $56.65 in extended trading.The company, spun off from Pfizer Inc in 2013, was valued at $24.85 billion as of Thursday's close, according to Thomson Reuters data. Both Valeant and Zoetis spokesperson declined to comment.It was not clear what Zoetis's reaction to the preliminary approach was, if any, or whether it was open to a sale, the Journal reported, citing people familiar with the matter. (on.wsj.com/1fGK2qC) Zoetis, the world's largest animal-health company, has been cutting costs and said last month it planned to cut up to a quarter of its workforce and exit nearly 40 percent of its manufacturing plants. The decision came a month after Bill Ackman's Pershing Square, Zoetis's biggest shareholder, and Sachem Head Group seated their second nominee on the company's 11-member board in exchange for not soliciting takeover offers.Valeant, which lost a bid to buy Botox maker Allergan Inc  in November, is often criticized for a growth plan that is driven by acquisitions and cost-cutting.Shares of Laval, Quebec-based Valeant closed at C$287.79 on the Toronto Stock Exchange, after rising 73 percent this year; while Zoetis shares closed at $55.38 on the NYSE on Thursday.   (Reporting by Rosmi Shaji in Bengaluru; Editing by Joyjeet Das)",2015-06-25,ZTS,"Thu Jun 25, 2015 | 5:21pm EDT",UPDATE 1-Canada's Valeant approaches to buy Zoetis - WSJ,http://www.reuters.com//article/zoetis-ma-valeant-pharms-idUSL3N0ZB5LM20150625?type=companyNews
34,"  June 25 Canada-based drugmaker Valeant Pharmaceuticals International Inc  has approached to buy Zoetis Inc, an animal-health company, the Wall Street Journal reported.Zoetis, spun off from Pfizer Inc in 2013, was valued at $24.85 billion as of Thursday's close, according to Thomson Reuters data. It was not clear what Zoetis's reaction to the approach was, if any, or whether it was open to a sale, the Journal reported, citing people familiar with the matter. (on.wsj.com/1fGK2qC)  Valeant spokeswoman Laurie Little declined to comment. Zoetis was not immediately available for comment.   (Reporting by Rosmi Shaji in Bengaluru; Editing by Joyjeet Das)",2015-06-25,ZTS,"Thu Jun 25, 2015 | 4:30pm EDT",Valeant offers to buy Zoetis - WSJ,http://www.reuters.com//article/zoetis-ma-valeant-pharms-idUSL3N0ZB5HC20150625?type=companyNews
35,"   By Barbara Grzincic  A federal judge in Pennsylvania on Wednesday threw out negligence and fraud claims in a products liability lawsuit filed by two Mexican poultry companies against Pfizer Inc and its former animal-health subsidiary Zoetis but declined to dismiss the action in its entirety. In a lawsuit filed in January, Incubadora Mexicana and Incubadoras Ranche Grande alleged that Pfizer and Zoetis sold them a bad batch of the poultry vaccine Poulvac in 2013. They claimed the companies discovered problems with the batch in January 2014 but failed to notify them until July 2014, when Zoetis issued a recall.  To read the full story on WestlawNext Practitioner Insights, click here: bit.ly/1NHBdeO",2015-09-18,ZTS,"Fri Sep 18, 2015 | 6:58am EDT","Judge trims poultry-vaccine suit against Zoetis, Pfizer",http://www.reuters.com//article/health-poulvac-idUSL1N11O0EI20150918?type=companyNews
36,"  Animal health company Zoetis Inc (ZTS.N) said it agreed to buy Pharmaq, a pharmaceutical company catering to the aquaculture industry, for $765 million.Pharmaq, with revenue of about $80 million in 2014, is considered a market leader in sales of vaccines for farmed fish. Zoetis is purchasing Pharmaq from a company owned by the global investment firm Permira and expects to close the deal this month. Zoetis said it expected the transaction to be neutral in 2016 and add to adjusted earnings thereafter. The company's shares closed at $44.24 on the New York Stock Exchange on Monday.  (Reporting by Natalie Grover in Bengaluru; Editing by Anil D'Silva)",2015-11-02,ZTS,"Mon Nov 2, 2015 | 6:17pm EST",Zoetis to buy aquaculture pharma company for $765 million,http://www.reuters.com//article/us-pharmaq-m-a-zoetis-idUSKCN0SR2FO20151102?type=companyNews
37,"  (Adds details)Nov 2 Animal health company Zoetis Inc  said it agreed to buy Pharmaq, a pharmaceutical company catering to the aquaculture industry, for $765 million.Pharmaq, with revenue of about $80 million in 2014, is considered a market leader in sales of vaccines for farmed fish. Zoetis is purchasing Pharmaq from a company owned by the global investment firm Permira and expects to close the deal this month. Zoetis said it expected the transaction to be neutral in 2016 and add to adjusted earnings thereafter. The company's shares closed at $44.24 on the New York Stock Exchange on Monday.   (Reporting by Natalie Grover in Bengaluru; Editing by Anil D'Silva)",2015-11-02,ZTS,"Mon Nov 2, 2015 | 5:42pm EST",UPDATE 1-Zoetis to buy aquaculture pharma company for $765 mln,http://www.reuters.com//article/pharmaq-ma-zoetis-idUSL3N12X66020151102?type=companyNews
38,"  Nov 2 Animal health company Zoetis Inc  said it agreed to buy Pharmaq, a pharmaceutical company catering to the aquaculture industry, for $765 million.Zoetis is purchasing Pharmaq from a company owned by the global investment firm Permira.  Pharmaq generated revenue of about $80 million in 2014.   (Reporting by Natalie Grover in Bengaluru; Editing by Anil D'Silva) ",2015-11-02,ZTS,"Mon Nov 2, 2015 | 5:27pm EST",Zoetis to buy aquaculture pharma company for $765 mln,http://www.reuters.com//article/pharmaq-ma-zoetis-idUSL3N12X63720151102?type=companyNews
39,"   By Danny Na and Tom Polansek  Dec 14 Animal-nutritionist John Goihl knows Minnesota farmers who feed the remains of dead baby pigs to hogs used for breeding in attempts to ward off infections of a deadly virus in offspring.In Oklahoma, farm workers are mixing manure from swine sick with the disease, known as Porcine Epidemic Diarrhea virus (PEDv), into the food of healthy animals to build their immunity.In Kansas, farmers are spraying a mixture of hog manure containing the virus and water on the noses of pigs to create a ""natural vaccine.""Across the Farm Belt, U.S. pork producers are doing whatever they can to shore up their herds' defences against the virus that killed up to 8 million pigs, a tenth of the nation's herd, two years ago, and that farmers fear could return this winter.The virus, which causes severe diarrhea that kills baby pigs, thrives in cold weather, and declining immunity in the U.S. herd has raised the risk of another outbreak to the highest level since 2013, when pork prices soared to record highs, veterinarians said. A resurgence could drive up prices again and hurt profits for processors including Tyson Foods and JBS USA, which have benefited from low hog prices.Farmers are better prepared to fight the disease than they were two years ago after implementing procedures to prevent the spread of the virus via farm vehicles, workers' shoes and animal feed. Veterinarians said that attempts to deliberately expose hogs to the virus also help reduce the risk of an outbreak as big as the one that began in 2013, although it is not clear how many farmers are taking such precautions.Michael Blackwell, chief veterinarian officer for the Humane Society of the United States, said feeding baby pigs to other hogs ""seems to be pretty barbaric,"" but that he understands why farmers are doing it. ""It is not as inhumane as having millions of piglets killed in an outbreak,"" he said. VACCINES AND ""FEEDBACK"" Veterinarians said commercial vaccines available from Zoetis Inc and Merck & Co-owned Harrisvaccines offer limited help preventing outbreaks. They do not specifically target the gut and are mainly effective on hogs that have already been exposed to the virus. Harrisvaccines said that vaccines are not a ""silver bullet,"" and Zoetis said there was not enough data that prove that vaccines effectively protect herds that have not previously been infected.Such limitations, along with concerns that immunity levels have waned, make farmers turn to methods such as ""feedback,"" where intestines of piglets killed by the virus are fed to female pigs used for breeding. Immunity has declined because a growing number of hogs have never been infected, meaning they lack natural immunity they could pass on to their babies, veterinarians say. Also, immunity wears off over time in hogs that were previously infected.Feedback allows female hogs to become infected and pass on immunity to piglets, which are more likely to die from the disease than older hogs. Those fed infected food or otherwise exposed to the virus usually become sick for a few days, but then get well again.Purposefully exposing hogs to the virus is ""really important because that's one way we can have local establishment and local building of immunity,"" said Lisa Becton, director of swine health information and research for the National Pork Board, an industry group. Matt Ackerman, a prominent hog veterinarian based in Indiana, estimates that more than a million pigs could die between June 1, 2015 and May 31, 2016, from a return of the virus, far below the 2013 levels. Such losses would occur if 10 percent of sow farms become infected, which Ackerman said was a ""very real expectation"" that would be devastating to producers.From July 1 to Dec. 4, 2 percent of herds cumulatively reported new infections, according to an analysis from Bob Morrison, a professor at the University of Minnesota. That is down from 56 percent between July 2013 and June 2014 and 9 percent a year later.For farmers seeking to deliberately expose their herds to the virus, one step is to identify infected hogs, so they can serve as ""vaccine"" donors. At Prestage Farms in Oklahoma, which sells hogs to Seaboard Corp, workers place pieces of rope into pig pens for hogs to bite. The rope is then tested for the virus, says Ron Prestage, who runs a division of the family-owned company.If the disease is detected, workers scoop up manure from the pens to mix with feed for female breeding hogs, so they can pass on antibodies to piglets through their milk, said Prestage, who is also president of the National Pork Producers Council.""They get a little bit of a belly ache and have diarrhea and then get over it,"" he said.(Reporting by Danny Na and Tom Polansek in Chicago; Editing by Tomasz Janowski)",2015-12-14,ZTS,"Mon Dec 14, 2015 | 4:00am EST","US hogs fed pig remains, manure to fend off deadly virus return",http://www.reuters.com//article/usa-hogs-virus-idUSL1N13Q38620151214?type=companyNews
40,"  May 4 Zoetis Inc* Zoetis reports first quarter 2016 results* Q1 adjusted earnings per share $0.48* Q1 earnings per share $0.41* Q1 revenue $1.2 billion versus I/B/E/S view $1.1 billion* Sees 2017 reported diluted eps for full year of between $2.01 to $2.19 per share * Sees fy 2016 adjusted earnings per share $1.83 to $1.90* Sees fy 2017 adjusted earnings per share $2.24 to $2.38* Sees fy 2017 revenue $5.075 billion to $5.275 billion * Sees fy 2016 revenue $4.775 billion to $4.875 billion* Q1 earnings per share view $0.41 -- Thomson Reuters I/B/E/S * Fy2016 earnings per share view $1.79, revenue view $4.75 billion -- Thomson Reuters I/B/E/S* Q1 earnings per share view $0.41, revenue view $1.10 billion -- Thomson Reuters I/B/E/S* Zoetis inc sees 2016  reported diluted EPS for full year of between $1.41 to $1.56 per share* Sees 2017 revenue of between $5.075 billion to $5.275 billion* Fy2017 earnings per share view $2.26, revenue view $5.06 billion -- Thomson Reuters I/B/E/S  Source text for Eikon:  Further company coverage:    (Bengaluru Newsroom: +1 646 223 8780)",2016-05-04,ZTS,"Wed May 4, 2016 | 7:28am EDT",BRIEF-Zoetis Q1 earnings per share $0.41,http://www.reuters.com//article/idUSASC08MLS?type=companyNews
41,"  Billionaire investor William Ackman's Pershing Square Capital Management on Monday set out to sell $800 million in shares of Zoetis Inc (ZTS.N), the New York Times reported, citing people familiar with the matter.Ackman set out to sell 16.85 million shares in Zoetis for a price range of $46.75 to $47 per share, the newspaper reported. (nyti.ms/1Wlwzrw)The newspaper said the transaction would be managed by Bank of America Merrill Lynch and Credit Suisse. It said Pershing would still own 25 million shares in the company after the sale. Ackman told his clients last week that Pershing Square Holdings portfolio gained 10.2 percent last month as battered drug company Valeant Pharmaceuticals (VRX.TO) climbed.   (Reporting by Parikshit Mishra in Bengaluru; Editing by David Gregorio)",2016-05-09,ZTS,"Mon May 9, 2016 | 6:57pm EDT",Ackman's Pershing Square seeks to sell Zoetis shares for $800 million: NYT,http://www.reuters.com//article/us-zoetis-pershing-square-stake-idUSKCN0Y02L3?type=companyNews
42,"  Billionaire investor William Ackman's Pershing Square Capital Management on Monday set out to sell $800 million in shares of Zoetis Inc (ZTS.N), the New York Times reported, citing people familiar with the matter.Ackman set out to sell 16.85 million shares in Zoetis for a price range of $46.75 to $47 per share, the newspaper reported. (nyti.ms/1Wlwzrw)The newspaper said the transaction would be managed by Bank of America Merrill Lynch and Credit Suisse. It said Pershing would still own 25 million shares in the company after the sale. Ackman told his clients last week that Pershing Square Holdings portfolio gained 10.2 percent last month as battered drug company Valeant Pharmaceuticals (VRX.TO) climbed.   (Reporting by Parikshit Mishra in Bengaluru; Editing by David Gregorio)",2016-05-09,ZTS,"Mon May 9, 2016 | 6:57pm EDT",Ackman's Pershing Square seeks to sell Zoetis shares for $800 mln -NYT,http://www.reuters.com//article/zoetis-pershing-square-stake-idUSL2N18621Q?type=companyNews
43,"  May 9 (Reuters) -* Bill Ackman's Pershing Square set out to sell 16.85 mln shares in Zoetis for a price range of $46.75 to $47 per share- NYT, citing sources Source (nyti.ms/1Wlwzrw)  Further company coverage:    (Bengaluru Newsroom)",2016-05-09,ZTS,"Mon May 9, 2016 | 6:23pm EDT",BRIEF-Bill Ackman sets out to sell $800 Million in shares of Zoetis- NYT,http://www.reuters.com//article/idUSFWN18611H?type=companyNews
44,"  Billionaire investor William Ackman's Pershing Square now holds a 5 percent stake in Zoetis Inc after the hedge fund sold about $800 million worth of shares in the animal health company, according to a regulatory filing.Ackman sold 16.85 million Zoetis shares at an average price of $46.55 each, the filing showed on Tuesday.The fund had reported an 8.6 percent stake in the company in a filing on April 22. Zoetis, which was spun off from Pfizer Inc in 2013, reported better-than-expected quarterly revenue and profit last week. Pershing Square was a top industry performer in 2014, when it delivered a 40 percent return. But more recently it has been close to the bottom, losing 20 percent last year.    (Reporting by Natalie Grover in Bengaluru; Editing by Saumyadeb Chakrabarty)",2016-05-10,ZTS,"Wed May 11, 2016 | 6:38am EDT",Ackman's Pershing Square cuts stake in Zoetis,http://www.reuters.com//article/zoetis-pershing-square-idUSL3N1875O4?type=companyNews
45,"  Billionaire investor William Ackman's Pershing Square now holds a 5 percent stake in Zoetis Inc after the hedge fund sold about $800 million worth of shares in the animal health company, according to a regulatory filing.Ackman sold 16.85 million Zoetis shares at an average price of $46.55 each, the filing showed on Tuesday.The fund had reported an 8.6 percent stake in the company in a filing on April 22. Zoetis, which was spun off from Pfizer Inc in 2013, reported better-than-expected quarterly revenue and profit last week. Pershing Square was a top industry performer in 2014, when it delivered a 40 percent return. But more recently it has been close to the bottom, losing 20 percent last year.    (Reporting by Natalie Grover in Bengaluru; Editing by Saumyadeb Chakrabarty)",2016-05-11,ZTS,"Wed May 11, 2016 | 6:38am EDT",Ackman's Pershing Square cuts stake in Zoetis,http://www.reuters.com//article/us-zoetis-pershing-square-idUSKCN0Y12SB?type=companyNews
46,"  LAS VEGAS May 12 Scott Ferguson said that his hedge fund firm Sachem Head Capital Management had exited its position in the stock of animal healthcare company Zoetis Inc  earlier this year, in an appearance at the SkyBridge Alternatives Conference in Las Vegas on Thursday. (Reporting by Lawrence Delevingne; Editing by Chris Reese)  ",2016-05-12,ZTS,"Thu May 12, 2016 | 2:02pm EDT",Scott Ferguson says his hedge fund Sachem Head exited position in Zoetis,http://www.reuters.com//article/hedgefunds-sachemhead-zoetis-idUSL2N1891RX?type=companyNews
47,"   By Lawrence Delevingne and Svea Herbst-Bayliss | LAS VEGAS  LAS VEGAS Hedge fund managers on Thursday named some of their recent investments, including a bet that shares of American Airlines Group (AAL.O) would fall and shares of both Chinese Internet company Tencent (0700.HK) and chipmaker Xilinx (XLNX.O) would rise, in addresses at one of the industry's most prominent conferences.John Lykouretzos, who runs $2.8 billion Hoplite Capital Management Lp, disclosed his negative case against American Airlines, which helped push the stock down as much as 4.7 percent on Thursday. Calling the company the ""most compelling short in the U.S. airline industry,"" Lykouretzos said American's costs are too high, that it is the most exposed airline to rising oil prices, and it has the highest leverage compared to its peers.An American airlines spokesman, Josh Freed, responding to Lykouretzos, referred Reuters to recent comments from Chief Executive Doug Parker on a company earnings call.Parker on that call said American was “purchasing our shares because we are bullish on the stock,"" and said “the industry is well undervalued,"" adding, ""We think American Airlines has more upside than anyone else in the industry.”Lykouretzos was one of a handful of prominent managers speaking at the annual SkyBridge Alternatives Conference in Las Vegas, four months into a difficult year where the average hedge fund has lost money and some big-name investors are rethinking their commitment to them.The managers did not provide details on when they invested in particular companies or at what price. Fears about a possible recession in the United States and slower growth in China have contributed to unpredictable markets that have left many managers nursing losses.But there are still good opportunities, the managers told the conference where about 2,000 investors, managers and others crowded in to hear who is picking what.John Burbank, who runs $4.1 billion Passport Capital and has often invested abroad, said he is betting on Tencent, calling it the ""dominant Internet play"" with six of the most popular smart-phone apps.Clifton Robbins of $3.5 billion Blue Harbour Group said he likes Xilinx and was buying more as recently as Thursday. He noted that the company has some $2 billion in cash and said the stock is undervalued, which would make a case for the company buying back some of its own stock. Activist investors like Blue Harbour have called on many chief executives to buy back their own stock. Robbins also said Xilinx is the last independent chip company after Intel Corp (INTC.O) and Altera merged. Xilinx's unique standing could prompt takeover bids, he said. Jim Chanos, who runs Kynikos Associates and built his reputation on a successful bet against Enron, spoke again about his short play on Cheniere Energy Inc (LNG.A), saying the stock is still ""crazy expensive.""Burbank said he's betting against large Chinese companies via the iShares China Large-Cap ETF to hedge out some of what he called ""old China risk.""Meanwhile, Scott Ferguson, who runs $4 billion Sachem Head Capital Management, said his activist firm exited its bet on animal healthcare company Zoetis Inc (ZTS.N) in the first quarter. Sachem brought the idea on Zoetis to the attention of Pershing Square's William Ackman and both made an investment in 2014. Ferguson said his fund had made money on the bet and Zoetis was very responsive to the activists' suggestions, but it was time to move on and find other opportunities.Pershing Square recently reduced its holding in Zoetis.Teresa Barger, chief executive officer of Cartica Management, repeated that her firm is invested in Taiwanese company Voltronic Power (6409.TW).Jeff Smith of Starboard Value spoke again about his firm's most prominent investment, Yahoo Inc (YHOO.O). Starboard recently reached an agreement with Yahoo under which Starboard will get board seats. Smith said his job as a new board member is to improve the strength of Yahoo's core business. (Reporting by Lawrence Delevingne and Svea Herbst; Editing by Chris Reese, Tom Brown and Leslie Adler)",2016-05-12,ZTS,"Thu May 12, 2016 | 6:03pm EDT",UPDATE 2-Hedge fund managers give stock picks in Vegas at SALT conference,http://www.reuters.com//article/hedgefunds-sachemhead-zoetis-idUSL2N1891TE?type=companyNews
48,  July 8 Zoetis Inc * William Ackman reports 3.8 percent stake in Zoetis Inc as of July 7 versus 5.0 stake as of May 9 - SEC filing  Source text for Eikon:  Further company coverage:    (Bengaluru Newsroom: +1-646-223-8780)  ,2016-07-08,ZTS,"Fri Jul 8, 2016 | 5:43pm EDT",BRIEF-William Ackman reports 3.8 pct stake in Zoetis Inc,http://www.reuters.com//article/idUSFWN19U0J8?type=companyNews
49,"  Aug 3 Zoetis Inc* Q2 adjusted earnings per share $0.49* Sees fy 2016 adjusted earnings per share $1.86 to $1.93* Q2 earnings per share $0.45 * Q2 earnings per share view $0.44 -- Thomson Reuters I/B/E/S* Zoetis reports second quarter 2016 results * Q2 revenue $1.2 billion versus I/B/E/S view $1.17 billion* Sees fy 2016 earnings per share $1.52 to $1.63 * Sees fy 2016 revenue $4.8 billion to $4.9 billion* Sees  reported diluted eps for full year 2016 between $1.52 to $1.63 per share* FY2016 earnings per share view $1.87, revenue view $4.85 billion -- Thomson Reuters I/B/E/S  Source text for Eikon:  Further company coverage:    (Bengaluru Newsroom: +1-646-223-8780)",2016-08-03,ZTS,"Wed Aug 3, 2016 | 7:18am EDT",BRIEF-Zoetis reports Q2 earnings per share $0.45,http://www.reuters.com//article/idUSASC0907M?type=companyNews
50,  Aug 8 Zoetis Inc* Deal for $80 million * Zoetis acquires scandinavian micro biodevices to extend its pipeline in diagnostics for veterinary use  * Deal for $80 million  Source text for Eikon:  Further company coverage:,2016-08-08,ZTS,"Mon Aug 8, 2016 | 8:17am EDT",BRIEF-Zoetis acquires Scandinavian Micro Biodevices to extend pipeline in veterinary diagnostics,http://www.reuters.com//article/idUSFWN1AP0MF?type=companyNews
